the financial times 30-share index closed 79.3 points lower at 1738.7	the financial times 30-share index closed 79.3 points lower
terms of the transaction were n't disclosed	terms were n't disclosed
buyers stepped in to the futures pit	buyers stepped in
the transaction is expected to close by nov. 30	the transaction is expected to close
the offering series 1989-86 is backed by fannie mae 9 % securities	the offering series 1989-86 is backed
currently average pay for machinists is 13.39 an hour boeing said	currently average pay is 13.39 an hour boeing said
sun also reported a record backlog of orders	sun also reported a record backlog
this being typed in a standing position	this being typed
after years of fading into the background two-tone photography is coming back	two-tone photography is coming back
heiwa real estate gained 40 to 2210	heiwa real estate gained 40
consumer stocks once again set the pace for blue-chip issues	consumer stocks once again set the pace
interest rates barely budged from tuesday 's levels	interest rates barely budged
hilton lost 20 % on friday paramount lost almost 11 %	hilton lost 20 % paramount lost almost 11 %
prices of treasury bonds tumbled in moderate to active trading	prices tumbled
by contrast surgical abortion is 99 % effective	surgical abortion is 99 % effective
some 70 % of them are to be exported to the u.s.	some 70 % are to be exported
this action was defended by the canadian government on conservation grounds	this action was defended
mr. mehl attributed the rise specifically to the treasury bill increase	mr. mehl attributed the rise
of course many more issues 93 hit new lows	many more issues 93 hit new lows
it was crazy said neil weisman general partner of chilmark capital corp	it was crazy said neil weisman general partner
productivity in japanese offices is relatively low	productivity is relatively low
waxman sells a variety of hardware products for the home repair market	waxman sells a variety
you 're making a pure bet on the market	you 're making a pure bet
most estimates for monsanto run between 1.70 and 2 a share	most estimates run
but there 's another side to mr. krenz	but there 's another side
volume on the new york stock exchange totaled 155.7 million shares	volume totaled 155.7 million shares
but there is a grimly ironic twist to the columbia loss	but there is a grimly ironic twist
gerald f. seib contributed to this article	gerald f. seib contributed
in september kellogg co. launched a competing psyllium-fortified cereal called heartwise	kellogg co. launched a competing psyllium-fortified cereal called heartwise
farm income is 15 % below the average	farm income is
the two big banks were instrumental in designing the new contract	the two big banks were instrumental
they are piggybacking onto developed technology he said	they are piggybacking he said
but middle east supplies were growing in importance	but middle east supplies were growing
he was back in jail over the summer on shoplifting charges	he was back
on china 's turmoil it is a very unhappy scene he said	it is a very unhappy scene he said
now television and radio evangelists are under scrutiny	now television and radio evangelists are
revenue rose to 235.2 million from 176.4 million	revenue rose
here 's a look at some of the alternatives	here 's a look
the drug was introduced in west germany this year	the drug was introduced this year
bush and gorbachev will hold two days of informal talks next month	bush and gorbachev will hold two days next month
they are all priced at par	they are all priced
the company reported a big third-quarter loss on thursday	the company reported a big third-quarter loss
and the sets are wider resembling the dimensions of a movie screen	and the sets are wider resembling the dimensions
it earned 76.4 million or 1.82 a share in the 1988 quarter	it earned 76.4 million or 1.82 a share
borrowed shares on the amex rose to another record	borrowed shares rose
added mr. jacobson there were some pretty bad losses in the stock	added mr. jacobson there were some pretty bad losses
once and for all 5-a-barrel crude oil and 35-cents-a-gallon gasoline were history	once and 5-a-barrel crude oil and 35-cents-a-gallon gasoline were history
reinsurance is protection taken out by the insurance firms themselves	reinsurance is protection taken out
rather they tend to have a set of two or three favorites	rather they tend to have a set
shares of biotechnology companies in the area were also higher	shares were also higher
it had a 258.9 million loss in the second quarter	it had a 258.9 million loss
changing the outcome of the trial is what really matters	changing the outcome is what really matters
big business mr. pawlowski snorts in english	big business mr. pawlowski snorts
federal judge expands role of u.s. courts in extradition decisions	federal judge expands role
its interest expense surged to 21.5 million from 12.4 million	its interest expense surged
revenue rose 15 % to 2.17 billion from 1.89 billion	revenue rose 15 %
the senators responded in kind	the senators responded
by lunchtime the selling was at near-panic fever	the selling was
the acquisition was completed in september	the acquisition was completed
he said he would convene hearings within two weeks	he said he would convene hearings
some current rates exceed those on cds	some current rates exceed those
short-term interest rates rose at the government 's regular weekly treasury-bill auction	short-term interest rates rose
in 1987 prosecutors filed against 35 defendants for every 100,000 adults	prosecutors filed
the price movements get bigger as the maturity of the securities lengthens	the price movements get bigger as the maturity lengthens
the loss was largely due to a 55.2 million addition to reserves	the loss was largely due
a spokeswoman for paramount said the company does n't comment on speculation	a spokeswoman said the company does n't comment
the agency plans to announce specific relief procedures in the coming days	the agency plans to announce specific relief procedures
but violation could bring substantial tax penalties to both employer and employees	but violation could bring substantial tax penalties
americans stay longer with japanese firms than american companies	americans stay longer
the country 's narcotics traffickers claimed responsibility for the slaying	the country 's narcotics traffickers claimed responsibility
the financial times 30-share index settled 27.8 points higher at 1758.5	the financial times 30-share index settled 27.8 points higher
i was never a rebel he said in an earlier interview	i was never a rebel he said
the increase was spread fairly evenly among all three types of funds	the increase was spread fairly evenly
on isaac stern 's recording it 's very biting	it 's very biting
they gleefully await the dream season in 1990	they gleefully await the dream season
the state will vigorously defend against any counterclaim	the state will vigorously defend
two other men also were charged with participating in the operation	two other men also were charged
but general motors dropped 1 7\/8 to 44 7\/8	but general motors dropped 1 7\/8
that target has been revised to 30 % by the year 2000	that target has been revised
some members of the huge crowd shouted viva peace viva	some members shouted viva peace viva
earnings per share were 10.35 kronor compared with 5.80 kronor	earnings were 10.35 kronor
for several months there was optimism all around	there was optimism all around
in the experiment mice with the defective gene were mated	mice were mated
it takes three months to turn copper concentrate into cathodes he said	it takes three months to turn copper concentrate he said
october is a critical month for the privatization program	october is a critical month
james a. white and sonja steptoe contributed to this article	james a. white and sonja steptoe contributed
creation of a new realistic u.s. policy is long overdue	creation is long overdue
he says he has never even dined with gangsters	he says he has never even dined
tenneco credit is a unit of tenneco inc	tenneco credit is a unit
in congress lawmakers already are looking for ways to add relief funds	lawmakers already are looking
kidder officials stand by their aggressive use of program trading	kidder officials stand
the condition known as paroxysmal supraventricular tachycardia leads to dizziness and fainting	the condition known leads
mr. nolan is a contributing editor at los angeles magazine	mr. nolan is a contributing editor
it would have been too late to think about on friday	it would have been too late to think
statistics canada said service-industry output in august rose 0.4 % from july	statistics canada said service-industry output rose 0.4 %
a saatchi spokesman declined to comment about interpublic	a saatchi spokesman declined to comment
nine-month revenue was 1.02 billion up 22 % from 841.5 million	nine-month revenue was 1.02 billion up 22 %
why in these movies is the unwed pregnant woman always from ohio	why is the unwed pregnant woman always
portrait studios have also latched onto the trend	portrait studios have also latched
municipal bonds were little changed to 1\/2 point higher in late dealings	municipal bonds were little changed
he wants to see steelmakers more involved in computers and artificial intelligence	he wants to see steelmakers more involved
overall salomon reported program trading volume of 75.2 million shares	overall salomon reported program trading volume
meanwhile new-home sales plunged 14 % in the month	meanwhile new-home sales plunged 14 %
they attached a second gene for herbicide resistance to the pollen-inhibiting gene	they attached a second gene
the clean water act contains no legal standard of zero discharge	the clean water act contains no legal standard
foreign bonds surged as the dollar weakened against most major currencies	foreign bonds surged as the dollar weakened
he also repeated justin 's denial of sony 's charges	he also repeated justin 's denial
transcanada declined to comment on the foothills application	transcanada declined to comment
only 22 % supported private security patrols funded by the merchants themselves	only 22 % supported private security patrols funded
rmi titanium is owned jointly by usx and quantum chemical corp	rmi titanium is owned jointly
this is a story about suckers	this is a story
as previously reported helionetics emerged from chapter 11 bankruptcy-law protection in february	as previously reported helionetics emerged
he could grasp an issue with the blink of an eye	he could grasp an issue
a healthy embryo can be picked for implantation and defective ones discarded	a healthy embryo can be picked and defective ones discarded
that 's just what happened in the october 1987 crash	that 's just what happened
but the brand had trouble from the start	but the brand had trouble
retailers could get a boost this year from the calendar	retailers could get a boost this year
the 142 institutional-type money funds rose 2.23 billion to 85.49 billion	the 142 institutional-type money funds rose 2.23 billion
the solution is stronger domestic growth in germany he said	the solution is stronger domestic growth he said
the company develops and markets products for the food service industry	the company develops and markets products
we still think there 's a lot of unsettlement in this market	we still think there 's a lot
the spinoff should solve a problem for the parent	the spinoff should solve a problem
the figures are at seasonally adjusted annual rates in trillions of dollars	the figures are
friday brings the final count on october auto sales	friday brings the final count
many of the affluent are n't comfortable with themselves either	many are n't comfortable either
ntt lost 30,000 yen to 1,380,000 yen 9,756	ntt lost 30,000 yen
not everything looks grim for quantum	not everything looks grim
taxes are not going out of business	taxes are not going out
and there were senate hearings on the questions in july 1972	and there were senate hearings
everyone in the world is watching us very closely	everyone is watching us very closely
the i-880 section had completed the first phase of the retrofitting	the i-880 section had completed the first phase
it is a distinction that satisfies neither side in the debate	it is a distinction that satisfies neither side
in montreal exchange trading memotec closed unchanged at 10.625 canadian dollars 9.05	memotec closed unchanged
the 30-share index fell 33.3 points to 1739.3	the 30-share index fell 33.3 points
ibm is based in armonk n.y	ibm is based
some state middlemen come to buy from me	some state middlemen come to buy
for them it makes all kinds of sense	it makes all kinds
senator pete domenici calls this effort the first gift of democracy	senator pete domenici calls this effort the first gift
he adds i think this is a great strategic move for quebecor	he adds i think this is a great strategic move
and most of these are absolutely unnecessary	and most are absolutely unnecessary
i assumed i was buying a cd as a cd he says	i assumed i was buying a cd he says
second section volume was estimated at 14 million shares unchanged from monday	second section volume was estimated unchanged
i am ready at any moment to compete with a state farm	i am ready to compete
that loss compared with a year-earlier profit of 273.5 million	that loss compared
some of the oil interests already have been sold	some already have been sold
mr. kakita said the key dollar-yen exchange rate is at 135 yen	mr. kakita said the key dollar-yen exchange rate is
eagle 's plastic type sharpens and looks like a wooden pencil	eagle 's plastic type sharpens and looks
even so few had ever dealt with an earthquake	even so few had ever dealt
aftershocks rattled northern california amid an earthquake cleanup	aftershocks rattled northern california
the work force provides the third arm of the alliance	the work force provides the third arm
more important the cd was purchased on the secondary or resale market	more important the cd was purchased
the sales recovery screeched to a halt this month some analysts say	the sales recovery screeched this month some analysts say
but new york city general obligation bonds came under selling pressure	but new york city general obligation bonds came
it 's a nuisance tax on mergers	it 's a nuisance tax
the only time the violin has it is right at the end	the only time the violin has it is
the owner was israel ortiz a 29-year-old entrepreneur and father of two	the owner was israel ortiz a 29-year-old entrepreneur and father
but they attribute much of the weakness to customer inventory reductions	but they attribute much
today there are 77 units all located in shopping malls	today there are 77 units all located
lawyers for the garcias said they plan to appeal	lawyers said they plan to appeal
everybody was still confident including most institutional investors	everybody was still confident
they saw an opportunity created by the sell-off	they saw an opportunity created
the dividend is payable dec. 15 to stock of record nov. 15	the dividend is payable dec. 15
having donated heavily to museums they demand a place on their boards	having donated heavily they demand a place
at gmac net dropped 3.1 % to 234.5 million from 241.9 million	net dropped 3.1 %
some of the large amounts are being raised by small firms	some are being raised
it was downhill from there however	it was downhill however
announced and anticipated purchases from foreign countries are also supporting futures prices	announced and anticipated purchases are also supporting futures prices
if there 's somethin' strange in your neighborhood	if there 's somethin' strange
in the year-earlier quarter the tax credit was 3.3 million	the tax credit was 3.3 million
this could be the first major bankruptcy-law proceeding for kkr he adds	this could be the first major bankruptcy-law proceeding he adds
but with some clients the talk can heat up a bit	but the talk can heat up a bit
today mr. corry presides over a company whose fortunes have changed abruptly	today mr. corry presides
but such skills were alien to toni johnson	but such skills were alien
the board increased by one to 26 members	the board increased
pharmaceuticals were mostly higher with ss pharmaceutical gaining 140 to 1,980	pharmaceuticals were mostly higher
the financial times 100-share index finished 10.6 points higher at 2189.7	the financial times 100-share index finished 10.6 points higher
there are of course obvious dangers to blatant unsubstantiated name-dropping	there are obvious dangers
that indicates speculators are betting a higher offer is in the wings	that indicates speculators are betting a higher offer is
a surprisingly small amount of reserves was added to the banking system	a surprisingly small amount was added
revenues declined 1 % to 4.17 billion from 4.19 billion	revenues declined 1 %
the last six months has established the quality of the collection	the last six months has established the quality
no one else will watch out for you	no one else will watch out
in greater israel more than half the children under six are muslims	more than half the children are muslims
this has led them in a fruitless and destructive policy circle	this has led them
the flat report followed a four-month string of declines	the flat report followed a four-month string
newspapers including this one have generally ignored his news releases	newspapers have generally ignored his news releases
prices on the frankfurt stock exchange tumbled in heavy trading	prices tumbled
only 42 % of last year 's respondents anticipated slowing growth	only 42 % anticipated slowing growth
keepers of the books dubbed figure filberts loathed the threat	keepers dubbed figure filberts loathed the threat
loyalty lags most for utilitarian products like trash bags and batteries	loyalty lags most
mr. tinker later left to become chairman of national broadcasting co	mr. tinker later left to become chairman
at the core of mr. loggia 's mancuso is his world-weary truculence	is his world-weary truculence
murder threat charged in haas securities corp stock-manipulation trial	murder threat charged
does the candidate favor parental consent for teen-age abortions	does the candidate favor parental consent
bigger than a breadbox was this cash hoarder 's reputation for honesty	bigger was this cash hoarder 's reputation
the march contract advanced 0.14 cent a pound to 14.11 cents	the march contract advanced 0.14 cent a pound
the position of chief operating officer is new	the position is new
shearson does n't break out the earnings of its subsidiaries	shearson does n't break out the earnings
she bursts into tears and walks away	she bursts and walks away
so mr. moon is in retreat refocusing on the far east	so mr. moon is refocusing
average attendance at their games about 49,000 last year continues flat	average attendance about 49,000 last year continues flat
waterford has decided against paying an interim dividend	waterford has decided
revenue rose 12 % to 1.37 billion from 1.22 billion	revenue rose 12 %
in addition global petroleum demand has been climbing	global petroleum demand has been climbing
istat said 369,000 more people were employed in july than in april	istat said 369,000 more people were employed
meanwhile sotheby 's guarantee is raising eyebrows in the art world	meanwhile sotheby 's guarantee is raising eyebrows
and most vacationers still prefer a warm climate for their winter excursions	and most vacationers still prefer a warm climate
it would open a can of worms	it would open a can
once again the indomitable peasant holds poland 's future in his hands	once again the indomitable peasant holds poland 's future
mr. maynard says the ruling pushed his company into bankruptcy court	mr. maynard says the ruling pushed his company
but then it was acquired by household international inc	but then it was acquired
pacific telesis group lost 62.5 cents to 44.625	pacific telesis group lost 62.5 cents
that 's good news because we all swim in this water	that 's good news because we all swim
other rjr issues fell between 1\/2 point and 1 1\/2 point	other rjr issues fell
the election was by secret ballot in the general assembly	the election was
a star attraction on the national network is the u.s. 's dynasty	a star attraction is the u.s. 's dynasty
the main obstacle is finding a way to pay for them	the main obstacle is finding a way to pay
in my opinion this is not true	this is not true
but the money is n't peanuts either particularly for a news program	but the money is n't peanuts either
several projects he said are still on the drawing board	several projects he said are still
that share has remained at about 24 % since 1970	that share has remained
recruiter donald clark does note an increase in searches for minority candidates	recruiter donald clark does note an increase
the bank said the talks resulted from solicitations by its financial adviser	the bank said the talks resulted
each right entitles shareholders to buy one-half share of common for 30	each right entitles shareholders to buy one-half share
mr. strieber knows a lot about aliens	mr. strieber knows a lot
the bonds are insured and rated triple-a by moody 's and s&p	the bonds are insured and rated triple-a
the afrikaner must end his reliance on others	the afrikaner must end his reliance
i was in stinson beach when the quake rolled through town	i was when the quake rolled
santa cruz county estimates total damage at nearly 600 million	santa cruz county estimates total damage
the beginning was chaotic said nigel longley a broker for commerzbank ag	the beginning was chaotic said nigel longley a broker
valued at 1.3 million it was part of a four-crate shipment	valued it was part
last week traders said there were three institutional sellers for every buyer	last week traders said there were three institutional sellers
all these reports about him committing genocide are probably exaggerated anyway	all these reports are probably exaggerated anyway
mr. bates usually handles day-to-day ual trading on his own	mr. bates usually handles day-to-day ual trading
ibm shares closed at 103 down 50 cents in big board trading	ibm shares closed
in my freshman year my roommate was known as a party animal	my roommate was known
mr. bostian said in august that his macroeconomic index signaled recession	mr. bostian said that his macroeconomic index signaled recession
it can happen in any industry	it can happen
crime is clearly more deadly to small-scale entrepreneurship than to big businesses	crime is clearly more deadly
obviously we are looking at making economies across the board	obviously we are looking
the stocks of computer-related companies located outside california improved too	the stocks improved too
it does n't look nice on the outside while getting mealy inside	it does n't look nice while getting mealy inside
but i 'm going to proceed in a more logical way	but i 'm going to proceed
the name of the game is to move goods	the name is to move goods
bond market analysts say the institutional selling was triggered by several factors	bond market analysts say the institutional selling was triggered
all three funds posted negative returns for the year to date	all three funds posted negative returns
medstone international plummeted 3 1\/4 to 7 1\/4	medstone international plummeted 3 1\/4
brand loyalty was stronger among older consumers in the journal survey	brand loyalty was stronger
the slack absorbs the pulling strain generated by an earthquake	the slack absorbs the pulling strain generated
sales rose 7 % to 3.8 billion	sales rose 7 %
it pays to follow a management career path even at law firms	it pays to follow a management career path
nguyen thi thi is vietnam 's entrepreneur of the 1980s	nguyen thi thi is vietnam 's entrepreneur
he speaks only in filipino	he speaks only
analysts said the company 's troubles mirror those of the industry	analysts said the company 's troubles mirror those
judge mayer was not on the three-member panel	judge mayer was not
politburo member joachim herrman confessed to a grave concern over hungarian democracy	politburo member joachim herrman confessed
we do n't know how to get from socialism to capitalism	we do n't know how to get
creative accounting is a hallmark of federal credit	creative accounting is a hallmark
sea containers which unveiled a proposed restructuring advanced 1 to 62	sea containers which unveiled a proposed restructuring advanced 1
the service supplies weekly reports on school and college construction plans	the service supplies weekly reports
a p&g spokeswoman confirmed that shipments to phoenix started late last month	a p&g spokeswoman confirmed that shipments started late last month
under the agreement hofi will own 87.2 % of the combined company	hofi will own 87.2 %
now those routes are n't expected to begin until jan	now those routes are n't expected to begin
earnings of female workers were unchanged	earnings were unchanged
like many sports buffs mr. engelken has turned cynic	mr. engelken has turned cynic
lone star 's bond corp. parent for instance hails from perth australia	lone star 's bond corp. parent hails
we 'll raise it through bank loans	we 'll raise it
the percentage change is since year-end	the percentage change is
the company is exposed to bulk chemicals however	the company is exposed however
goldman sachs 's mr. einhorn for one subscribes to that scenario	goldman sachs 's mr. einhorn subscribes
revenue rose slightly to 3.8 billion from 3.7 billion	revenue rose slightly
prudential-bache said the york issue was delayed because of market conditions	prudential-bache said the york issue was delayed
mr. warren will remain on the company 's board	mr. warren will remain
the interest-only securities will be sold separately by bt securities	the interest-only securities will be sold separately
