the nasdaq composite index surged 4.26 or about 0.94 % to 455.63	the nasdaq composite index surged 4.26 or about 0.94 %
probably the most clear-cut soviet violation for example is the krasnoyarsk radar	probably the most clear-cut soviet violation is the krasnoyarsk radar
federal revenues rose 9 % to 990.79 billion	federal revenues rose 9 %
says mr. steidtmann i 'm looking for a bi-polar christmas	says mr. steidtmann i 'm looking
weisfield 's had about 1.1 million shares outstanding as of july 31	weisfield 's had about 1.1 million shares outstanding
other firms are dealing with the masses	other firms are dealing
they estimate the value of the transaction at close to 100 million	they estimate the value
there is no rational justification for such behavior	there is no rational justification
a 35-nation environmental conference opened in sofia bulgaria	a 35-nation environmental conference opened
revenues were 99.23 billion up from 97.74 billion a year earlier	revenues were 99.23 billion up
freddie mac 's 9 % issue ended at 97 19\/32 up 2\/32	freddie mac 's 9 % issue ended up 2\/32
hanson with 15 million shares traded closed 2.5 lower at 212.5	hanson closed 2.5 lower
at the time the merksamer chain had 11 stores in operation	the merksamer chain had 11 stores
some auto executives believe the benefits of more choice outweigh the drawbacks	some auto executives believe the benefits outweigh the drawbacks
for there is an emerging protocol indeed an etiquette to it	for there is an emerging protocol indeed an etiquette
mccormick is a developer and manager of futures-investment limited partnerships	mccormick is a developer and manager
the flight was rescheduled for today	the flight was rescheduled
backlog at general dynamics rose to 16.5 billion from 15.8 billion	backlog rose
the unions and the company last week agreed to mediation	the unions and the company last week agreed
he probably has n't done it for the cash	he probably has n't done it
the charter was approved by the ec commission on sept. 21	the charter was approved
sales rose 2.9 % to 827.9 million from 804.3 million	sales rose 2.9 %
one might well ask why bother with this drug at all	one might well ask why bother at all
by one estimate everyone here under 50 owns at least one bike	everyone here owns at least one bike
the company focuses on the how-to aspects says andrew e. philip president	the company focuses says andrew e. philip president
apparently they are learning to say no to excess risk	apparently they are learning to say no
caere was underwritten by alex brown & sons	caere was underwritten
stockholders will vote on the proposal at a meeting dec. 13	stockholders will vote dec. 13
however inflation for 1990 was seen slowing to 4.5 %	however inflation was seen slowing
continental airlines is a unit of texas air corp	continental airlines is a unit
without legal recourse there are no guarantees of civil rights for anyone	there are no guarantees
roughly a third of the charities reviewed flunk the test	roughly a third flunk the test
with less capital coming in china 's balance of payments would suffer	china 's balance would suffer
following that announcement tuesday however company officials were unavailable to elaborate	however company officials were unavailable to elaborate
those percentages hardly changed from the previous year 's poll	those percentages hardly changed
this activity produced small rallies which in turn attracted new short selling	this activity produced small rallies which attracted new short selling
they note that stocks experienced volatile swings long before futures	they note that stocks experienced volatile swings
the company is active in office and residential development in new york	the company is active
the panamanian affair is only the tip of a more alarming iceberg	the panamanian affair is only the tip
will ogonyok begin a series of reports analyzing the failures of perestroika	will ogonyok begin a series
revenue rose 7.6 % to 12.97 billion from 12.05 billion	revenue rose 7.6 %
the number includes such unstylish burgs as well oakland	the number includes such unstylish burgs
giants fans went into euphoria says mr. engelken	giants fans went says mr. engelken
the warrants may be exercised until 90 days after their issue date	the warrants may be exercised
the two sides were scheduled to meet with the mediator this morning	the two sides were scheduled to meet this morning
this legislation was not drafted by a handful of democratic do-gooders	this legislation was not drafted
other fundamental reforms of the 1986 act have been threatened as well	other fundamental reforms have been threatened as well
in 1986 congress strengthened the penalty by making it a felony	congress strengthened the penalty
of course that was before ford 's latest move	that was
emc manufactures data-storage systems for mainframes and minicomputers	emc manufactures data-storage systems
mr. beddall had been executive vice president of the division since april	mr. beddall had been executive vice president
that should happen by today he said	that should happen he said
mr. ehrlich will continue as a director and a consultant	mr. ehrlich will continue
the spokesman said unocal has had considerable interest from prospective buyers	the spokesman said unocal has had considerable interest
should they too stop messing with his free market	should they too stop messing
the 150,000-square-foot plant will be constructed on a 55-acre site near dublin	the 150,000-square-foot plant will be constructed
gray was advised by goldman sachs and merrill lynch	gray was advised
no individuals were charged in the indictment	no individuals were charged
that committee determined to open arizona to banking across state lines	that committee determined to open arizona
sterling was quoted at 1.6030 up from 1.5885 late friday	sterling was quoted up
mccaw lost 8 % or 3 1\/2 to 40	mccaw lost 8 % or 3 1\/2
ge capital has a working relationship with l.j. hooker	ge capital has a working relationship
shorted shares must eventually be replaced through buying	shorted shares must eventually be replaced
in addition mccall 's put in a less than stellar performance	mccall 's put in a less than stellar performance
the elections are set for nov. 7	the elections are set
taken by surprise the socialist party is busy changing its doctrines	taken the socialist party is busy changing its doctrines
quarterly revenue rose 4.5 % to 2.3 billion from 2.2 billion	quarterly revenue rose 4.5 %
had the case gone to trial the same issues would have surfaced	had the case gone the same issues would have surfaced
risc technology speeds up a computer by simplifying the internal software	risc technology speeds up a computer
mothers of young aids patients expressed somber satisfaction	mothers expressed somber satisfaction
elsewhere share prices closed lower in zurich amsterdam milan and stockholm	elsewhere share prices closed lower
the pool invested idle cash for many state agencies and local governments	the pool invested idle cash
a hearing is scheduled on the issue today	a hearing is scheduled today
the transaction would mark the entry of p&g into cosmetics	the transaction would mark the entry
i thought back to our time in small sparsely populated communities	i thought back
stock prices rallied in active trading	stock prices rallied
world-wide production would be cut in half by 1998	world-wide production would be cut
in addition delmed is exploring distribution arrangements with fresenius usa delmed said	delmed is exploring distribution arrangements delmed said
keeping the listed price at a dollar is primarily a convenience	keeping the listed price is primarily a convenience
but there are grounds for complaint	but there are grounds
the janus group had a similar recording for investors	the janus group had a similar recording
at that point investors may face a long bumpy ride	investors may face a long bumpy ride
now that 's advice the writers should take to heart	now that 's advice the writers should take
mr. dinkins concedes nothing in his ability to stumble and bumble	mr. dinkins concedes nothing
macmillan has owned berlitz since 1966	macmillan has owned berlitz
much is being done in colombia to fight the drug cartel mafia	much is being done to fight the drug cartel mafia
easy eggs are pasteurized in a heat-using process	easy eggs are pasteurized
he says his son has n't paid for the shares	he says his son has n't paid
by move 21 d.t. had fallen into a deep positional trap	d.t. had fallen
revenue slipped 0.7 % to 395.3 million from 398.3 million	revenue slipped 0.7 %
in 1982 he started a factory in greece	he started a factory
a spokesman for ge capital declined to comment	a spokesman declined to comment
profit from continuing operations in the year-earlier period was 402.7 million	profit was 402.7 million
a crusade of no to the consumption of drugs is imperative	a crusade is imperative
that puts pressure on cd rates	that puts pressure
december delivery gold fell 1.80 an ounce to 370.60	december delivery gold fell 1.80 an ounce
he does n't just walk off the mound and weep	he does n't just walk and weep
many affluent people place personal success and money above family	many affluent people place personal success and money
pay for performance hangs mostly on boss 's subjective view	pay hangs mostly
mr. sherry declined to comment when asked about the sales	mr. sherry declined to comment when asked
hambros rose 5 to 204 and schroders rose 25 to 12.75	hambros rose 5 and schroders rose 25
in the 300-a-share buyout that totaled about 76.7 million	that totaled about 76.7 million
remember those bulky thick-walled refrigerators of 30 years ago	remember those bulky thick-walled refrigerators
he succeeds john a. boudreau who resigned for personal reasons	he succeeds john a. boudreau who resigned
it has been trying to improve its share of the residential market	it has been trying to improve its share
it is a knock-out battle perhaps to the death	it is a knock-out battle perhaps
the exclusion would apply to assets sold after oct. 1 1989	the exclusion would apply
maybe he thinks they should also sell to the highest bidder	maybe he thinks they should also sell
california 's insurance commissioner does n't hold hearings on acquisition applications	california 's insurance commissioner does n't hold hearings
sometimes like now it 's gray	sometimes it 's gray
the buy-out group had no firm financing for the plan	the buy-out group had no firm financing
people have a different reputation country by country	people have a different reputation country
but that development also had little effect on traders ' sentiment	but that development also had little effect
interest payments on the bonds will be payable semiannually	interest payments will be payable semiannually
a raft of new computer companies also has targeted this server market	a raft also has targeted this server market
the value traded on the exchanges is close to 3 trillion	the value traded is close to 3 trillion
this was too much for james oakes the court 's chief judge	this was too much
but it never did let up on the pressure	but it never did let up
i look at it as a ho-hum matter he says	i look he says
the figures exclude businesses now organized as american express information services co	the figures exclude businesses now organized
but he said a system such as ibm 's should help significantly	but he said a system should help significantly
sales fell 1.5 % to 884 million from 897.2 million	sales fell 1.5 %
citicorp posted a 9 % drop in quarterly profit	citicorp posted a 9 % drop
the u.s. contends that the rules are n't justified on health grounds	the u.s. contends that the rules are n't justified
joanne lipman contributed to this article	joanne lipman contributed
hilton rose 2 7\/8 to 100 for example	hilton rose 2 7\/8
the investors range from elderly widows to affluent professionals	the investors range
part of drexel 's plea was to cut mr. milken loose	part was to cut mr. milken loose
researchers can apply for permission to use the probes for brain studies	researchers can apply
the three units had combined 1988 sales of about 904 million	the three units had combined 1988 sales
mr. ohmae is managing director of mckinsey & co. in japan	mr. ohmae is managing director
among broader nasdaq industry groups the utility index gained 18.11 to 761.38	the utility index gained 18.11
by comparison republicans have held closer to the anti-abortion movement	republicans have held closer
daiwa is one of the world 's largest securities firms	daiwa is one
european investors have further reason for optimism today after the u.s. rebound	european investors have further reason today
designs call for an l-shaped structure with a playground in the center	designs call
sales rose 9 % to 7.54 billion from 6.95 billion	sales rose 9 %
there 's a casino the financial heart of it all	there 's a casino the financial heart
precision castparts corp. portland ore. will begin trading with the symbol pcp	precision castparts corp. portland ore. will begin trading
even at this early stage drugs caused additional concerns	drugs caused additional concerns
the two sides had n't met since oct. 18	the two sides had n't met
they talked of the aftermath	they talked
the percentage change is since year-end	the percentage change is
we 're not rushing into anything	we 're not rushing
the latest wave of marketing is instructive	the latest wave is instructive
gate receipts are only the cowboys ' second largest source of cash	gate receipts are only the cowboys ' second largest source
forty million in the total scheme of things is not that significant	forty million is not that significant
it looks like a holiday	it looks
the stock split four-for-one on oct. 10	the stock split four-for-one
by afternoon the broader market joined the advance in full strength	the broader market joined the advance
freddie mac 9 % securities were at 97 5\/32 down 3\/32	freddie mac 9 % securities were down 3\/32
as of aug. 31 thrifts held 185 billion in mortgage-backed securities	thrifts held 185 billion
revenue rose 7.7 % to 1.28 billion from 1.18 billion	revenue rose 7.7 %
at this point the dow industrials were down 75.41 points and falling	the dow industrials were down 75.41 points and falling
they 're more worried about bread on the table	they 're more worried
the sustainability of u.s. foreign policy is essential he explains	the sustainability is essential he explains
put march 31 1992 at fixed 107 13\/16 to yield 3.43 %	put march 31 1992 to yield 3.43 %
no safety problems with the products are known the fda said	no safety problems are known the fda said
the market during the start-up is estimated at 25,000 subscribers	the market is estimated
in the end politics got in the way	politics got
in over-the-counter trading yesterday benjamin franklin rose 25 cents to 4.25	yesterday benjamin franklin rose 25 cents
other senators want to lower the down payments required on fha-insured loans	other senators want to lower the down payments required
we are n't looking at anything like a doomsday scenario he says	we are n't looking he says
by then dlj hopes to be able to sell less-junky junk bonds	dlj hopes to be able to sell less-junky junk bonds
but most of those stocks fared well	but most fared well
but by that time many big institutions had switched business to london	but many big institutions had switched business
accepted bids were all at 7.962 %	accepted bids were all
mercedes sold 82,348 cars in 1988	mercedes sold 82,348 cars
the contract also provides for advanced billing and network management services	the contract also provides
norfolk southern went up 1 1\/8 to 37 7\/8	norfolk southern went up 1 1\/8
investors apparently did n't like the news from rainbow technologies either	investors apparently did n't like the news either
on the big board crawford & co. atlanta cfd begins trading today	crawford & co. atlanta cfd begins trading today
ortega cited renewed attacks by the u.s.backed rebels	ortega cited renewed attacks
some think investors should sell into rallies	some think investors should sell
some drill-bit prices have risen 5 % in the past month	some drill-bit prices have risen 5 %
total turnover in glaxo was a thin 975,000 shares	total turnover was a thin 975,000 shares
i spent 30 million in the last half-hour	i spent 30 million
chemical securities inc. is acting as agent for the seller	chemical securities inc. is acting
its stock closed at 38 up 1.875 in national over-the-counter trading	its stock closed up 1.875
sales rose to 406 million from 356 million the year earlier	sales rose
most earn high ratings from credit agencies	most earn high ratings
getting out of them however may be a different story now	getting however may be a different story now
they have the most sophisticated computers in the world says mr. llerena	they have the most sophisticated computers says mr. llerena
confectionery products sales also had strong growth in the quarter	confectionery products sales also had strong growth
hugely popular it is far more flexible than straight whole life	hugely popular it is far more flexible
esselte business systems rose 1 to 43 1\/2	esselte business systems rose 1
he turned himself in to authorities in new york earlier this year	he turned himself in earlier this year
genetic defect spotted in 3-day-old embryo	genetic defect spotted
mr. coffee is a professor at columbia law school	mr. coffee is a professor
revenue was 873.9 million up 7.3 % from 814.8 million	revenue was 873.9 million up 7.3 %
she notes that she also stresses professionalism during her weekly visits	she notes that she also stresses professionalism
nesb is also the parent of omnibank	nesb is also the parent
cnn 's viewer habits have been molded by its format	cnn 's viewer habits have been molded
total operating expenses increased 3.5 % to 2.78 billion from 2.69 billion	total operating expenses increased 3.5 %
but out on cobb parkway ted negas sees it differently	but out ted negas sees it differently
the nasdaq 100 rose 7.08 to 445.23	the nasdaq 100 rose 7.08
the dollar rose against the swiss and french francs	the dollar rose
sun 's results were slightly better than expectations	sun 's results were slightly better
the models which cost about 75,000 each will be used in research	the models which cost about 75,000 each will be used
this could be the first of five or six down quarters	this could be the first
the gap between winners and laggards will grow	the gap will grow
sales were 4.66 billion up 1.3 % from 4.6 billion	sales were 4.66 billion up 1.3 %
the single-day record of 288 million shares was set on oct. 21	the single-day record was set
until now it had sat idle	it had sat idle
dealers said it was hit by some profit-taking after gains since mid-week	dealers said it was hit
conservatives expect bush to solidify their majority on a key court	conservatives expect bush to solidify their majority
on a stand-alone basis the network ought to make money he says	the network ought to make money he says
chivas has an image of something you would savor rather than guzzle	chivas has an image
traders said today may be an anxious day for the market	traders said today may be an anxious day
revenue was flat at 2.59 billion	revenue was flat
a resistance government would walk into kabul	a resistance government would walk
this will give paribas and lonrho joint control of societe commerciale	this will give paribas and lonrho joint control
they 're looking for something that 's very safe	they 're looking
the joke here is that the giants lost by de fault	the joke here is that the giants lost
seats are quoted at 430,000 bid and 525,000 asked	seats are quoted
looking ahead to other commodity markets this week	looking ahead
people got rich through takeovers in those days as they do today	people got rich as they do today
for a long time he ignored baseball altogether even the sports pages	he ignored baseball altogether even the sports pages
congressmen raised the issue yesterday at a hearing	congressmen raised the issue yesterday
magazine publishers are facing spiraling costs and a glut of new titles	magazine publishers are facing spiraling costs and a glut
some 4,300 institutions are part of the pension fund	some 4,300 institutions are part
as of late yesterday the ipo was still on	the ipo was still on
investors with a heavy tax load should take out their calculators	investors should take out their calculators
it 's tabloid news from a to z	it 's tabloid news
on the week ual was down nearly 40 %	ual was down nearly 40 %
in a statement young & rubicam called the award unfortunate but bearable	young & rubicam called the award unfortunate but bearable
as a result u.s. trust 's earnings have been hurt	u.s. trust 's earnings have been hurt
this interest in words goes beyond puns and playfulness however	this interest goes however
the name maidenform was coined by a third business partner enid bissett	the name maidenform was coined
with that authority of course goes an unambiguous accountability	goes an unambiguous accountability
that 's the highest estimate for a single collection in auction history	that 's the highest estimate
admittedly the principle in the cases is the same	admittedly the principle is the same
merchant banker morgan grenfell climbed 14 to 406 on renewed takeover speculation	merchant banker morgan grenfell climbed 14
now movieline is located in the same building as vesoft	now movieline is located
jeff rowe contributed to this article	jeff rowe contributed
he is ogling the curtains rippling above the ventilation ducts	he is ogling the curtains rippling
pemex which produces 40 % of government revenue desperately needs new investment	pemex which produces 40 % desperately needs new investment
like just about everything else that remains to be seen	that remains to be seen
mr. sukle says he would n't dream of participating himself	mr. sukle says he would n't dream
some residents defied orders and returned to red buildings to retrieve goods	some residents defied orders and returned to retrieve goods
a u.s.-made imitation under the title almost anything goes flopped fast	a u.s.-made imitation flopped fast
time eluded paramount by acquiring warner communications inc	time eluded paramount
the 1989 act simply extends these guarantees to the private sector	the 1989 act simply extends these guarantees
the u.s. soon found new cause for concern gun-running	the u.s. soon found new cause gun-running
then he jumped into the market	then he jumped
in addition the principles attempt to eliminate the so-called delaney paradox	the principles attempt to eliminate the so-called delaney paradox
for cathay pacific airways the smooth ride may be ending	the smooth ride may be ending
their effort has received a lukewarm response from the justice department	their effort has received a lukewarm response
collectibles should continue to be recognized as capital assets the letter states	collectibles should continue to be recognized the letter states
he apologizes for sounding pushy	he apologizes
no one ever eats in their books and look at them	no one ever eats and look
the envelope arrives in the mail	the envelope arrives
we were out of the box	we were
revenue nearly tripled to 479 million from 160 million	revenue nearly tripled
serial bonds were priced to yield to 6.80 % in 1999	serial bonds were priced to yield to 6.80 %
exxon corp. said it will move its headquarters from manhattan to dallas	exxon corp. said it will move its headquarters
meanwhile general motors and ford motor continue their pursuit of the company	meanwhile general motors and ford motor continue their pursuit
men would crawl in the sand looking for shiny stones	men would crawl looking
corporations need liquidity in the form of borrowed funds	corporations need liquidity
i think a lot of people got scared and stayed home	i think a lot got scared and stayed home
he predicted the debt ratio will improve further in coming quarters	he predicted the debt ratio will improve further
bolar pharmaceutical co. posted the largest volume increase 552,302 shares to 2,157,656	bolar pharmaceutical co. posted the largest volume increase 552,302 shares
this is an index fund with a bet	this is an index fund
fiat said it 's only interested in technical cooperation with saab	fiat said it 's only interested
prices were mixed in zurich and lower in stockholm	prices were mixed and lower
it will continue to be sold in the european market	it will continue to be sold
sales rose 8.2 % to 848.7 million from 784.5 million	sales rose 8.2 %
the current backlog of orders is strong throughout the corporation he said	the current backlog is strong he said
liza said hello to me	liza said hello
venezuela has also earmarked 200 million in new money for light-crude exploration	venezuela has also earmarked 200 million
everybody 's finger is one inch closer to the button	everybody 's finger is one inch closer
the gene thus can prevent a plant from fertilizing itself	the gene thus can prevent a plant
in los angeles more small businesses ponder adopting a child-care policy	more small businesses ponder adopting a child-care policy
the financial times 100-share index finished at 2161.9 up 12.6 points	the financial times 100-share index finished up 12.6 points
the number of authorized common shares will remain at 100 million	the number will remain
that 's 115 % more than in 1981	that 's 115 % more
this is no longer true because of campeau 's massive debt load	this is no longer true
merrill lynch capital markets inc. is the sole underwriter for the offering	merrill lynch capital markets inc. is the sole underwriter
k mart officials and mr. pilevsky would n't comment on the sale	k mart officials and mr. pilevsky would n't comment
if i need to ask for money up front later i will	if i need to ask later i will
