cuban military personnel also have been active in afghanistan since 1979	personnel have been active in afghanistan since 1979
mr. goldberg is the sole general partner in rose partners	mr. goldberg is the partner in rose partners
per-share net rose to 14.95 yen from 14.44 yen	net rose to 14.95 yen from 14.44 yen
now the assault is on said one top trader	the assault is on said one top trader
but many proponents of filipino see resistance to the language finally crumbling	but proponents of filipino see resistance to the language crumbling
and then there 's always state u	and there 's state u
this gap eventually closes but slowly	this gap closes but
traders shouted as their screens posted an ever-narrowing loss on wall street	traders shouted as their screens posted an loss on wall street
that individual was n't identified	that was n't identified
so far mr. dassault has resisted pressure to change	mr. dassault has resisted pressure to change
both figures were record highs	both figures were highs
in over-the-counter trading mgm grand was bid at 17.50 a share	in trading mgm grand was bid at 17.50 a share
stabilizing the derivative markets would tend to stabilize the primary market	stabilizing the markets would tend to stabilize the market
some smaller clients do n't seem to notice his switch	some clients do n't seem to notice his switch
i mean it is a normal adult relationship	i mean it is a adult relationship
but east germany is merely the land of truly existing socialism	but east germany is the land of existing socialism
a metric ton is equal to 2,204.62 pounds	a ton is equal to 2,204.62 pounds
the company 's president quit suddenly	the company 's president quit
however mr. steinhardt says he 's comfortable holding usair as an investment	mr. steinhardt says he 's comfortable holding usair as an investment
most foreign government bonds markets were quiet	government bonds markets were quiet
that is typically about a three-week window	that is a window
the expansion will set off a marketing war among the big hotel-casinos	the expansion will set off a marketing war among the hotel-casinos
pay for performance hangs mostly on boss 's subjective view	pay for performance hangs on boss 's view
once somebody eats one they get hooked	once somebody eats one they get
but is exile in hollywood enough	but is exile in hollywood
imperial said it had n't been served with this suit either	imperial said it had n't been served with this suit
we will have a reasonably flat year this year mr. schwarz says	we will have a flat year this year mr. schwarz says
stocks also rose in london while the frankfurt market was mixed	stocks rose in london while the frankfurt market was mixed
no non-competitive tenders will be accepted	no tenders will be accepted
the first five leased units were to be delivered in 1991	the five leased units were to be delivered in 1991
the dax index closed at 1466.29 up only 3.36	the dax index closed at 1466.29 3.36
details of credit enhancements vary widely from issue to issue	details of credit enhancements vary from issue to issue
a year earlier net was 71.6 million or 1.22 a share	a year net was 71.6 million or 1.22 a share
estimated volume was a light two million ounces	volume was a two million ounces
it said the reduced dividend reflects the low price for precious metals	it said the reduced dividend reflects the price for metals
mr. smith angered federal 's pilots too	mr. smith angered federal 's pilots
the investment community for one has been anticipating a speedy resolution	the investment community for one has been anticipating a resolution
is such a view justified	is a view justified
and expenses up 7.9 % in the quarter have stayed stubbornly high	and expenses 7.9 % in the quarter have stayed high
mr. sung formerly worked at general electric in research on synthetic diamonds	mr. sung worked at general electric in research on diamonds
sen. cohen said the relationship has reverted to its pre-reagan character	sen. cohen said the relationship has reverted to its character
born-again christians are the most visible targets of unscrupulous do-gooder investment pitches	christians are the visible targets of investment pitches
new york-based chase manhattan corp. took an 85 million arizona-related charge	new york-based chase manhattan corp. took an 85 million charge
people are fast leaving the place where he is stuck	people are leaving the place where he is stuck
he probably has n't done it for the cash	he has n't done it for the cash
many fund managers argue that now 's the time to buy	fund managers argue that 's the time to buy
strong farmer selling over the weekend also weighed on prices	farmer selling over the weekend weighed on prices
some maintain underwriters also have been inept	some maintain underwriters have been inept
nobody smiled onstage and nobody in the audience was encouraged to laugh	nobody smiled and nobody in the audience was encouraged to laugh
on second thought make that just mom	on thought make that mom
under current law it is not financially rational to forgo consumption	under law it is not rational to forgo consumption
that was n't always the way the reagan administration handled such matters	that was n't the way the reagan administration handled matters
this could be a big protest against an administrative failure	this could be a protest against an failure
but it may have a good listener in washington	but it may have a listener in washington
the original owners happily repaid the claim and took their kylix home	the owners repaid the claim and took their kylix home
southeast asian crude imports however were 3.6 % higher than august	southeast asian crude imports were 3.6 % higher than august
not that oil suddenly is a sure thing again	that oil is a thing
eventually mr. postel broke his toe in the dark	mr. postel broke his toe in the dark
sony also agreed to indemnify the producers against any liability to warner	sony agreed to indemnify the producers against any liability to warner
norman j. harrison chairman will succeed him as chief executive	norman j. harrison chairman will succeed him chief executive
but they are stalwart socialists	but they are socialists
but steelmakers must also find new markets	but steelmakers must find markets
quest for fire was the first time	quest for fire was the time
and even though employees paid the bill taxpayers grumbled	and though employees paid the bill taxpayers grumbled
some bankers are reporting more inquiries than usual about cds since friday	some bankers are reporting inquiries than usual about cds since friday
the pentagon is a haunted house	the pentagon is a house
battelle 's mr. mccall thinks steelmakers should concentrate more on construction	battelle 's mr. mccall thinks steelmakers should concentrate on construction
trading volume was a moderately heavy 3.1 million shares	trading volume was a heavy 3.1 million shares
one big obstacle is that few drugstores develop the film anymore	one obstacle is that drugstores develop the film
people are naturally suspicious of them says mr. mullins of morgan stanley	people are suspicious of them says mr. mullins of morgan stanley
i want them to stand alone	i want them to stand
i just felt another aftershock a few seconds ago	i felt another aftershock a seconds ago
not all those who wrote oppose the changes	all those who wrote oppose the changes
in national over-the-counter trading skipper 's shares rose 50 cents to 11	in trading skipper 's shares rose 50 cents to 11
but out on cobb parkway ted negas sees it differently	but on cobb parkway ted negas sees it
the second factor spurring mega-issues is political	the factor spurring mega-issues is political
economists expected twice as large an increase	economists expected an increase
mason serves commercial and government customers including the national institutes of health	mason serves and government customers including the national institutes of health
such caution was evident after the recent friday-the-13th stock market plunge	caution was evident after the stock market plunge
these are curious times in south african politics	these are times in south african politics
the notes are zero-coupon securities and will not pay interest periodically	the notes are zero-coupon securities and will not pay interest
the measure also includes spending cuts and increases in federal fees	the measure includes spending cuts and increases in fees
operating profit for world-wide tobacco products rose 10 % to 247.6 million	operating profit for tobacco products rose 10 % to 247.6 million
this is not nearly good enough	this is not good
transition is a reference to the company 's five-year restructuring effort	transition is a reference to the company 's restructuring effort
dominion textile inc. holders adopted a shareholder-rights plan at the annual meeting	dominion textile inc. holders adopted a plan at the meeting
other scandal survivors are sometimes the best source of solace	scandal survivors are the source of solace
no one else will watch out for you	no one will watch out for you
i will hereafter devote myself to serving him	i will devote myself to serving him
other companies figure they ca n't avoid the market	companies figure they ca n't avoid the market
then they identified snags in the process	they identified snags in the process
pressed on the matter he is more specific	pressed on the matter he is specific
europe had proved even less hospitable than north america	europe had proved hospitable than north america
some current rates exceed those on cds	some rates exceed those on cds
among other things the brief cited insufficient evidence	among things the brief cited evidence
per-share net rose to 55.10 yen from 54.51 yen	net rose to 55.10 yen from 54.51 yen
the machine is essentially a mainframe computer he said	the machine is a mainframe computer he said
the estimate includes the results of new stores	the estimate includes the results of stores
he had been group vice president of the electronic-publishing group	he had been group vice president of the group
in five minutes the dow industrials climbed almost 30 points	in five minutes the dow industrials climbed 30 points
but as japanese stocks rebounded treasurys retreated and ended just modestly higher	but as stocks rebounded treasurys retreated and ended
bush and deng are hoping that cooler heads prevail	bush and deng are hoping that heads prevail
it 's a very small shop	it 's a small shop
the winter games outlook also is mixed	the winter games outlook is mixed
canadian investment rules require that big foreign takeovers meet that standard	investment rules require that takeovers meet that standard
the core rate is not really out of line	the rate is not out of line
first there 's the name asset-backed securities	there 's the name securities
marshall 's ghost is satisfied for now but he 'll be back	marshall 's ghost is satisfied for but he 'll be
everyone in the world is watching us very closely	everyone in the world is watching us
while rights fees head skyward ad rates wo n't	while rights fees head ad rates wo n't
we got some exposure and pretty much good will	we got some exposure and much will
intel was up 1 3\/8 to 33 3\/4	intel was 1 3\/8 to 33 3\/4
on the other hand mr. cheney retained all those new land forces	on the hand mr. cheney retained all those land forces
mr. conn charges that humana 's own actions undermine its argument	mr. conn charges that humana 's actions undermine its argument
a simultaneous announcement was made in moscow	a announcement was made in moscow
foreign publications have responded with articles declaring her vietnam 's richest woman	publications have responded with articles declaring her vietnam 's woman
the company rejected those past proposals	the company rejected those proposals
she highlighted exclusionary business practices that the u.s. government has identified	she highlighted business practices that the u.s. government has identified
hostile thus entered the merger-acquisition lexicon	hostile entered the lexicon
the ultimate hope is that the technique could identify diseased vessels	the hope is that the technique could identify vessels
the system is the problem not an individual member	the system is the problem not an member
we 're extremely committed to optical storage technology he said	we 're committed to storage technology he said
in national over-the-counter trading friday scimed shares tumbled 2.75 to 43	in trading friday scimed shares tumbled 2.75 to 43
overall more big board stocks lost money than gained	overall big board stocks lost money than gained
their compounding effect is also alluring	their compounding effect is alluring
mr. jones is attacking the problem on several fronts	mr. jones is attacking the problem on fronts
a 35-nation environmental conference opened in sofia bulgaria	a conference opened in sofia bulgaria
getting out of them however may be a different story now	getting of them may be a story
steppenwolf needs the extra seats even more than the fly space	steppenwolf needs the seats than the fly space
the cement producer said the payment was made from excess cash flow	the cement producer said the payment was made from cash flow
buying from willing shareholders makes an unfriendly takeover impossible mr. rey contends	buying from shareholders makes an takeover impossible mr. rey contends
there is one sacred rule of journalism john hersey has said	there is one rule of journalism john hersey has said
the leveraged buy-out group of ge capital now reports to mr. carpenter	the leveraged buy-out group of ge capital reports to mr. carpenter
sometimes traders lose sight of that he says	traders lose sight of that he says
we just want to have our own cup of tea	we want to have our cup of tea
the one-hour program will be repeated with updates throughout saturday mornings	the program will be repeated with updates throughout saturday mornings
yields on most fixed-income securities are lower than several months ago	yields on securities are lower than months
the machine began shipping at the end of last year	the machine began shipping at the end of year
i 'm on my own land mr. pyszkiewicz says	i 'm on my land mr. pyszkiewicz says
oh yes the atlantic was also pushed back 300 yards	oh yes the atlantic was pushed back 300 yards
home-sale losses rise but they 're often covered by employers	losses rise but they 're covered by employers
should you really own stocks	should you own stocks
quantum is sharon 's largest unsecured creditor	quantum is sharon 's creditor
risk is also a function of time	risk is a function of time
since 1981 indian military advisers have been assisting the kabul regime	since 1981 advisers have been assisting the kabul regime
it was considered south africa 's largest opposition rally	it was considered south africa 's opposition rally
but his release within the next few months is widely expected	but his release within the months is expected
despite their ubiquity the consultants are n't entirely welcome	despite their ubiquity the consultants are n't welcome
in addition mccall 's put in a less than stellar performance	in addition mccall 's put in a than stellar performance
police detained more than 350 people	police detained than 350 people
the two are also signing a trade agreement	the two are signing a trade agreement
we are all fine here although mame was extremely freaked	we are fine although mame was freaked
the journal also will offer expanded volume and frequency discounts	the journal will offer expanded volume and frequency discounts
bond prices posted strong gains as investors went on a bargain hunt	bond prices posted gains as investors went on a bargain hunt
here they are searching for a higher price	they are searching for a price
he seems to be typical of many professional money managers	he seems to be typical of money managers
following that announcement tuesday however company officials were unavailable to elaborate	following that announcement tuesday company officials were unavailable to elaborate
but they wo n't necessarily eat at denny 's	but they wo n't eat at denny 's
but mexico urgently needs more help	but mexico needs help
he is our most dangerous enemy	he is our dangerous enemy
the issue has an expected final maturity date of 1998	the issue has an expected maturity date of 1998
only now is it undergoing a badly needed facelift	is it undergoing a needed facelift
but the broader truth is more complicated and dismaying	but the truth is complicated and dismaying
mr. meador had been executive vice president of balcor	mr. meador had been vice president of balcor
their relationship with mr. sugarman soured shortly thereafter	their relationship with mr. sugarman soured
another big question hovering over the debate is what president bush thinks	another question hovering over the debate is what president bush thinks
the afl-cio also embraces treatment guidelines	the afl-cio embraces treatment guidelines
conservatives have an important decision to make this fall	conservatives have an decision to make this fall
the company just went public earlier this month	the company went public this month
there already are proposals pending in congress to overhaul pesticide law	there are proposals pending in congress to overhaul pesticide law
we 're settling down to a less active period	we 're settling down to a active period
here 's a look at some of the alternatives	's a look at some of the alternatives
the owners william and margie hammack are luckier than many others	the owners william and margie hammack are luckier than others
mr. sheinberg remains as executive vice president	mr. sheinberg remains as vice president
the product overcame the bad publicity and kept evolving	the product overcame the publicity and kept evolving
dragging prop. 13 into this story is a pretty long stretch	dragging prop. 13 into this story is a long stretch
he turned himself in to authorities in new york earlier this year	he turned himself in to authorities in new york this year
her recent report classifies the stock as a hold	her report classifies the stock as a hold
now after beating them mr. achenbaum is joining them	after beating them mr. achenbaum is joining them
a reflects 2-for-1 stock split effective dec. 30 1988	a reflects stock split effective dec. 30 1988
the california thrift has just announced a 226 million third-quarter loss	the california thrift has announced a 226 million third-quarter loss
futures he says merely cut down on trading costs	futures he says cut down on trading costs
last week many jaguar shareholders took their money and ran	week jaguar shareholders took their money and ran
now that 's advice the writers should take to heart	that 's advice the writers should take to heart
actually the funds do fluctuate but beyond the third decimal place	the funds do fluctuate but beyond the decimal place
i would like to issue a challenge to corporate america	i would like to issue a challenge to america
many bankers view property-sector loans as particularly risky	bankers view property-sector loans risky
union officials have taken a beating politically as a result	union officials have taken a beating as a result
last friday 's market gyrations did not result in severe aftershocks	friday 's market gyrations did not result in aftershocks
and his outlook improved after successful cataract surgery in august	and his outlook improved after cataract surgery in august
institutional buyers were the main force pushing blue chips higher	buyers were the force pushing chips
italian magistrates labeled his death a suicide	magistrates labeled his death a suicide
he acknowledged however that washington 's drug-related murder rate is intolerably high	he acknowledged that washington 's murder rate is high
the single-day record of 288 million shares was set on oct. 21	the record of 288 million shares was set on oct. 21
but darman suggests such tensions will dissipate quickly	but darman suggests tensions will dissipate
earlier this month mr. icahn boosted his usx stake to 13.4 %	this month mr. icahn boosted his usx stake to 13.4 %
we practically ran our own studio	we ran our studio
a program-bashing move is clearly on	a move is on
adverse pressure on gross margins has subsided mr. sculley said	pressure on margins has subsided mr. sculley said
the 30-share index ended 12.6 points higher at 1751.9	the index ended 12.6 points at 1751.9
in over-the-counter trading yesterday moscom closed at 4.375 up 37.5 cents	in trading yesterday moscom closed at 4.375 37.5 cents
the company was officially merged with bristol-myers co. earlier this month	the company was merged with bristol-myers co. this month
there is after all big money in environmentalism	there is after all money in environmentalism
the average three-month issue rose to 8.05 % from 7.77 %	the issue rose to 8.05 % from 7.77 %
the japanese government does n't allow this	the government does n't allow this
and in financial markets irrational behavior is sometimes translated into catastrophe	and in markets behavior is translated into catastrophe
most bond prices fell but junk bonds and the dollar rose	bond prices fell but junk bonds and the dollar rose
and then there 's the case of the missing gold watch	and there 's the case of the gold watch
the issue here may be the soundness of the guarantee	the issue may be the soundness of the guarantee
a side porch was ripped away	a side porch was ripped
there 's no constitutional right involved in the rule change he says	there 's no right involved in the rule change he says
the rtc needs the most able competent management available	the rtc needs the able competent management available
not surprisingly he sometimes bites	he bites
ncnb 's profit more than doubled	ncnb 's profit than doubled
the company reported a big third-quarter loss on thursday	the company reported a loss on thursday
the irs assessed the clinic 350,000 in back payroll taxes	the irs assessed the clinic 350,000 in payroll taxes
even drexel is pulling back	drexel is pulling back
total merchant banking exposures are in excess of the firm 's equity	merchant banking exposures are in excess of the firm 's equity
that compared with 49 such transactions totaling 28.7 billion as year earlier	that compared with 49 transactions totaling 28.7 billion as year
healthcare operates many of the health-care properties that healthvest owns	healthcare operates many of the properties that healthvest owns
i never thought it would become so momentous bobby remarked	i thought it would become momentous bobby remarked
he pampers them he invites them to fabulous parties he strokes them	he pampers them he invites them to parties he strokes them
but he wanted to pursue his own dream and he went	but he wanted to pursue his dream and he went
the system currently has a capacity of 1.55 million barrels a day	the system has a capacity of 1.55 million barrels a day
the largest was the 12 billion merger creating bristol-myers squibb co	the was the 12 billion merger creating bristol-myers squibb co
in the previous three general elections similar national issues clinched the vote	in the three elections issues clinched the vote
the company said a new chief operating officer wo n't be appointed	the company said a chief operating officer wo n't be appointed
toyota motor corp. 's lexus division also provides specifications	toyota motor corp. 's lexus division provides specifications
the 1988 quarter also included one-time gains totaling about 35 million	the 1988 quarter included gains totaling about 35 million
all nasdaq industry indexes finished lower with financial issues hit the hardest	all nasdaq industry indexes finished with issues hit the
officials also say a national electricity shortage might not be far off	officials say a electricity shortage might not be off
still no one expects ibm 's rivals to deliver a knockout	no one expects ibm 's rivals to deliver a knockout
but daewoo is expanding too	but daewoo is expanding
also he notes most corporate bonds are callable	he notes bonds are callable
japanese stock salesmen selling american bonds	stock salesmen selling bonds
here is the red tape that irks surveyed business owners the most	is the tape that irks surveyed business owners the
the fast-food business is intensely competitive notes wertheim schroder analyst john rohs	the business is competitive notes wertheim schroder analyst john rohs
how such remarks translate into policy wo n't become clear for months	how remarks translate into policy wo n't become clear for months
the proposal however was immediately rebuffed by arby 's parent dwg corp	the proposal was rebuffed by arby 's parent dwg corp
also most of the telecommunications equipment was out	of the telecommunications equipment was out
as of aug. 31 thrifts held 185 billion in mortgage-backed securities	as of aug. 31 thrifts held 185 billion in securities
british airways rose initially after announcing its withdrawal from the ual deal	british airways rose after announcing its withdrawal from the ual deal
whatever the difficulties mr. gorbachev remains committed to increasing foreign trade	whatever the difficulties mr. gorbachev remains committed to increasing trade
it is hoped that other japanese would then follow the leader	it is hoped that japanese would follow the leader
they stroll through the marble-encased corridors of the atrium court	they stroll through the corridors of the atrium court
but this is almost an underground activity	but this is an activity
the heavy selling by farmers helped to damp the price rally	the selling by farmers helped to damp the price rally
