the deal fell through and kandahar remains a major regime base	the deal fell and kandahar remains a regime base
u.k. sales for last year 's quarter were about 3 million	u.k. sales for year 's quarter were 3 million
it also would have reduced mandatory overtime	it would have reduced overtime
the changes have n't come easy	the changes have n't come
but most of those stocks fared well	but most of those stocks fared
other gainers were companies with one or more undamaged california refineries	gainers were companies with one or california refineries
for bankers and regulators arizona is looking more like texas every day	for bankers and regulators arizona is looking like texas every day
yuba city calif. meanwhile ranked dead last among 329 metro areas	yuba city calif. ranked dead last among 329 metro areas
the new zealand bond issue simply has brought the two institutions face-to-face	the new zealand bond issue has brought the two institutions
the monthly increase is the highest recorded in the past four years	the increase is the recorded in the four years
but the scope of seagram 's chivas promotion sets it apart	but the scope of seagram 's chivas promotion sets it
the newport beach operators also tend to indulge themselves privately	the newport beach operators tend to indulge themselves
that loss compared with a year-earlier profit of 273.5 million	that loss compared with a profit of 273.5 million
other western union securities were also lower	western union securities were lower
mr. kaiser said there were no fundamental factors moving these markets	mr. kaiser said there were no factors moving these markets
mr. spinney is a permanent pentagon official	mr. spinney is a pentagon official
the stock market reacted strongly to the news	the stock market reacted to the news
some of the more cautious cd holders might like pre-refunded municipals	some of the cautious cd holders might like municipals
in either case the investor faces three possible outcomes	in either case the investor faces three outcomes
seats are currently quoted at 430,000 bid and 525,000 asked	seats are quoted at 430,000 bid and 525,000 asked
that may just be the nature of these highly leveraged little creatures	that may be the nature of these leveraged creatures
that raised hopes that interest rates will continue to move lower	that raised hopes that interest rates will continue to move
mr. carter is a political commentator who heads a television production firm	mr. carter is a commentator who heads a television production firm
what really stirs his muse though is aerobic architecture	what stirs his muse is architecture
that was the first time they lost and i won he says	that was the time they lost and i won he says
mr. decker is about 45 years old	mr. decker is 45 years old
spending by japanese households averaged 290,782 yen 2,052.10 in august	spending by households averaged 290,782 yen 2,052.10 in august
however that does n't mean they can benefit from the vaccine	that does n't mean they can benefit from the vaccine
so what is santa fe worth	what is santa fe worth
it 's just not cost efficient he says	it 's not cost efficient he says
but gaf 's bellwether role was short-lived	but gaf 's role was short-lived
waterford has decided against paying an interim dividend	waterford has decided against paying an dividend
and neither can your pilot	and can your pilot
i had calls all night long from the states he said	i had calls all night from the states he said
it 's worth noting that both disapproving relatives are immigrants	it 's worth noting that both relatives are immigrants
we go from one to the other	we go from one to the
mr. gonzalez is not quite a closet supply-side revolutionary however	mr. gonzalez is not a closet supply-side revolutionary
george marshall 's ghost is much more difficult to keep happy	george marshall 's ghost is difficult to keep happy
the 21-square-mile area is contaminated with lead zinc and other metals	the area is contaminated with lead zinc and metals
i am aware we have real budgetary problems	i am aware we have problems
b.a.t industries the most active amex issue rose 3\/8 to 12 3\/8	b.a.t industries the active amex issue rose 3\/8 to 12 3\/8
it defended appropriate constitutional safeguards and practical common sense	it defended safeguards and sense
completion of the sale is expected early next year falcon said	completion of the sale is expected year falcon said
they should never be on	they should be
delayed financings also would affect the operations of many companies	financings would affect the operations of companies
this is the commercial version	this is the version
u.s. takeover-stock speculators now own an estimated 25 % of jaguar shares	u.s. takeover-stock speculators own an estimated 25 % of jaguar shares
new telephone lines posted healthy growth	telephone lines posted growth
columbia savings is a major holder of so-called junk bonds	columbia savings is a holder of junk bonds
they 're just as confused	they 're confused
the irs delays several deadlines for hugo 's victims	the irs delays deadlines for hugo 's victims
revenue rose slightly to 3.16 billion from 3.13 billion	revenue rose to 3.16 billion from 3.13 billion
the rest were withdrawn for lack of acceptable bids	the rest were withdrawn for lack of bids
they attached a second gene for herbicide resistance to the pollen-inhibiting gene	they attached a gene for herbicide resistance to the gene
mr. zafris thinks rates are heading down helping small companies	mr. zafris thinks rates are heading helping companies
the next woman was older and i was afraid to touch her	the woman was older and i was afraid to touch her
i 'm now monitoring every major account	i 'm monitoring every account
in national over-the-counter trading yesterday bsb closed at 17.50 up 12.5 cents	in over-the-counter trading yesterday bsb closed at 17.50 up 12.5 cents
ms. de vries is a free-lance writer	ms. de vries is a writer
the fund invests heavily in dollar-denominated money-market securities overseas	the fund invests in securities
i tell people it 's the groundup bones of saints he says	i tell people it 's the bones of saints he says
union federal a federally insured savings bank has 2.4 billion in assets	union federal a insured savings bank has 2.4 billion in assets
the 15 % restriction covers any would-be suitor british or foreign	the 15 % restriction covers any suitor british or foreign
the merger is scheduled to take place in the 1990 first quarter	the merger is scheduled to take place in the 1990 quarter
companies are still going to buy companies around the world he says	companies are going to buy companies around the world he says
they will do it every chance they get said one program-trading executive	they will do it every chance they get said one executive
as this is now a litigation matter we have no further comment	as this is a litigation matter we have no comment
but the deal fell apart last week for lack of financing	but the deal fell week for lack of financing
in japan small suggestions are encouraged	in japan suggestions are encouraged
and now at the crucial moment he 's running out of money	and at the moment he 's running of money
it was our first acquisition he says and it was a mistake	it was our acquisition he says and it was a mistake
however operating profit fell 35 % to 16.4 million	operating profit fell 35 % to 16.4 million
because the law made compliance voluntary it inspired little more than jokes	because the law made compliance voluntary it inspired than jokes
the key word in that paragraph though is may	the word in that paragraph is may
pemex 's customers also are pleased with the company 's new spirit	pemex 's customers are pleased with the company 's spirit
later the judge went a step farther	the judge went a step
indeed mccaw seemed to hint at that option in a brief statement	mccaw seemed to hint at that option in a statement
this is a very personal ethnic style mr. carew says	this is a personal style mr. carew says
the comic book will cost about 2	the book will cost about 2
serial bond yields were up about 0.05 percentage point	bond yields were 0.05 percentage point
in coming years mr. cathcart says kidder is gon na hum	in years mr. cathcart says kidder is gon na hum
further consolidations in the industry could follow	consolidations in the industry could follow
the media she says have distorted his personal life	the media she says have distorted his life
no one ever eats in their books and look at them	no one eats in their books and look at them
let 's put it bluntly	let 's put it
but after restructuring under new management the profits began rolling in	but after restructuring under management the profits began rolling in
the new exchange drew instant recognition from an unwelcome quarter	the exchange drew recognition from an quarter
if you want more opinions ask my wife	if you want opinions ask my wife
maybe i 'll plant castor-oil seeds	i 'll plant castor-oil seeds
the most recent sales do n't appear to be option-related he said	the sales do n't appear to be option-related he said
mr. padovan is currently a director at barclays de zoete wedd ltd	mr. padovan is a director at barclays de zoete wedd ltd
in other words get rid of all the pictures	in words get rid of all the pictures
no longer innocent they qualified as fools	no innocent they qualified as fools
brooks armored car service inc. never wanted to get into money laundering	brooks armored car service inc. wanted to get into money laundering
business was slow because many companies were closed yesterday	business was slow because companies were closed yesterday
talk show hosts quickly change the topic	talk show hosts change the topic
in over-the-counter national trading bowater inc. jumped 1.50 to 27.50	in trading bowater inc. jumped 1.50 to 27.50
this was george bush 's own idea	this was george bush 's idea
they learned they could survive it without much problem	they learned they could survive it without problem
the latest quarter included a 6.6 million write-down of investments	the quarter included a 6.6 million write-down of investments
the carrier has n't yet turned a profit	the carrier has n't turned a profit
the cia told him it does not do domestic counterespionage	the cia told him it does not do counterespionage
closely held automax has annual sales of about 10 million	held automax has sales of about 10 million
national leaders stopped by his stand to commend his achievements	leaders stopped by his stand to commend his achievements
this is not a major crash she said	this is not a crash she said
occasionally all that 's needed is a little coaxing	all that 's needed is a coaxing
ashland expects that sale to be complete next year	ashland expects that sale to be complete year
more carefully targeted intervention might actually reduce the need for government action	targeted intervention might reduce the need for government action
small-lot buying targeted at incentive-backed issues pushed up the nikkei	buying targeted at issues pushed up the nikkei
ual corp. is a good example	ual corp. is a example
the company is active in office and residential development in new york	the company is active in office and development in new york
yesterday it received a 15 million three-year contract from drexel burnham lambert	yesterday it received a 15 million contract from drexel burnham lambert
east bloc pollution data typically have been state secrets	east bloc pollution data have been state secrets
the mask cuts to the quick	the mask cuts to the
the plan would impose a brief freeze on physician fees next year	the plan would impose a freeze on physician fees next year
panic frequently results in irrational behavior	panic results in behavior
in the experiment mice with the defective gene were mated	in the experiment mice with the gene were mated
the company deliberately understaffs stretching employees ' schedules to the limit	the company understaffs stretching employees ' schedules to the limit
a healthy embryo can be picked for implantation and defective ones discarded	a embryo can be picked for implantation and ones discarded
by 1986 the number of federal regulators was down to about 103,000	by 1986 the number of regulators was to about 103,000
after all he says even to make love you need experience	after all he says to make love you need experience
i want to add one more truck mr. huber says	i want to add one truck mr. huber says
let me immediately put limits to whatever nostalgic notions that may intimate	let me put limits to whatever notions that may intimate
the planned turbogenerator plant is expected to go into operation in 1994	the turbogenerator plant is expected to go into operation in 1994
the other two props earnings and the economic outlook are troubling too	the two props earnings and the outlook are troubling
contract details however have n't been made public	contract details have n't been made public
concorde trans-atlantic flights are 2,400 to paris and 3,200 to london	concorde flights are 2,400 to paris and 3,200 to london
but attendance is down from previous years	but attendance is from years
other details were n't available	details were n't available
second-tier companies are receiving even less per ton	companies are receiving per ton
a surprisingly small amount of reserves was added to the banking system	a small amount of reserves was added to the banking system
the globalists tend to think mr. lawson ran onto technical reefs	the globalists tend to think mr. lawson ran onto reefs
other changes including easing restrictions on travel for east germans are expected	changes including easing restrictions on travel for east germans are expected
the pay 's the same and the duty 's lighter	the pay 's the and the duty 's lighter
currently average pay for machinists is 13.39 an hour boeing said	pay for machinists is 13.39 an hour boeing said
mr. brody left the company to find other backers	mr. brody left the company to find backers
these are not certain either	these are not certain
are consumers too deep in hock	are consumers in hock
it is n't yet clear whether the 200-ruble limit will be lifted	it is n't clear whether the limit will be lifted
but does it have to be so soon	but does it have to be
but his first crop wo n't be picked till next year	but his crop wo n't be picked till year
seats are currently quoted at 151,000 bid and 162,000 asked	seats are quoted at 151,000 bid and 162,000 asked
third-quarter profits from gasoline were weaker	profits from gasoline were weaker
i do n't know if this would have happened somewhere else	i do n't know if this would have happened
of course many more issues 93 hit new lows	of course issues 93 hit lows
alamco inc. said its board has approved a 1-for-10 reverse stock split	alamco inc. said its board has approved a reverse stock split
keeping the listed price at a dollar is primarily a convenience	keeping the listed price at a dollar is a convenience
cracking the top 10 within three years will be difficult at best	cracking the top 10 within three years will be difficult at
the trial begins today in federal court in philadelphia	the trial begins today in court in philadelphia
flesh goes to total alert for flight or fight	flesh goes to total for flight or fight
sterling was quoted at 1.5920 up from 1.5753 late tuesday	sterling was quoted at 1.5920 from 1.5753 tuesday
entertainment and media stocks generally escaped the market 's slide as well	entertainment and media stocks escaped the market 's slide
after months of internal rumblings mr. ngoc was fired last december	after months of rumblings mr. ngoc was fired december
older people help profits by filling in downtime	people help profits by filling in downtime
the port of houston closed its terminal for handling bulk cargo	the port of houston closed its terminal for handling cargo
finally was the information material	was the information material
who that winner will be is highly uncertain	who that winner will be is uncertain
it was supposed to be a routine courtesy call	it was supposed to be a courtesy call
these big stocks greatly influence the nasdaq composite index	these stocks influence the nasdaq composite index
the house energy committee will debate the issue later this month	the house energy committee will debate the issue this month
would mr. antori ever get back in	would mr. antori get in
mr. warren pronounces the litchfield case your typical demonic infestation	mr. warren pronounces the litchfield case your infestation
the final proration factor will be announced monday	the proration factor will be announced monday
issues of insurance brokers were especially strong	issues of insurance brokers were strong
as of sept. 30 halsey had 5.3 million common shares outstanding	as of sept. 30 halsey had 5.3 million shares outstanding
but mr. simmons has long ties to both republicans and banking	but mr. simmons has ties to both republicans and banking
corporate planners can plan again	planners can plan
and most of these are absolutely unnecessary	and most of these are unnecessary
it 's reassuring and it usually works	it 's reassuring and it works
for the prior year deposits exceeded withdrawals by 8.8 billion	for the year deposits exceeded withdrawals by 8.8 billion
for longer-term cds yields were up	for cds yields were up
i feel better than i ever have in my life he says	i feel than i have in my life he says
security costs are also quite high	security costs are high
it has more drug users than boston has people	it has drug users than boston has people
but some money managers are doing just that	but some money managers are doing that
other major players in intimate apparel apparently feel the same way	players in apparel feel the way
now the alley has moved ahead on both artistic and financial fronts	the alley has moved on both artistic and financial fronts
but even mr. boren defends congressional oversight	but mr. boren defends oversight
state government is more typically split along republican-governor\/democratic-legislature lines than the reverse	state government is split along lines than the reverse
of course mr. mason did not use neutral language	of course mr. mason did not use language
imperial cup has annual sales of approximately 75 million	imperial cup has sales of 75 million
it has about 12.3 million shares outstanding	it has 12.3 million shares outstanding
still employees do occasionally try to smuggle out a gem or two	employees do try to smuggle out a gem or two
i thought your editorial was factually accurate and deliberately elucidative	i thought your editorial was accurate and elucidative
what happens to me if campeau collapses between now and then	what happens to me if campeau collapses between and
they stopped short of resuming diplomatic ties severed in 1979	they stopped of resuming ties severed in 1979
the move was approved at a special shareholders ' meeting yesterday	the move was approved at a shareholders ' meeting yesterday
the golden share was scheduled to expire at the beginning of	the share was scheduled to expire at the beginning of
we 've taken more than our fair share	we 've taken more than our share
copper prices fell sharply friday afternoon	copper prices fell friday afternoon
two big stocks involved in takeover activity saw their short interest surge	two stocks involved in takeover activity saw their interest surge
meanwhile the brokerage firms in san francisco were trying to cope	the brokerage firms in san francisco were trying to cope
they were absolutely killed slaughtered said one chicago-based options trader	they were killed slaughtered said one options trader
nuclear power plants are acceptable	power plants are acceptable
but the offering almost did n't happen	but the offering did n't happen
sterling was quoted at 1.6055 up from 1.6030 late monday	sterling was quoted at 1.6055 from 1.6030 monday
if the economy turns down such proposals could gain strong momentum	if the economy turns proposals could gain momentum
the merc first started working on developing this contract in 1984	the merc started working on developing this contract in 1984
some abortion advocates have been asking themselves this very question	some abortion advocates have been asking themselves this question
these securities are attractive to japanese investors for three reasons	these securities are attractive to investors for three reasons
it 's a process that never really ends	it 's a process that ends
the numbers were adjusted for usual seasonal fluctuations	the numbers were adjusted for fluctuations
sterling was quoted at 1.6030 up from 1.5885 late friday	sterling was quoted at 1.6030 from 1.5885 friday
so far all the studies have concluded that ru-486 is safe	so all the studies have concluded that ru-486 is safe
a natural gas rule was struck down by a federal appeals court	a gas rule was struck down by a appeals court
but the reagan administration thought otherwise and so may the bush administration	but the reagan administration thought and may the bush administration
that could change thanks to lower long-distance rates and cheaper electronics	that could change thanks to rates and electronics
you can too if you like me refuse to bite the bullet	you can if you like me refuse to bite the bullet
indeed his caution has become legendary within the government	his caution has become legendary within the government
materials and production costs also rose trw said	materials and production costs rose trw said
but so far the effort has failed and traffic is still slow	but the effort has failed and traffic is slow
ten minutes later it was done	ten minutes it was done
the tva 's public debt offering was its first in 15 years	the tva 's debt offering was its in 15 years
the disk-drive maker disclosed a major fraud two months ago	the disk-drive maker disclosed a fraud two months
two other men also were charged with participating in the operation	two men were charged with participating in the operation
mr. chan used to be an oddity in hanoi a private entrepreneur	mr. chan used to be an oddity in hanoi a entrepreneur
right now they 're pursuing evidence	they 're pursuing evidence
the reputed wealth of the unification church is another matter of contention	the wealth of the unification church is another matter of contention
broader market averages were little changed in the latest session	market averages were changed in the session
the charts show how househld assets have been distributed over time	the charts show how assets have been distributed over time
he adds i think this is a great strategic move for quebecor	he adds i think this is a move for quebecor
and for now at least the competition is n't the only enemy	and for at least the competition is n't the enemy
consumer stocks once again set the pace for blue-chip issues	consumer stocks set the pace for issues
earnings of female workers were unchanged	earnings of workers were unchanged
it comes real gentle before it pulls	it comes gentle before it pulls
and the egg producers have done a pretty good job	and the egg producers have done a good job
weatherford said market conditions led to the cancellation of the planned exchange	weatherford said market conditions led to the cancellation of the exchange
the senate commerce committee already has approved similar legislation	the senate commerce committee has approved legislation
arguably both were on notice that their behavior was at least risky	both were on notice that their behavior was at least risky
you 'll see fewer gimmicks	you 'll see gimmicks
other senators want to lower the down payments required on fha-insured loans	senators want to lower the payments required on loans
but this raises added cost barriers to urban entrepreneurship	but this raises added cost barriers to entrepreneurship
and there were other blunders	and there were blunders
most of the telephone problems in the immediate aftermath stemmed from congestion	most of the telephone problems in the aftermath stemmed from congestion
shearson lehman however executes program trades for clients	shearson lehman executes program trades for clients
the condition known as paroxysmal supraventricular tachycardia leads to dizziness and fainting	the condition known as tachycardia leads to dizziness and fainting
slowing economies in some areas limit student choice	economies in some areas limit student choice
there was no cost estimate for the second phase	there was no cost estimate for the phase
the gains to be sure are rather small	the gains to be sure are small
south african gold stocks closed moderately lower	south african gold stocks closed
others preach the gospel of buying only blue-chip growth stocks	others preach the gospel of buying growth stocks
americans may not be so lucky the next time	americans may not be lucky the time
mr. jordan of gm meanwhile still criticizes japanese styling	mr. jordan of gm criticizes styling
fed officials probably wo n't drive down rates immediately mr. keith said	fed officials wo n't drive rates mr. keith said
that may be the last thing she needs	that may be the thing she needs
television news of course has always been part show-biz	television news of course has been part show-biz
the now-standard price of 1 a share came about by accident	the price of 1 a share came about by accident
i would n't expect an immediate resolution to anything	i would n't expect an resolution to anything
it also will hand unilab new markets	it will hand unilab markets
testimony is expected to continue until early december	testimony is expected to continue until december
you think you can go out and turn things around	you think you can go and turn things
