the big board 's mr. grasso said our systemic performance was good	the big board 's mr. grasso said our performance was good
some companies are cutting costs and hoping for the best	some companies are cutting costs and hoping for the
the senate will probably vote not long afterward	the senate will vote not
but in this case the needle has a very sharp point	but in this case the needle has a sharp point
british sterling eased to 1.5775 from 1.5825	sterling eased to 1.5775 from 1.5825
the new rules will allow investors to buy foreign stocks directly	the rules will allow investors to buy stocks
in the year-earlier quarter morgan earned 233.6 million or 1.25 a share	in the quarter morgan earned 233.6 million or 1.25 a share
but we ca n't produce enough anymore	but we ca n't produce enough
the security business is my favorite subject	the security business is my subject
the manuevering illustrates an emerging republican donnybrook pacified since the early 1980s	the manuevering illustrates an emerging donnybrook pacified since the 1980s
rally rally rally shouted shearson trader andy rosen selling more jaguar shares	rally rally rally shouted shearson trader andy rosen selling jaguar shares
seats currently are quoted at 361,000 bid 395,000 asked	seats are quoted at 361,000 bid 395,000 asked
the tax court is n't expected to rule before early next year	the tax court is n't expected to rule before year
that trend could increase demand for hot-dipped galvanized sheet	that trend could increase demand for sheet
the 30-share index closed 11.6 points higher at 1772.6	the index closed 11.6 points higher at 1772.6
we believe that the vast majority of imported material is safe	we believe that the majority of imported material is safe
some town-watching excursions were downright comic	some excursions were comic
such centrifugal egg breakers have been around since the 1890s	egg breakers have been around since the 1890s
and navigation mixte has a huge hidden attraction	and navigation mixte has a attraction
a two-hour lunch break follows	a lunch break follows
his tuesday night team the leftovers is in first place	his tuesday night team the leftovers is in place
the two companies like fox already have their own tv stations	the two companies like fox have their tv stations
mid-sized companies were most affected by talk of layoffs or plant closings	companies were affected by talk of layoffs or plant closings
says mr. steidtmann i 'm looking for a bi-polar christmas	says mr. steidtmann i 'm looking for a christmas
we think alliances are very important mr. eddington says	we think alliances are important mr. eddington says
which celebrity endorsers are most believable	which celebrity endorsers are believable
it 's a nuisance tax on mergers	it 's a tax on mergers
wisconsin toy currently has about 4.7 million shares outstanding	wisconsin toy has about 4.7 million shares outstanding
smaller-stock earnings by comparison rose between 15 % and 20 %	earnings by comparison rose between 15 % and 20 %
world prices tumbled mostly from their own weight according to analysts	world prices tumbled from their weight according to analysts
declines came because of concern that demand for copper may slow down	declines came of concern that demand for copper may slow down
the new rate will be payable feb. 15	the rate will be payable feb. 15
the bank employs 8,000 people in spain and 2,000 abroad	the bank employs 8,000 people in spain and 2,000
he said certain volunteers developed kinds of antibodies associated with early aids	he said volunteers developed kinds of antibodies associated with aids
there was n't a lot of panic selling either domestically or internationally	was n't a lot of panic selling either or
many other tax benefits also were swept away	tax benefits were swept
most of those freed had spent at least 25 years in prison	most of those freed had spent at 25 years in prison
rather it just shows things have changed	it shows things have changed
still fund groups are n't taking any chances	fund groups are n't taking any chances
it will develop produce and market high-performance electronic parts	it will develop produce and market parts
had the case gone to trial the same issues would have surfaced	had the case gone to trial the issues would have surfaced
they want late-night shuttles to the biology labs	they want shuttles to the biology labs
profit from continuing operations in the year-earlier period was 402.7 million	profit from continuing operations in the period was 402.7 million
following is a breakdown of major market activity	following is a breakdown of market activity
while some automotive programs have been delayed they have n't been canceled	while some programs have been delayed they have n't been canceled
every witness receives a formal subpoena rep. gonzalez told him	every witness receives a subpoena rep. gonzalez told him
the second time he says they left the shovel	the time he says they left the shovel
ms. de vries writes frequently about theater	ms. de vries writes about theater
writes bilanz no one in switzerland ever came so far so fast	writes bilanz no one in switzerland came
so why even consider stacking freeways now	why consider stacking freeways
here are details of yesterday 's three-month and six-month bill auction	are details of yesterday 's three-month and six-month bill auction
asians and native americans were n't studied hispanics were included with whites	asians and americans were n't studied hispanics were included with whites
ibm closed at 102 down 5.625	ibm closed at 102 5.625
after being inspected buildings with substantial damage were color-coded	after being inspected buildings with damage were color-coded
our business is constantly looking at all these things he says	our business is looking at all these things he says
it also is trying to shore up its tobacco business	it is trying to shore up its tobacco business
mr. rey says the move is yet another example of his conservatism	mr. rey says the move is another example of his conservatism
things work out unexpectedly in life said ms. volokh	things work out in life said ms. volokh
agip already has an oil stake in libya	agip has an oil stake in libya
third they offer high yields	third they offer yields
ms. bartlett blithely suggested calling upon semi-skilled garden club workers for maintenance	ms. bartlett suggested calling upon garden club workers for maintenance
the department also said it takes four months to establish a trend	the department said it takes four months to establish a trend
few petitions however have actually delayed or scuttled mergers	petitions have delayed or scuttled mergers
lloyd 's overblown bureaucracy also hampers efforts to update marketing strategies	lloyd 's bureaucracy hampers efforts to update marketing strategies
with little competition the computer industry here is inefficient	with competition the computer industry is inefficient
east germans rallied as officials reportedly sought honecker 's ouster	east germans rallied as officials sought honecker 's ouster
the securities were priced at 99.1875 to yield about 9.19 %	the securities were priced at 99.1875 to yield 9.19 %
the liquor industry went metric 10 years ago	the liquor industry went metric 10 years
needless to say it was an interesting first session	needless to say it was an session
each share point is worth about 60 million in sales	each share point is worth 60 million in sales
i see no major support until 2200	i see no support until 2200
indeed the competition is n't greatly concerned	the competition is n't concerned
in the year-earlier quarter the tax credit was 3.3 million	in the quarter the tax credit was 3.3 million
norfolk southern went up 1 1\/8 to 37 7\/8	norfolk southern went 1 1\/8 to 37 7\/8
it 's difficult to be that consistently wrong	it 's difficult to be that wrong
analysts expect others to show a similar pattern	analysts expect others to show a pattern
they serve the industries and the special-interest groups	they serve the industries and the groups
the day was saturated with the weight of its own impending history	the day was saturated with the weight of its history
so are indiana ohio and michigan	are indiana ohio and michigan
our teachers are not an important factor in our educational crisis	our teachers are not an factor in our crisis
the dow jones industrial average opened down 1.64 shortly after 9:30	the dow jones industrial average opened 1.64 after 9:30
it stopped selling a standard personal computer a while ago	it stopped selling a computer a while
okay now you can pick up that phone	okay you can pick up that phone
a few months later mr. bush became ronald reagan 's running mate	a months mr. bush became ronald reagan 's mate
that 's more than 10 times the usual housing site size	that 's than 10 times the housing site size
over time the odds increasingly favor the investor with a diversified portfolio	over time the odds favor the investor with a portfolio
the harvest delays however are expected to be temporary	the harvest delays are expected to be temporary
like many sports buffs mr. engelken has turned cynic	like sports buffs mr. engelken has turned cynic
company with 1,750 workers in area is fully functional	company with 1,750 workers in area is functional
unless he changes they lose said a democratic leadership aide	unless he changes they lose said a leadership aide
that 's just what joseph granville expects	that 's what joseph granville expects
world-wide production would be cut in half by 1998	production would be cut in half by 1998
nine-month revenue was 1.02 billion up 22 % from 841.5 million	revenue was 1.02 billion 22 % from 841.5 million
maybe it 's not that simple	it 's not simple
not quite sen. leahy contends	sen. leahy contends
but it does n't always work so smoothly	but it does n't work
people will learn to be more circumspect	people will learn to be circumspect
he 's totally geared to a punitive position	he 's geared to a position
to reinforce employees ' dedication mr. smith pays well	to reinforce employees ' dedication mr. smith pays
unilever wo n't comment schering however denies the brand is for sale	unilever wo n't comment schering denies the brand is for sale
politburo member joachim herrman confessed to a grave concern over hungarian democracy	politburo member joachim herrman confessed to a concern over democracy
the subscribers are in 52 different communities in georgia alabama and mississippi	the subscribers are in 52 communities in georgia alabama and mississippi
it is currently waiving management fees which contributes to the higher yield	it is waiving management fees which contributes to the yield
i am a devout catholic says mr. pignatelli a 40-year-old health officer	i am a catholic says mr. pignatelli a health officer
giveaways just give people the wrong image said mr. heinemann	giveaways give people the image said mr. heinemann
and avoiding such losses will take a monumental effort	and avoiding losses will take a effort
japan has found another safe outlet for its money u.s. home mortgages	japan has found another outlet for its money u.s. home mortgages
earnings have plummeted too in each of the past three quarters	earnings have plummeted in each of the three quarters
the following issues were recently filed with the securities and exchange commission	the following issues were filed with the securities and exchange commission
the bikes are unwelcome on trails in national parks	the bikes are unwelcome on trails in parks
but most investors were seeking share prices and other information	but investors were seeking share prices and information
yesterday when similar securities rebounded it bumped the valuation up again	yesterday when securities rebounded it bumped the valuation up
i have felt many aftershocks	i have felt aftershocks
but so far mr. paul and his advisers are holding fast	but mr. paul and his advisers are holding
also smithkline beecham rose 1 3\/8 to 39 1\/2	smithkline beecham rose 1 3\/8 to 39 1\/2
put march 31 1992 at fixed 107 13\/16 to yield 3.43 %	put march 31 1992 at 107 13\/16 to yield 3.43 %
yet they are far and away the most prolific producers in hollywood	they are and the prolific producers in hollywood
most analysts had expected the government to report a 4 % decline	analysts had expected the government to report a 4 % decline
a similar proposal may be introduced soon by senate democrats	a proposal may be introduced by senate democrats
the airport 's biggest supplier of aircraft fuel is the soviet union	the airport 's supplier of aircraft fuel is the soviet union
and if the europeans come in they benefit too	and if the europeans come they benefit
the p53 gene has just been implicated in lung cancer	the p53 gene has been implicated in lung cancer
was 300 ft. out on a pier in san rafael	was 300 ft. on a pier in san rafael
those percentages hardly changed from the previous year 's poll	those percentages changed from the year 's poll
top officers insist maidenform 's greatest strength is its family ownership	officers insist maidenform 's strength is its family ownership
phil harms a software engineer was an eager customer	phil harms a software engineer was an customer
it flopped all around real dramatic	it flopped all around dramatic
and apparently it is here to stay	and it is to stay
the main reason remains weather	the reason remains weather
the actual disciplinary hearings will be public	the hearings will be public
responding to that demand however has led to a variety of compromises	responding to that demand has led to a variety of compromises
it makes sense from a strategic standpoint	it makes sense from a standpoint
sotheby 's has been aggressively promoting the dorrance sale	sotheby 's has been promoting the dorrance sale
the 30-share index settled 42.0 points lower at 1678.5	the index settled 42.0 points lower at 1678.5
goldman sachs & co. and drexel burnham lambert inc. are lead underwriters	goldman sachs & co. and drexel burnham lambert inc. are underwriters
sadly the cycle appears not as waves but as a downward spiral	the cycle appears not as waves but as a spiral
gasb rules still apply for other government units	gasb rules apply for government units
geeks by at least one definition are chicken-mutilating circus freaks	geeks by at one definition are circus freaks
amex short interest climbed 3 % to 53,496,665 shares from 51,911,566 shares	amex interest climbed 3 % to 53,496,665 shares from 51,911,566 shares
heating oil prices also rose	heating oil prices rose
ms. malcolm had mr. masson describing himself as an intellectual gigolo	ms. malcolm had mr. masson describing himself as an gigolo
in the short term the move is likely to have little effect	in the term the move is likely to have effect
banks are continuing to go after individual investors despite falling interest rates	banks are continuing to go after investors despite falling interest rates
the states have their own ideas about regulation and certification	the states have their ideas about regulation and certification
six-year-old pace based in aurora colo. operates 41 warehouse-club stores	pace based in aurora colo. operates 41 warehouse-club stores
but says mr. bock it was a close call	but says mr. bock it was a call
similarly the big board hopes to entice merrill lynch & co	the big board hopes to entice merrill lynch & co
it certainly was n't intended to be a demotion the spokesman said	it was n't intended to be a demotion the spokesman said
so he advises make goals achievable	he advises make goals achievable
among other blue chips exxon gained 1\/8 to 45 1\/2	among chips exxon gained 1\/8 to 45 1\/2
the dispute shows clearly the global power of japan 's financial titans	the dispute shows the power of japan 's titans
the cuts will be made half within germany and half abroad	the cuts will be made half within germany and half
but it wo n't be a boom again	but it wo n't be a boom
but these wide swings scare them to death	but these swings scare them to death
it was quite a shock says a 43-year-old east german shopkeeper	it was a shock says a shopkeeper
in a great restaurant do n't deprive yourself	in a restaurant do n't deprive yourself
but it still might be cheaper than taking a major hit	but it might be cheaper than taking a hit
however for many managing speed does not come naturally	for many managing speed does not come
it 's a quiet retreat said mr. howley	it 's a retreat said mr. howley
newly acquired assets would get a bigger break than those currently held	acquired assets would get a break than those held
ms. mcglade of painewebber raised a more fundamental question about the deal	ms. mcglade of painewebber raised a question about the deal
her story is becoming part of local folklore	her story is becoming part of folklore
merrill lynch 's profit slid 37 % in the third quarter	merrill lynch 's profit slid 37 % in the quarter
but a lower bid could face rejection by the ual board	but a bid could face rejection by the ual board
the defendants could n't immediately be reached for comment	the defendants could n't be reached for comment
the company said it was delaying construction because of current market conditions	the company said it was delaying construction because of market conditions
the vatican was in the red last year	the vatican was in the red year
in other words they treat you like a piece of meat	in words they treat you like a piece of meat
that 's good news because we all swim in this water	that 's news because we all swim in this water
certain details of the restructured facilities remain to be negotiated	details of the restructured facilities remain to be negotiated
he succeeds william kohut who resigned earlier this year	he succeeds william kohut who resigned this year
it now takes something really weird to inspire public outrage	it takes something weird to inspire outrage
personal-computer maker ast research inc. said it is still studying the situation	personal-computer maker ast research inc. said it is studying the situation
in september kellogg co. launched a competing psyllium-fortified cereal called heartwise	in september kellogg co. launched a competing cereal called heartwise
but there was no way to prove dr. knudson 's two-hit theory	but there was no way to prove dr. knudson 's theory
it was nasdaq 's biggest percentage gainer	it was nasdaq 's percentage gainer
merrill lynch capital markets inc. is the sole underwriter for the offering	merrill lynch capital markets inc. is the underwriter for the offering
such problems may not be over	problems may not be over
nasdaq 's gain was led by its biggest industrial stocks	nasdaq 's gain was led by its stocks
it is the stuff of dreams but also of traumas	it is the stuff of dreams but of traumas
but japanese bonds ended weaker	but bonds ended weaker
the proposal values the company 's real estate operation at 2 billion	the proposal values the company 's estate operation at 2 billion
as people get even older many become widowed	as people get older many become widowed
for financial analysts reading omni 's accounts is a tough challenge	for analysts reading omni 's accounts is a challenge
then came the earthquake and a damaging delay of 11 days	came the earthquake and a delay of 11 days
weatherford currently has approximately 11.1 million common shares outstanding	weatherford has 11.1 million shares outstanding
there is a reality to the excess energy he said	there is a reality to the energy he said
senator pete domenici calls this effort the first gift of democracy	senator pete domenici calls this effort the gift of democracy
he has two more years at texas a&m	he has two years at texas a&m
my colleagues and i fully realize we are not a court etc	my colleagues and i realize we are not a court etc
it 's an unrealistic expectation	it 's an expectation
the economic ideas in the document are much bolder than current policies	the ideas in the document are bolder than policies
the company earned 6.6 million in the year-earlier quarter	the company earned 6.6 million in the quarter
ortega had threatened to end a 19-month-old ceasefire	ortega had threatened to end a ceasefire
it is a peaceful time in this part of western india	it is a time in this part of india
the wind stinging with sand never seems to stop	the wind with sand seems to stop
but he said dentsu has n't looked seriously at saatchi	but he said dentsu has n't looked at saatchi
if i can show signs of maturity almost anybody can he jokes	if i can show signs of maturity anybody can he jokes
interest during first year paid semiannually at 7.51 %	interest during year paid at 7.51 %
most other bonds however would probably not have fared much better	bonds would not have fared
operating profit dropped 35 % however to 3.8 million	operating profit dropped 35 % to 3.8 million
cri which sponsors champs is a world-wide real estate investment firm	cri which sponsors champs is a estate investment firm
cbs may remain a distant no. 3 in that regard	cbs may remain a no. 3 in that regard
before the 1987 crash the p\/e was more than 20	before the 1987 crash the p\/e was than 20
it has a similar project for 200,000 cars a year	it has a project for 200,000 cars a year
yellow pages advertising sales rose 11.8 % to 41.2 million	pages advertising sales rose 11.8 % to 41.2 million
the action renews concern about buyouts in high-tech industries	the action renews concern about buyouts in industries
this is a total bloodbath for takeover-stock traders one investment banker said	this is a bloodbath for takeover-stock traders one investment banker said
arm troubles forced him back to the minors the next year	arm troubles forced him to the minors the year
already the fight has been costly	the fight has been costly
it 's understood several compromises already have been worked into the plan	it 's understood compromises have been worked into the plan
in offices triphosphorous bulbs simulate daylight	in offices bulbs simulate daylight
analysts said they expect mccaw to escalate the bidding again	analysts said they expect mccaw to escalate the bidding
many law firms sponsor their own programs	law firms sponsor their programs
results for the earlier quarter included a 100,000 restructuring charge	results for the quarter included a 100,000 restructuring charge
now you see it now you do n't	you see it you do n't
meanwhile the big players have n't tried to copy the nec standard	the players have n't tried to copy the nec standard
the system also provides course-correction advisories	the system provides course-correction advisories
abc had based its budget for baseball on a six-game series	abc had based its budget for baseball on a series
they currently have large orders for cargo planes	they have orders for cargo planes
maybe we recognize values the other guys do n't mr. pilson says	we recognize values the guys do n't mr. pilson says
the interview did not touch on singapore 's domestic affairs	the interview did not touch on singapore 's affairs
yet the bill is riding high on the furor over drug trafficking	the bill is riding high on the furor over drug trafficking
but city officials say tax revenues are lagging	but city officials say tax revenues are
a federal judge turned down the chapter 11 petition	a judge turned down the chapter 11 petition
the share buy-back plan is likely to underpin b.a.t 's share price	the share plan is likely to underpin b.a.t 's share price
these guys prey on human frailties	these guys prey on frailties
prospective competition is one problem	competition is one problem
she did n't have hot water for five days	she did n't have water for five days
rolled copper product sales were major contributors to overall sales growth	rolled copper product sales were contributors to sales growth
this could be the first major bankruptcy-law proceeding for kkr he adds	this could be the bankruptcy-law proceeding for kkr he adds
mr. cremonie 's firm once held about 4.8 % of h&r block	mr. cremonie 's firm held about 4.8 % of h&r block
the series typically is among the highest-rated sports events on television	the series is among the sports events on television
it expects a 1.42 billion quarterly loss	it expects a 1.42 billion loss
after years of fading into the background two-tone photography is coming back	after years of fading into the background photography is coming
these people are n't necessarily stupid or naive	these people are n't stupid or naive
nissan will introduce a completely revamped sentra next fall	nissan will introduce a revamped sentra fall
inland said its third-quarter results will be announced later this week	inland said its results will be announced this week
earlier this month another effort to choose a commissioner failed	this month another effort to choose a commissioner failed
and beauregard was mentioned twice although very briefly and in passing	and beauregard was mentioned although very briefly and in passing
trouble was nobody thought they looked right	trouble was nobody thought they looked
he is going to pursue other interests mr. jahn said	he is going to pursue interests mr. jahn said
some analysts are cynical about the new corporate interest in health-care overhaul	some analysts are cynical about the interest in health-care overhaul
but for photofinishers developing costs for black-and-white film are higher	but for photofinishers developing costs for film are higher
i 'm really wiped out after walking five hours she says	i 'm wiped out after walking five hours she says
companies that only recently were thriving find themselves scrambling to survive	companies that were find themselves scrambling to survive
but it 's in very early stages still	but it 's in early stages
