mr. gonzalez is not quite a closet supply-side revolutionary however	mr. gonzalez was not quite a closet supply-side revolutionary however
now he can go further	now he could go further
the index uses a base of 100 in 1982	the index used a base of 100 in 1982
meanwhile general motors and ford motor continue their pursuit of the company	meanwhile general motors and ford motor continued their pursuit of the company
the issue is n't age age is just a number	the issue was n't age age was just a number
i 've had no problems performing my duties and responsibilities	i 'ved had no problems performing my duties and responsibilities
the bill is expected to pass in congress next month	the bill was expected to pass in congress next month
but mr. runkel contends there has been no exodus of strike-force lawyers	but mr. runkel contended there had been no exodus of strike-force lawyers
some congressional leaders intend to continue to fight for independent strike forces	some congressional leaders intended to continue to fight for independent strike forces
we will vigorously oppose the bill he says	we vigorously oppose the bill he said
i do n't think the reorganization is going to happen	i did n't think the reorganization was going to happen
whitman & ransom recruits lawyers from disbanding firm	whitman & ransom recruited lawyers from disbanding firm
golenbock with 35 lawyers has lost several partners during the past year	golenbock with 35 lawyers had lost several partners during the past year
do you think the british know something that we do n't	do you thought the british knew something that we did n't
neither is going to back down easily	neither was going to back down easily
first the price of natural gas will have to almost double	first the price of natural gas had to almost double
the forest-products concern currently has about 38 million shares outstanding	the forest-products concern currently had about 38 million shares outstanding
the offer is scheduled to expire on nov. 28 unless extended	the offer was scheduled to expire on nov. 28 unless extended
here are details of yesterday 's three-month and six-month bill auction	here were details of yesterday 's three-month and six-month bill auction
both issues are dated oct. 31	both issues were dated oct. 31
here are details of yesterday 's 51-day cash management bill auction	here were details of yesterday 's 51-day cash management bill auction
the bills are dated oct. 31 and mature dec. 21 1989	the bills were dated oct. 31 and mature dec. 21 1989
it 's not going to stop it at all	it was not going to stop it at all
a program-bashing move is clearly on	a program-bashing move was clearly on
the new company is capitalized at about 3.5 million	the new company was capitalized at about 3.5 million
it also hopes to enter the u.s. market	it also hopped to enter the u.s. market
the insurance adjusters think differently	the insurance adjusters thought differently
the current backlog of orders is strong throughout the corporation he said	the current backlog of orders was strong throughout the corporation he said
by contrast surgical abortion is 99 % effective	by contrast surgical abortion was 99 % effective
nausea and vomiting are other common side effects	nausea and vomiting were other common side effects
timing is of the essence with ru-486	timing was of the essence with ru-486
that is typically about a three-week window	that was typically about a three-week window
so far all the studies have concluded that ru-486 is safe	so far all the studies had concluded that ru-486 was safe
but there are no scientific data on this question	but there were no scientific data on this question
some abortion advocates have been asking themselves this very question	some abortion advocates had been asking themselves this very question
following the feminist and population-control lead has been a generally bovine press	following the feminist and population-control lead had been a generally bovine press
remember the dalkon shield and the early birth-control pills	remembered the dalkon shield and the early birth-control pills
mrs. allen is a senior editor of insight magazine	mrs. allen was a senior editor of insight magazine
this article is adapted from one in the october american spectator	this article was adapted from one in the october american spectator
forty million in the total scheme of things is not that significant	forty million in the total scheme of things was not that significant
please contribute what you can the ad said	please contributed what you could the ad said
that has n't deterred plenty of companies	that had n't deterred plenty of companies
what did we get out of it	what did we got out of it
the ultimate form of charity is when you do n't tell anyone	the ultimate form of charity was when you did n't tell anyone
we do n't consider that ambulance chasing	we did n't consider that ambulance chasing
new york life has been doing the same for over 140 years	new york life had been doing the same for over 140 years
miller brewing co. will introduce its first non-alcoholic beer jan. 1	miller brewing co. introduced its first non-alcoholic beer jan. 1
he adds i think this is a great strategic move for quebecor	he added i thought this was a great strategic move for quebecor
they are buying an operation that is running well	they were buying an operation that was running well
size does n't matter mr. peladeau says	size did n't matter mr. peladeau said
what counts is the bottom line	what counted was the bottom line
the venture cost quebecor 12 million mr. peladeau says	the venture cost quebecor 12 million mr. peladeau said
i 've read balzac he answers critics	i 'ved read balzac he answered critics
it 's tabloid news from a to z	it was tabloid news from a to z
quebecor will own 57.5 % of the new subsidiary	quebecor owned 57.5 % of the new subsidiary
now the personal-computer revolution is finally reaching japan	now the personal-computer revolution was finally reaching japan
productivity in japanese offices is relatively low	productivity in japanese offices was relatively low
apple computer inc. has doubled its staff here over the past year	apple computer inc. had doubled its staff here over the past year
but the japanese have to go a long way to catch up	but the japanese had to go a long way to catch up
some machines make charts for presentations	some machines made charts for presentations
to transmit charts to branch offices they use a fax machine	to transmit charts to branch offices they used a fax machine
in japan about 1 % are linked	in japan about 1 % were linked
various cultural and economic forces have suppressed demand	various cultural and economic forces had suppressed demand
but the complex language is n't the only reason	but the complex language was n't the only reason
with little competition the computer industry here is inefficient	with little competition the computer industry here was inefficient
that is the state of japan 's computer industry	that was the state of japan 's computer industry
meanwhile the big players have n't tried to copy the nec standard	meanwhile the big players had n't tried to copy the nec standard
the result according to many analysts is higher prices and less innovation	the result according to many analysts was higher prices and less innovation
there are no price wars no competition	there were no price wars no competition
but the market is changing	but the market was changing
the government is funding several projects to push pc use	the government was funding several projects to push pc use
meanwhile more computer makers now are competing for the new business	meanwhile more computer makers now were competing for the new business
it has won about 15 % of the retail pc market	it had won about 15 % of the retail pc market
but the americans are also to blame	but the americans were also to blame
critics also say american companies charge too much	critics also said american companies charged too much
but the u.s. companies are redoubling their efforts	but the u.s. companies were redoubling their efforts
but it 's an enormous business opportunity	but it was an enormous business opportunity
those rights prevent anyone other than revco from proposing a reorganization plan	those rights prevented anyone other than revco from proposing a reorganization plan
mr. bass is based in fort worth	mr. bass was based in fort worth
revco has 1.5 billion in claims outstanding	revco had 1.5 billion in claims outstanding
they want to pretend it does n't exist he said	they wanted to pretend it did n't exist he said
edisto currently is the general partner of nrm	edisto currently was the general partner of nrm
four other countries in europe have approved proleukin in recent months	four other countries in europe had approved proleukin in recent months
cetus is currently trying to obtain federal regulatory clearance for u.s. distribution	cetus was currently trying to obtain federal regulatory clearance for u.s. distribution
that is a property right that belongs to the performer	that was a property right that belonged to the performer
few petitions however have actually delayed or scuttled mergers	few petitions however had actually delayed or scuttled mergers
if there 's somethin' strange in your neighborhood	if there was somethin' strange in your neighborhood
if there 's something weird and it do n't look good	if there was something weird and it did n't look good
who ya gon na call	who ya gonned na call
for starters some people call ed and lorraine warren	for starters some people called ed and lorraine warren
either way the ghostbusting business is going like gangbusters	either way the ghostbusting business was going like gangbusters
the committee formed in 1967 now has 60 chapters around the world	the committee formed in 1967 now had 60 chapters around the world
mr. baker heads the kentucky association of science educators and skeptics	mr. baker headed the kentucky association of science educators and skeptics
i 'm not sure he 's explained everything mrs. stinnett says grudgingly	i was not sure he 's explained everything mrs. stinnett said grudgingly
mr. baker promises to return if the haunting continues	mr. baker promised to return if the haunting continued
i tell people it 's the groundup bones of saints he says	i told people it was the groundup bones of saints he said
i sprinkle a little around and tell the demons to leave	i sprinkled a little around and tell the demons to leave
it 's reassuring and it usually works	it was reassuring and it usually worked
invariably he says eyewitnesses are untrustworthy	invariably he said eyewitnesses were untrustworthy
but sometimes more energetic attacks are required	but sometimes more energetic attacks were required
i attend and so does a television crew from new york city	i attended and so did a television crew from new york city
mr. warren pronounces the litchfield case your typical demonic infestation	mr. warren pronounced the litchfield case your typical demonic infestation
two previous exorcisms have failed	two previous exorcisms had failed
this is a very tenacious ghost mr. warren says darkly	this was a very tenacious ghost mr. warren said darkly
suddenly the woman begins swaying and then writhing	suddenly the woman began swaying and then writhing
she declines to show them	she declined to show them
this time though he says i think we got it	this time though he said i thought we got it
hospital regulation sparks kentucky feud	hospital regulation sparked kentucky feud
which is the best medicine for runaway health costs competition or regulation	which bed the best medicine for runaway health costs competition or regulation
mr. conn charges that humana 's own actions undermine its argument	mr. conn charged that humana 's own actions undermined its argument
debt-burdened doctors seek financial security	debt-burdened doctors seeked financial security
they 're looking for something that 's very safe	they were looking for something that was very safe
that 's 115 % more than in 1981	that was 115 % more than in 1981
money is n't the only reason for the shift in practice preferences	money was n't the only reason for the shift in practice preferences
this is a change in the social fabric of medicine he says	this was a change in the social fabric of medicine he said
related roommates trim hospital bills	related roommates trimmed hospital bills
it was certainly good to have him handy mrs. bobar says	it was certainly good to have him handy mrs. bobar said
recently japan has been buying copper elsewhere	recently japan had been buying copper elsewhere
i feel sorry for whoever wins says a brazilian diplomat	i felt sorry for whoever won said a brazilian diplomat
who that winner will be is highly uncertain	who that winner bed was highly uncertain
the uncertainty is sending shivers through brazilian financial markets	the uncertainty was sending shivers through brazilian financial markets
capital flight is reported to be strong	capital flight was reported to be strong
and where we are is bad	and where we were was bad
among the results is a frequent breakdown of public services	among the results was a frequent breakdown of public services
officials also say a national electricity shortage might not be far off	officials also said a national electricity shortage might not be far off
completion of the project is expected by mid-1992	completion of the project was expected by mid-1992
mazda makes the tracer for ford	mazda made the tracer for ford
the minimum unit is 100,000	the minimum unit was 100,000
they are piggybacking onto developed technology he said	they were piggybacking onto developed technology he said
his election increases ryder 's board to 14 members	his election increased ryder 's board to 14 members
a big pension-insurance case will be reviewed by the supreme court	a big pension-insurance case bed reviewed by the supreme court
known as easy eggs the product has disappointed investors	known as easy eggs the product had disappointed investors
easy eggs are pasteurized in a heat-using process	easy eggs were pasteurized in a heat-using process
but burger king operators independently confirm using michael 's product	but burger king operators independently confirmed using michael 's product
many analysts question management 's credibility	many analysts questioned management 's credibility
prospective competition is one problem	prospective competition was one problem
hewlett-packard will charge 5,000 for a license covering 10 users	hewlett-packard charged 5,000 for a license covering 10 users
only 36 of 1,200 priority cleanup sites have been decontaminated	only 36 of 1,200 priority cleanup sites had been decontaminated
over the next 50 years 500 billion is earmarked for the program	over the next 50 years 500 billion was earmarked for the program
stick some money in an interest-bearing account and watch it grow	stuck some money in an interest-bearing account and watch it grew
in short throw away the passbook and go for the glory	in short threw away the passbook and go for the glory
a year at harvard now goes for 19,395	a year at harvard now went for 19,395
stanford mit and other utmosts will cost no less	stanford mit and other utmosts cost no less
others prefer deep-discount zero-coupon bonds	others prefered deep-discount zero-coupon bonds
that 's the dilemma for today 's parent	that was the dilemma for today 's parent
and then there 's always state u	and then there was always state u
forget about treasury bills or a money-market fund	forgot about treasury bills or a money-market fund
the latest wave of marketing is instructive	the latest wave of marketing was instructive
not everyone is so pessimistic	not everyone was so pessimistic
their compounding effect is also alluring	their compounding effect was also alluring
mr. anderson wants the prestige colleges to sponsor such a plan	mr. anderson wanted the prestige colleges to sponsor such a plan
prepayments much like mutual-fund purchases are pooled for investment	prepayments much like mutual-fund purchases were pooled for investment
its plan is set up as an independent agency	its plan was set up as an independent agency
mr. putka covers education from the wall street journal 's boston bureau	mr. putka covered education from the wall street journal 's boston bureau
polymerix makes lumber-like materials that it describes as plastic wood	polymerix made lumber-like materials that it described as plastic wood
the operating chief 's post is new	the operating chief 's post was new
he remains chief executive officer	he remained chief executive officer
there is a reality to the excess energy he said	there was a reality to the excess energy he said
the u.s. is required to notify foreign dictators of certain coup plans	the u.s. bed required to notify foreign dictators of certain coup plans
the incident occurred saturday night	the incident occured saturday night
reward el espectador 's courage with real support	rewarded el espectador 's courage with real support
reggie jackson the retired baseball star has found another use for them	reggie jackson the retired baseball star had found another use for them
who knows how much they 'll be worth 100 years from now	who knew how much they 'll be worth 100 years from now
i do n't think the checks are worth 15 apiece he says	i did n't think the checks were worth 15 apiece he said
he probably has n't done it for the cash	he probably had n't done it for the cash
and mr. jackson probably has opened new checking accounts too	and mr. jackson probably had opened new checking accounts too
estimated and actual results involving losses are omitted	estimated and actual results involving losses were omitted
otherwise actual profit is compared with the 300-day estimate	otherwise actual profit was compared with the 300-day estimate
adverse pressure on gross margins has subsided mr. sculley said	adverse pressure on gross margins had subsided mr. sculley said
mail-order ministers have been squelched	mail-order ministers had been squelched
now television and radio evangelists are under scrutiny	now television and radio evangelists were under scrutiny
the independent-contractor project which began in 1988 involves about 350 irs agents	the independent-contractor project which began in 1988 involved about 350 irs agents
shippers are saying the party 's over said mr. lalonde	shippers were saying the party was over said mr. lalonde
not everyone believes that the good times are over for shippers	not everyone believed that the good times were over for shippers
and ship lines carrying containers are also trying to raise their rates	and ship lines carrying containers were also trying to raise their rates
keeping the listed price at a dollar is primarily a convenience	keeping the listed price at a dollar was primarily a convenience
actually the funds do fluctuate but beyond the third decimal place	actually the funds did fluctuated but beyond the third decimal place
rounding-off keeps them at 1	rounding-off kept them at 1
the companion tax-exempt funds add 71 billion	the companion tax-exempt funds added 71 billion
seats are currently quoted at 430,000 bid and 525,000 asked	seats were currently quoted at 430,000 bidded and 525,000 asked
in some cases competition has squeezed margins	in some cases competition had squeezed margins
but not every company expects to report increased earnings	but not every company expected to report increased earnings
hospitals companies meanwhile are reporting improved earnings	hospitals companies meanwhile were reporting improved earnings
most important hospital admission rates are stabilizing after several years of decline	most important hospital admission rates were stabilizing after several years of decline
more banks are being hurt by arizona 's worsening real-estate slump	more banks were being hurt by arizona 's worsening real-estate slump
freight rates are bottoming out and starting to rebound	freight rates were bottoming out and starting to rebound
texaco has purchased an oil-producing company in texas for 476.5 million	texaco had purchased an oil-producing company in texas for 476.5 million
the transaction represents lynch 's entry into the telephone business	the transaction represented lynch 's entry into the telephone business
they root among the designer offerings at neiman-marcus and bullocks wilshire	they rooted among the designer offerings at neiman-marcus and bullocks wilshire
they stroll through the marble-encased corridors of the atrium court	they strolled through the marble-encased corridors of the atrium court
we call them fraud farms	we called them fraud farms
newport beach fits the scam artists ' specifications perfectly	newport beach fitted the scam artists ' specifications perfectly
that 's what they 're after	that was what they were after
the investors range from elderly widows to affluent professionals	the investors ranged from elderly widows to affluent professionals
the newport beach operators also tend to indulge themselves privately	the newport beach operators also tended to indulge themselves privately
as a result of the sales he holds 6,727,042 shares	as a result of the sales he held 6,727,042 shares
meanwhile overall evidence on the economy remains fairly clouded	meanwhile overall evidence on the economy remained fairly clouded
u.k. base rates are at their highest level in eight years	u.k. base rates were at their highest level in eight years
profit systems valley stream n.y. is an air freight forwarding concern	profit systems valley stream n.y. was an air freight forwarding concern
the second portion will be completed the following year	the second portion bed completed the following year
tangible capital will be about 115 million	tangible capital bed about 115 million
the merger is subject to regulatory clearance and a definitive agreement	the merger was subject to regulatory clearance and a definitive agreement
webster has 3.5 million shares outstanding and eagle 2.6 million	webster had 3.5 million shares outstanding and eagle 2.6 million
it 's traders squaring positions	it was traders squaring positions
it 's not good the market is setting up for another fall	it was not good the market was setting up for another fall
outstanding contracts are those that remain to be liquidated	outstanding contracts were those that remained to be liquidated
there has been a tremendous increase in mmi positions mr. selkin said	there had been a tremendous increase in mmi positions mr. selkin said
he also says he is losing money now	he also said he was losing money now
high-end u.s. furriers say these imports have n't squeezed them	high-end u.s. furriers said these imports had n't squeezed them
yet mr. rosen has turned the import phenomenon to his advantage	yet mr. rosen had turned the import phenomenon to his advantage
inspired by imports mr. rosen now makes fur muffs hats and flings	inspired by imports mr. rosen now made fur muffs hats and flings
other furriers have also benefited from leathers	other furriers had also benefited from leathers
he says it accounts for 25 % of total sales	he said it accounted for 25 % of total sales
mr. rosen is also pushing retail sales	mr. rosen was also pushing retail sales
other furriers have also placed more weight on retailing	other furriers had also placed more weight on retailing
aftereffects of the 1987 stock market crash head the list of reasons	aftereffects of the 1987 stock market crash headed the list of reasons
the animal-rights movement has n't helped sales	the animal-rights movement had n't helped sales
and those who did n't move some production overseas suffer labor shortages	and those who did n't move some production overseas suffered labor shortages
but mr. rosen responds whatever people want to buy i 'll sell	but mr. rosen responded whatever people wanted to buy i 'll sell
the name of the game is to move goods	the name of the game was to move goods
the new line is aimed directly at international business machines corp	the new line was aimed directly at international business machines corp
you just call your broker and say buy or sell	you just called your broker and say bought or sell
i like to use them to feel out the market he says	i liked to use them to feel out the market he said
on the close can be added to many types of orders	on the close could be added to many types of orders
most brokers assume that all orders are day orders unless specified otherwise	most brokers assumed that all orders were day orders unless specified otherwise
the percentage change is since year-end	the percentage change was since year-end
more than 700 people work in the gte building	more than 700 people worked in the gte building
the journal also will offer expanded volume and frequency discounts	the journal also offered expanded volume and frequency discounts
rates for the wall street journal reports will remain unchanged	rates for the wall street journal reports remained unchanged
no safety problems with the products are known the fda said	no safety problems with the products were known the fda said
both regions are the fastest-growing areas for basf the company said	both regions were the fastest-growing areas for basf the company said
ual currently has 22.6 million shares fully diluted	ual currently had 22.6 million shares fully diluted
i refer essentially to petroleum electric power banking and newsprint	i refered essentially to petroleum electric power banking and newsprint
those enterprises however are not going to be privatized	those enterprises however were not going to be privatized
