the companies are automotive-emissions-testing concerns	the companies were automotive-emissions-testing concerns
many economists expect the weakness to continue	many economists expected the weakness to continue
all the figures are adjusted for seasonal variations	all the figures were adjusted for seasonal variations
here is the commerce department 's latest report on personal income	here was the commerce department 's latest report on personal income
the figures are at seasonally adjusted annual rates in trillions of dollars	the figures were at seasonally adjusted annual rates in trillions of dollars
the transaction is expected to close around year end	the transaction was expected to close around year end
the year-earlier results have been restated to reflect an accounting change	the year-earlier results had been restated to reflect an accounting change
goldman sachs & co. is the underwriter	goldman sachs & co. was the underwriter
there still are some details to be nailed down	there still were some details to be nailed down
some conservatives will accuse the president of promising congress too much	some conservatives accused the president of promising congress too much
mr. dorgen has changed tactics dropping the seat-for-the-secretary idea	mr. dorgen had changed tactics dropping the seat-for-the-secretary idea
the urging admittedly has been gentle	the urging admittedly had been gentle
the central bank has been helping but apparently not especially eagerly	the central bank had been helping but apparently not especially eagerly
the dollar is still highly volatile	the dollar was still highly volatile
i view this as a building	i viewed this as a building
at the core of it all is a love for plants	at the core of it all was a love for plants
lindens need about 36 feet	lindens needed about 36 feet
i 'm not going to address questions of safety	i was not going to address questions of safety
mr. quennell has said he plans to go with the grid regardless	mr. quennell had said he planned to go with the grid regardless
the ira 's conception is murky	the ira 's conception was murky
ira himself confirms this account	ira himself confirmed this account
ira rules have been changed over the years	ira rules had been changed over the years
mr. trivelpiece 58 years old succeeds william bolger who died in august	mr. trivelpiece 58 years old succeeded william bolger who died in august
it is n't yet clear whether the 200-ruble limit will be lifted	it was n't yet clear whether the 200-ruble limit bed lifted
the coin is their problem	the coin was their problem
after cooling the coins are then rewrapped	after cooling the coins were then rewrapped
and while the job is half done brooks is still bitter	and while the job was half done brooks was still bitter
he is negotiating a rich book contract to boot	he was negotiating a rich book contract to boot
mr. deaver has reopened a public-relations business	mr. deaver had reopened a public-relations business
it now takes something really weird to inspire public outrage	it now took something really weird to inspire public outrage
not all the scandal-tripped have enjoyed soft landings	not all the scandal-tripped had enjoyed soft landings
for there is an emerging protocol indeed an etiquette to it	for there was an emerging protocol indeed an etiquette to it
i feel better than i ever have in my life he says	i felt better than i ever had in my life he said
but it does n't always work so smoothly	but it did n't always work so smoothly
mr. fedders is philosophical about his travails	mr. fedders was philosophical about his travails
this whole experience has been an opportunity for internal growth he says	this whole experience had been an opportunity for internal growth he said
he sees a psychoanalyst five mornings a week	he saw a psychoanalyst five mornings a week
i 've surrendered to the circumstances mr. fedders says	i 'ved surrendered to the circumstances mr. fedders said
the word surrender has a precise psychoanalytic meaning	the word surrender had a precise psychoanalytic meaning
i 'm enjoying my life and who i am today	i was enjoying my life and who i was today
the aspect of being a mega-lawyer is n't as important	the aspect of being a mega-lawyer was n't as important
it helps to be male	it helped to be male
male scandal victims invariably fare better	male scandal victims invariably fared better
what accounts for the difference	what accounted for the difference
if sex is involved all bets are off	if sex bed involved all bets bed off
you can be wicked but not foolish says mr. mankiewicz	you could be wicked but not foolish said mr. mankiewicz
mr. bauman a conservative says he was deserted by the right wing	mr. bauman a conservative said he was deserted by the right wing
conservatives shoot their own he says	conservatives shot their own he said
other scandal survivors are sometimes the best source of solace	other scandal survivors were sometimes the best source of solace
he reassured me that the hurricane would end mr. deaver recalls	he reassured me that the hurricane would end mr. deaver recalled
all of the bidders contemplate full payment including interest to secured creditors	all of the bidders contemplated full payment including interest to secured creditors
united illuminating 's plan however offers more for unsecured creditors	united illuminating 's plan however offered more for unsecured creditors
northeast utilities ' plan proposes 5.5 % annual increases	northeast utilities ' plan proposed 5.5 % annual increases
the appointments are effective nov. 1	the appointments were effective nov. 1
even so his bill is given little chance of passage	even so his bill was given little chance of passage
the strategy boosts current yield by putting more bonds into the portfolio	the strategy boosted current yield by putting more bonds into the portfolio
trouble is junk bond prices have been weak for months	trouble was junk bond prices had been weak for months
thus the leverage has amplified the funds ' portfolio losses	thus the leverage had amplified the funds ' portfolio losses
leverage is used only by some of the closed-end funds	leverage was used only by some of the closed-end funds
the fallout for investors lately has been painful	the fallout for investors lately had been painful
consider the new america high income fund	considered the new america high income fund
fund managers for their part defend their use of leverage	fund managers for their part defended their use of leverage
yet some funds have pulled in their horns	yet some funds had pulled in their horns
but a few funds have taken other defensive steps	but a few funds had taken other defensive steps
some have raised their cash positions to record levels	some had raised their cash positions to record levels
high cash positions help buffer a fund when the market falls	high cash positions helped buffered a fund when the market fell
other funds have recently sold weak junk bonds to raise cash	other funds had recently sold weak junk bonds to raise cash
but the ec is strongly opposed to converting agricultural supports into tariffs	but the ec was strongly opposed to converting agricultural supports into tariffs
the show also signals mr. vila 's return as a television celebrity	the show also signaled mr. vila 's return as a television celebrity
public tv is in fantasy land he said	public tv was in fantasy land he said
his other agreements to promote products have expired	his other agreements to promote products had expired
as a result u.s. trust 's earnings have been hurt	as a result u.s. trust 's earnings had been hurt
mr. schwarz says the competition broadens the base of opportunity for us	mr. schwarz said the competition broadenned the base of opportunity for us
other firms are dealing with the masses	other firms were dealing with the masses
we will have a reasonably flat year this year mr. schwarz says	we had a reasonably flat year this year mr. schwarz said
it will include messrs. schwarz and maurer	it included messrs. schwarz and maurer
mr. padovan is currently a director at barclays de zoete wedd ltd	mr. padovan was currently a director at barclays de zoete wedd ltd
proceeds of the issue will be used for general government purposes	proceeds of the issue bed used for general government purposes
nearby six dolphins will frolic in a 1.5 million-gallon saltwater aquarium	nearby six dolphins frolicced in a 1.5 million-gallon saltwater aquarium
at the core of all this stands a hotel	at the core of all this stood a hotel
there 's a casino the financial heart of it all	there was a casino the financial heart of it all
las vegas has seen nothing quite like it before	las vegas had seen nothing quite like it before
smaller projects swell the figure to at least 2.5 billion	smaller projects swelled the figure to at least 2.5 billion
hotel-casino operators play down the possibility of a labor shortage	hotel-casino operators played down the possibility of a labor shortage
but nevada state labor economists think a shortage is probable	but nevada state labor economists thought a shortage was probable
the expansion will set off a marketing war among the big hotel-casinos	the expansion set off a marketing war among the big hotel-casinos
will the investments pay off	will the investments paid off
casino revenues and hotel occupancy rates are high	casino revenues and hotel occupancy rates were high
ellen cokely a tourist from alton ill. seems inclined to agree	ellen cokely a tourist from alton ill. seemed inclined to agree
now in the '90s we 're headed toward a total resort environment	now in the '90s we were headed toward a total resort environment
a serious economic downturn pessimists observe could hurt the expansionists	a serious economic downturn pessimists observed could hurt the expansionists
yet that has n't discouraged investors	yet that had n't discouraged investors
hotel expansion and an influx of more-discriminating tourists have hurt motels	hotel expansion and an influx of more-discriminating tourists had hurt motels
since 1979 the number of motel rooms has fallen by 17,000	since 1979 the number of motel rooms had fallen by 17,000
many people here expect a room-rate war as the new projects open	many people here expected a room-rate war as the new projects opened
the mirage will cost at least 1 million a day to operate	the mirage cost at least 1 million a day to operate
bally officials decline to discuss the situation	bally officials declined to discuss the situation
older properties that still have a 1950s image are also vulnerable	older properties that still had a 1950s image were also vulnerable
the company 's excalibur will also appeal to families of course	the company 's excalibur appealed to families of course also
some casino owners have resisted the temptation to add rooms	some casino owners had resisted the temptation to add rooms
some have been combined into suites for the high rollers	some had been combined into suites for the high rollers
but 93 % of tourists still come for gambling	but 93 % of tourists still came for gambling
office market weakens in overbuilt northeast	office market weakenned in overbuilt northeast
often developers stay on as property manager	often developers stayed on as property manager
beverly hills comes to suburban tokyo	beverly hills came to suburban tokyo
that 's more than 10 times the usual housing site size	that was more than 10 times the usual housing site size
housing developers try brand-name buildings	housing developers tryed brand-name buildings
so he 's using river in many project names	so he was using river in many project names
the leader in real estate brand names is developer ara hovnanian	the leader in real estate brand names was developer ara hovnanian
his entry-price condos are labeled society hill	his entry-price condos were labeled society hill
said the spokeswoman the whole structure has changed	said the spokeswoman the whole structure had changed
the value of the company has changed	the value of the company had changed
welcome to the 28th tokyo motor show	welcomed to the 28th tokyo motor show
mitsubishi has a futuristic delivery truck called the guppy	mitsubishi had a futuristic delivery truck called the guppy
its buglike carol minicar is designed with softness gentleness and warmheartedness	its buglike carol minicar was designed with softness gentleness and warmheartedness
the jokes are n't just on the japanese though	the jokes were n't just on the japanese though
hyundai motor co. of south korea has its first-ever exhibit in tokyo	hyundai motor co. of south korea had its first-ever exhibit in tokyo
even so traditional american cockiness is n't terribly endangered	even so traditional american cockiness was n't terribly endangered
mr. jordan of gm meanwhile still criticizes japanese styling	mr. jordan of gm meanwhile still criticized japanese styling
now it 's on the fence	now it was on the fence
the computer 's miscalculation has been painful for renaissance	the computer 's miscalculation had been painful for renaissance
our computer model has a certain trigger point he said	our computer model had a certain trigger point he said
when the computer says switch renaissance switches	when the computer said switched renaissance switched
those investors think sci tv needs new equity to survive	those investors thought sci tv needed new equity to survive
you stay out of it author whitford quotes mr. clements as saying	you stayed out of it author whitford quoted mr. clements as saying
the units are the edelmann ideal and plews divisions	the units were the edelmann ideal and plews divisions
motorola is fighting back against junk mail	motorola was fighting back against junk mail
it 's the overload problem and the weight problem we have	it was the overload problem and the weight problem we had
motorola is in good company	motorola was in good company
it smacks of big brotherism	it smacked of big brotherism
the practice is however legal in most cases	the practice was however legal in most cases
the junk-mail titans ever optimistic are looking for ways around the problem	the junk-mail titans ever optimistic were looking for ways around the problem
no wonder the competition 's green with envy the announcer says	no wonder the competition 's green with envy the announcer said
the drug is being used primarily to treat anemias	the drug was being used primarily to treat anemias
he was performing for pay and why should anyone expect anything more	he was performing for pay and why should anyone expected anything more
there is evidence to support that view	there was evidence to support that view
if there is no law against it do it	if there was no law against it did it
if the law leaves loopholes use them	if the law left loopholes used them
that is the key to the current national disease	that was the key to the current national disease
mr. carter is a political commentator who heads a television production firm	mr. carter was a political commentator who headed a television production firm
but for us in western europe these are europeans next door	but for us in western europe these were europeans next door
a reintegrated europe implies big changes in 40-year-old military and economic policies	a reintegrated europe implyed big changes in 40-year-old military and economic policies
but british analysts are beginning to link the issues	but british analysts were beginning to link the issues
the french analysis goes further	the french analysis went further
but they have n't yet drawn the operational policy conclusions	but they had n't yet drawn the operational policy conclusions
we certainly see an increasing trend toward that she added	we certainly saw an increasing trend toward that she added
it has always been so	it had always been so
to the rest of us the case is a puzzle	to the rest of us the case was a puzzle
it is what lawyers call fact intensive	it was what lawyers called fact intensive
to ask those questions is to answer them	to ask those questions was to answer them
mr. rezneck is a lawyer in washington d.c	mr. rezneck was a lawyer in washington d.c
this is not the case	this was not the case
some diaries simply are n't worth snooping in	some diaries simply were n't worth snooping in
the film makers have couched this offensive idea in pretty packaging	the film makers had couched this offensive idea in pretty packaging
i ask this not necessarily as a native ohioan	i asked this not necessarily as a native ohioan
lucy of course is pretty and smart though uneducated	lucy of course was pretty and smart though uneducated
everyone falls in love with everyone else	everyone fell in love with everyone else
but by comparison this fluffy comedy seems like a gem	but by comparison this fluffy comedy seemed like a gem
viroqua serves about 3,000 access lines in western wisconsin	viroqua served about 3,000 access lines in western wisconsin
the agreement is subject to certain conditions including obtaining financing	the agreement was subject to certain conditions including obtaining financing
he remains chairman but wields little power at the company	he remained chairman but wields little power at the company
quantum is sharon 's largest unsecured creditor	quantum was sharon 's largest unsecured creditor
in fact this is the best bargain available to someone traveling abroad	in fact this was the best bargain available to someone traveling abroad
he is president and chief executive officer of comerica inc. in detroit	he was president and chief executive officer of comerica inc. in detroit
it 's all part of a new command center	it was all part of a new command center
not everyone has jumped on the breeden bandwagon however	not everyone had jumped on the breeden bandwagon however
it was the plunge that did n't happen he says	it was the plunge that did n't happen he said
closely held automax has annual sales of about 10 million	closely held automax had annual sales of about 10 million
mr. kilpatrick will remain a director	mr. kilpatrick remained a director
the earnings-per-share figures reflect a 25 % stock dividend in june 1989	the earnings-per-share figures reflected a 25 % stock dividend in june 1989
the company is being acquired	the company was being acquired
both moves are effective today	both moves were effective today
health clubs gear up for a graying clientele	health clubs geared up for a graying clientele
older people help profits by filling in downtime	older people helped profits by filling in downtime
hot topaz sparks regulator jeweler concern over import of irradiated stones	hot topaz sparked regulator jeweler concern over import of irradiated stones
we believe that the vast majority of imported material is safe	we believed that the vast majority of imported material was safe
some jewelers have geiger counters to measure topaz radiation	some jewelers had geiger counters to measure topaz radiation
capital travels to europe as 1992 unification nears	capital traveled to europe as 1992 unification neared
continentals believe that the strongest growth area will be southern europe	continentals believed that the strongest growth area bed southern europe
favored ventures include media telecommunications and retailing	favored ventures included media telecommunications and retailing
learning aids lists films pamphlets brochures videos and other educational data	learning aids listed films pamphlets brochures videos and other educational data
the distributor is r.r. bowker new york	the distributor was r.r. bowker new york
radio malaise draws the ear of the federal communications commission	radio malaise drew the ear of the federal communications commission
am stereo remains largely undeveloped because it lacks a uniform delivery system	am stereo remained largely undeveloped because it lacked a uniform delivery system
after that it will make a final decision on the policy	after that it made a final decision on the policy
the stakes in the controversy are large	the stakes in the controversy were large
but says mr. bock it was a close call	but said mr. bock it was a close call
the predictions of doom are premature she says	the predictions of doom were premature she said
indeed institutions already are taking note	indeed institutions already were taking note
the damage is already done	the damage was already done
the highest-yielding funds are still above 9 %	the highest-yielding funds were still above 9 %
the fund invests heavily in dollar-denominated money-market securities overseas	the fund invested heavily in dollar-denominated money-market securities overseas
it is currently waiving management fees which contributes to the higher yield	it was currently waiving management fees which contributed to the higher yield
mr. merksamer is leading the buy-out	mr. merksamer was leading the buy-out
the merksamer bankruptcy-law filing appears to supersede that agreement	the merksamer bankruptcy-law filing appeared to supersede that agreement
they estimate the value of the transaction at close to 100 million	they estimated the value of the transaction at close to 100 million
most are anchored by a k mart store	most were anchored by a k mart store
the company is active in office and residential development in new york	the company was active in office and residential development in new york
k mart runs 2,200 k mart stores primarily in leased facilities	k mart ran 2,200 k mart stores primarily in leased facilities
this case realizes that concern	this case realized that concern
judges oakes and leval understand the requirements of historical scholarship	judges oakes and leval understood the requirements of historical scholarship
judges miner and altimari do not appear to have a clue	judges miner and altimari did not appear to have a clue
the bare-faced messiah decision strikes a blow against the whole historical enterprise	the bare-faced messiah decision struck a blow against the whole historical enterprise
no such statement appears on the tapes	no such statement appeared on the tapes
again no such statement appears on the tapes	again no such statement appeared on the tapes
we now know that the words were not always his own	we now knew that the words were not always his own
there is one sacred rule of journalism john hersey has said	there was one sacred rule of journalism john hersey had said
the historical profession will survive these decisions	the historical profession survived these decisions
perhaps in time the supreme court will correct them	perhaps in time the supreme court corrected them
mr. milgrim succeeds david berman who resigned last month	mr. milgrim succeeded david berman who resigned last month
there is no slow-motion close-up blood-and-guts portrayal of the animal 's demise	there was no slow-motion close-up blood-and-guts portrayal of the animal 's demise
ibm is based in armonk n.y	ibm was based in armonk n.y
there already are proposals pending in congress to overhaul pesticide law	there already were proposals pending in congress to overhaul pesticide law
in addition the principles attempt to eliminate the so-called delaney paradox	in addition the principles attempted to eliminate the so-called delaney paradox
among other changes the white house wants to	among other changes the white house wanted to
it has three u.s. branches	it had three u.s. branches
ohbayashi is japan 's second largest construction company	ohbayashi was japan 's second largest construction company
other democrats who favor a capital-gains cut are even more pessimistic	other democrats who favored a capital-gains cut were even more pessimistic
i 'm probably not going to vote for any capital-gains proposal	i was probably not going to vote for any capital-gains proposal
the ira portion of the packwood-roth plan is irresponsible	the ira portion of the packwood-roth plan was irresponsible
it 's unlikely extracting the gas will cause subsidence says a spokeswoman	it was unlikely extracting the gas caused subsidence said a spokeswoman
construction is set to begin in early 1991	construction was set to begin in early 1991
i transmitted my conversations to the white house prof. lee says	i transmitted my conversations to the white house prof. lee said
but he adds i was not acting as a messenger	but he added i was not acting as a messenger
bush and deng are hoping that cooler heads prevail	bush and deng were hoping that cooler heads prevailed
i do n't see this as a debt reduction exercise	i did n't see this as a debt reduction exercise
the minimum unit is 100,000	the minimum unit was 100,000
pittston seeks changes in health and pension benefits among other things	pittston seeked changes in health and pension benefits among other things
the measure is expected to move through this congress	the measure was expected to move through this congress
call it anecdotal if you will	called it anecdotal if you did
we do not depend on pharmaceutical companies for our support	we did not depend on pharmaceutical companies for our support
cnbc is available to 13 million cable households	cnbc was available to 13 million cable households
but i 'm going to proceed in a more logical way	but i was going to proceed in a more logical way
but that does n't mean i 'm not going to get angry	but that did n't mean i was not going to get angry
this time there are 30 % more shares outstanding	this time there were 30 % more shares outstanding
the executive branch bears the first responsibility for timidity	the executive branch bore the first responsibility for timidity
the pay 's the same and the duty 's lighter	the pay was the same and the duty 's lighter
witness the walsh prosecution of ollie north	witnessed the walsh prosecution of ollie north
