recruiter donald clark does note an increase in searches for minority candidates	recruiter donald clark did note an increase in searches for minority candidates
pay for performance hangs mostly on boss 's subjective view	pay for performance hung mostly on boss 's subjective view
many companies have set up machinery to assure workers a fair shake	many companies had set up machinery to assure workers a fair shake
japanese companies fare best in u.s. when they give americans more say	japanese companies fared best in u.s. when they gave americans more say
americans stay longer with japanese firms than american companies	americans stayed longer with japanese firms than american companies
but they think promotions are limited	but they thought promotions were limited
long-term care insurance gains favor	long-term care insurance gained favor
fear of aids hinders hiring at few hospitals	fear of aids hindered hiring at few hospitals
i can tell you that nobody quit over it	i could tell you that nobody quit over it
no one panicked a spokeswoman says	no one panicked a spokeswoman said
ibm 's push is also unusual in its approach to marketing	ibm 's push was also unusual in its approach to marketing
senators are focusing on making a capital-gains differential permanent	senators were focusing on making a capital-gains differential permanent
the current debt limit expires oct. 31	the current debt limit expired oct. 31
if one city is down the other can take over	if one city was down the other could take over
we are having a regular day	we were having a regular day
we are seeing such exercises today in fact	we were seeing such exercises today in fact
in congress lawmakers already are looking for ways to add relief funds	in congress lawmakers already were looking for ways to add relief funds
still some aid is moving westward from washington almost immediately	still some aid was moving westward from washington almost immediately
the agency plans to announce specific relief procedures in the coming days	the agency planned to announce specific relief procedures in the coming days
the account currently has 220 million	the account currently had 220 million
their machine tools are even bolted to the shop floor	their machine tools were even bolted to the shop floor
they then run remotely controlled self-diagnostic programs	they then ran remotely controlled self-diagnostic programs
already the 1982 legislation has saved an estimated 800 million	already the 1982 legislation had saved an estimated 800 million
that division 's manager has been fired	that division 's manager had been fired
i 'm happy and sad he said	i was happy and sad he said
the protesters point out that galileo also could crash to earth then	the protesters pointed out that galileo also could crash to earth then
the successful launch continues a remarkable recovery in the u.s. space-science program	the successful launch continued a remarkable recovery in the u.s. space-science program
not all of nasa 's space-science work will be so auspicious though	not all of nasa 's space-science work bed so auspicious though
the slack absorbs the pulling strain generated by an earthquake	the slack absorbed the pulling strain generated by an earthquake
officials expect difficulty routing traffic through downtown san francisco	officials expected difficulty routing traffic through downtown san francisco
mr. bandler puts traffic volume at 10 to 50 times normal	mr. bandler put traffic volume at 10 to 50 times normal
the construction industry is sure to feel increased demand	the construction industry was sure to feel increased demand
the money spent on repairs will be counted as a plus	the money spent on repairs bed counted as a plus
you certainly can say it 's going to be extremely severe	you certainly could say it 's going to be extremely severe
now we realize what our mothers must have gone through she says	now we realized what our mothers must have gone through she said
tendered shares not purchased will be returned to holders	tendered shares not purchased bed returned to holders
the berlin wall still stands	the berlin wall still stood
but the man who built it has fallen	but the man who built it had fallen
but u.s. officials have strong doubts that he is a reformer	but u.s. officials had strong doubts that he was a reformer
clearly the central figure in this process is egon krenz	clearly the central figure in this process was egon krenz
moreover both men have hewn to a similar hard-line philosophy	moreover both men had hewn to a similar hard-line philosophy
however mr. krenz also has a reputation for being politically savvy	however mr. krenz also had a reputation for being politically savvy
in recent days mr. krenz has sought to project a kinder image	in recent days mr. krenz had sought to project a kinder image
but will it be enough	but will it bed enough
west german government officials and western analysts are doubtful	west german government officials and western analysts were doubtful
but they are stalwart socialists	but they were stalwart socialists
one of their pastors has envisioned a new utopia of creative socialism	one of their pastors had envisioned a new utopia of creative socialism
a reflects 2-for-1 stock split effective dec. 30 1988	a reflected 2-for-1 stock split effective dec. 30 1988
the latest quarter includes a 42.7 million addition to loan-loss reserves	the latest quarter included a 42.7 million addition to loan-loss reserves
but how much will shoppers benefit	but how much will shoppers benefitted
soybean production swells 24 %	soybean production swelled 24 %
some couples continue to try	some couples continued to try
market moves these managers do n't	market moved these managers did n't
we 're on a tight budget says detroit edison 's carol roskind	we were on a tight budget said detroit edison 's carol roskind
new jersey bell awaits state clearance	new jersey bell awaited state clearance
christmas shoppers find a helping hand from some catalog companies	christmas shoppers found a helping hand from some catalog companies
j.p. morgan securities inc. is offering the remaining 10 million of notes	j.p. morgan securities inc. was offering the remaining 10 million of notes
the notes are rated mig-1 by moody 's investors service inc	the notes were rated mig-1 by moody 's investors service inc
standard & poor 's corp. has them under review	standard & poor 's corp. had them under review
the offering series 1989-83 is backed by fannie mae 9 % securities	the offering series 1989-83 was backed by fannie mae 9 % securities
the offering series 1989-84 is backed by fannie mae 9 % securities	the offering series 1989-84 was backed by fannie mae 9 % securities
all parts of the issue are callable at any time at par	all parts of the issue were callable at any time at par
continental airlines is a unit of texas air corp	continental airlines was a unit of texas air corp
but put her behind a shopping cart and she turns ruthless	but put her behind a shopping cart and she turned ruthless
never mind that her husband prefers crest	never minded that her husband prefered crest
but i do n't want any of that oil for my grandkids	but i did n't want any of that oil for my grandkids
clearly people like mrs. lombardi are giving marketers fits	clearly people like mrs. lombardi were giving marketers fits
about 47 % are loyal for one to five of the products	about 47 % were loyal for one to five of the products
he simply ca n't stomach the taste of heinz she says	he simply ca n't stomach the taste of heinz she said
loyalty lags most for utilitarian products like trash bags and batteries	loyalty lagged most for utilitarian products like trash bags and batteries
it 's sort of loyalty by default	it was sort of loyalty by default
they 're buying whatever 's cheaper	they were buying whatever was cheaper
mr. kim of j. walter thompson does n't think so	mr. kim of j. walter thompson did n't think so
rather they tend to have a set of two or three favorites	rather they tended to have a set of two or three favorites
advertisers attribute this shared loyalty to the striking similarity among brands	advertisers attributed this shared loyalty to the striking similarity among brands
but most companies are too afraid to take that chance	but most companies were too afraid to take that chance
consider for example what happened to maxwell house coffee	considered for example what happened to maxwell house coffee
the best odds are with your core franchise	the best odds were with your core franchise
some foodstuff shipments will probably resume thursday he said	some foodstuff shipments resumed thursday probably he said
but service on the line is expected to resume by noon today	but service on the line was expected to resume by noon today
the highway system is screwed up by the earthquake mr. engelken said	the highway system was screwed up by the earthquake mr. engelken said
the transit system is how people are going to be getting around	the transit system was how people were going to be getting around
we 're in the dark he said	we were in the dark he said
there 's no question it will make lbos more expensive he said	there was no question it made lbos more expensive he said
we view it as a good long-term investment the spokesman said	we viewed it as a good long-term investment the spokesman said
in the short term the move is likely to have little effect	in the short term the move was likely to have little effect
this is indeed what the market decided	this was indeed what the market decided
but this is not where the rewards of junk financing were found	but this was not where the rewards of junk financing were found
the consequences of building empires with sand are showing up	the consequences of building empires with sand were showing up
corporations need liquidity in the form of borrowed funds	corporations needed liquidity in the form of borrowed funds
these are long-term richter readings on american capitalism	these were long-term richter readings on american capitalism
the whole structure is extremely shaky	the whole structure was extremely shaky
but sophistication has its limits	but sophistication had its limits
under what weights will the federal deposit insurance corporation totter	under what weights will the federal deposit insurance corporation tottered
mr. cockburn is a columnist for the nation and la weekly	mr. cockburn was a columnist for the nation and la weekly
but these wide swings scare them to death	but these wide swings scared them to death
but friday did n't help things says mr. schaefer	but friday did n't help things said mr. schaefer
investors will develop thicker skins and their confidence will return he says	investors developped thicker skins and their confidence returned he said
it could be a long wait say some industry observers	it could be a long wait said some industry observers
i think this is a market that required some level of security	i thought this was a market that required some level of security
its securities have been dubbed bailout bonds by traders	its securities had been dubbed bailout bonds by traders
chemical securities inc. is acting as agent for the seller	chemical securities inc. was acting as agent for the seller
for one thing digital maynard mass. has sold fewer machines	for one thing digital maynard mass. had sold fewer machines
investors in b.a.t have been on a roller coaster	investors in b.a.t had been on a roller coaster
we are n't forced sellers	we were n't forced sellers
b.a.t has declined to identify the potential bidders	b.a.t had declined to identify the potential bidders
galveston-houston makes and markets products for the construction mining and energy industries	galveston-houston made and markets products for the construction mining and energy industries
and the egg producers have done a pretty good job	and the egg producers had done a pretty good job
part of the answer lies in the nature of the industry	part of the answer lied in the nature of the industry
such centrifugal egg breakers have been around since the 1890s	such centrifugal egg breakers had been around since the 1890s
mr. maynard claims this is a manageable problem	mr. maynard claimed this was a manageable problem
opponents do n't buy such arguments	opponents did n't buy such arguments
leading the assault against the egg king has been united egg producers	leading the assault against the egg king had been united egg producers
mr. maynard says the ruling pushed his company into bankruptcy court	mr. maynard said the ruling pushed his company into bankruptcy court
the dividend is payable dec. 15 to stock of record nov. 15	the dividend was payable dec. 15 to stock of record nov. 15
why they wonder should it belong to the ec	why they wondered should it belonged to the ec
turkey in any event is long past it	turkey in any event was long past it
now it is their fellow turks arriving as refugees from bulgaria	now it was their fellow turks arriving as refugees from bulgaria
small-business interests have lobbied against the so-called section 89 tax rules	small-business interests had lobbied against the so-called section 89 tax rules
randy delchamps retains his position as president	randy delchamps retained his position as president
the september figures are due to be released this week	the september figures were due to be released this week
it implies very dramatic growth he said	it implyed very dramatic growth he said
cracking the top 10 within three years will be difficult at best	cracking the top 10 within three years bed difficult at best
all operations have stopped he said	all operations had stopped he said
ac&r advertising is a unit of saatchi & saatchi co	ac&r advertising was a unit of saatchi & saatchi co
budget is set at 1.5 million	budget was set at 1.5 million
the offering will be dated oct. 31 and mature oct. 31	the offering bed dated oct. 31 and mature oct. 31
i do n't want to feel guilty representing my constituents	i did n't want to feel guilty representing my constituents
prince henri is the crown prince and hereditary grand duke of luxembourg	prince henri was the crown prince and hereditary grand duke of luxembourg
interest payments on the bonds will be payable semiannually	interest payments on the bonds bed payable semiannually
yet her intensity stops and starts with the music	yet her intensity stopped and starts with the music
yet they do n't disparage their audiences by disparaging their act	yet they did n't disparage their audiences by disparaging their act
on his off-hours he wears cardigan sweaters	on his off-hours he wore cardigan sweaters
he can live with little pleasures	he could live with little pleasures
mr. kloves has put together some priceless moments	mr. kloves had put together some priceless moments
housing and urban development 's budget is 17 billion	housing and urban development 's budget was 17 billion
if that takes money take it away from this discredited federal department	if that took money took it away from this discredited federal department
congress is unlikely to go even that far	congress was unlikely to go even that far
she says it 'd create 600 jobs and bring cleveland tourist revenue	she said it 'd create 600 jobs and bring cleveland tourist revenue
rival gangs have turned cities into combat zones	rival gangs had turned cities into combat zones
innocent bystanders often are the victims	innocent bystanders often were the victims
until then the billions hud spends on inner-city housing simply is wasted	until then the billions hud spent on inner-city housing simply was wasted
no doubt he believes the place can be salvaged	no doubt he believed the place could be salvaged
mellon has 36.6 million shares outstanding	mellon had 36.6 million shares outstanding
calisto tanzi odeon 's owner will retain his 23.34 % stake	calisto tanzi odeon 's owner retained his 23.34 % stake
beefeater alone is worth as much as 300 million analysts said	beefeater alone was worth as much as 300 million analysts said
allied-lyons while powerful in whiskey does n't own any major white-spirit brands	allied-lyons while powerful in whiskey did n't own any major white-spirit brands
but analysts estimate their trading profit at 30 million	but analysts estimated their trading profit at 30 million
he will retain the honorary title of non-executive chairman	he retained the honorary title of non-executive chairman
but an uninvited guest is expected to try to crash the party	but an uninvited guest was expected to try to crash the party
they 're deliberately trying to steal our thunder a digital executive complains	they were deliberately trying to steal our thunder a digital executive complained
ibm based in armonk n.y. has dominated the market for decades	ibm based in armonk n.y. had dominated the market for decades
digital is promising a new approach	digital was promising a new approach
and unlike ibm 's water-cooled mainframes it does n't need any plumbing	and unlike ibm 's water-cooled mainframes it did n't need any plumbing
the challengers will have a big price advantage	the challengers had a big price advantage
that 's about half the price of comparably equipped ibm mainframes	that was about half the price of comparably equipped ibm mainframes
tandem 's pricing is just as aggressive	tandem 's pricing was just as aggressive
the heightened competition will hit ibm at a difficult time	the heightened competition hit ibm at a difficult time
still no one expects ibm 's rivals to deliver a knockout	still no one expected ibm 's rivals to deliver a knockout
one such company is bankers trust co	one such company was bankers trust co
but mr. rose is still looking seriously at the 9000	but mr. rose was still looking seriously at the 9000
as that system grows larger computers may be needed	as that system grew larger computers may be needed
now they do n't have to he says	now they did n't have to he said
that 's going to cost ibm revenue	that was going to cost ibm revenue
digital 's new line has been a long time coming	digital 's new line had been a long time coming
ibm will face still more competition in coming months	ibm faced still more competition in coming months
our attitude is that the ranking is like miss america	our attitude was that the ranking was like miss america
once you 're miss america you 're always miss america	once you were miss america you were always miss america
atlanta mr. savageau sniffs has unrealistic pretensions to world-class status	atlanta mr. savageau sniffed had unrealistic pretensions to world-class status
mr. savageau says earthquake or not san francisco makes the list	mr. savageau said earthquake or not san francisco made the list
it 's like fighting your way out of a fog	it was like fighting your way out of a fog
you do n't know which way to punch	you did n't know which way to punch
poverty remains far more widespread among blacks than other americans	poverty remained far more widespread among blacks than other americans
in a bull market credit does not matter mr. devoe added	in a bull market credit did not matter mr. devoe added
things are beginning to settle down	things were beginning to settle down
the markets are returning to normalcy	the markets were returning to normalcy
the minimum unit is 100,000	the minimum unit was 100,000
ford has signaled it might acquire a majority interest later	ford had signaled it might acquire a majority interest later
it has never been done before but there 's always a first	it had never been done before but there was always a first
imperial cup has annual sales of approximately 75 million	imperial cup had annual sales of approximately 75 million
federal paper board sells paper and wood products	federal paper board sold paper and wood products
hanson is a london producer of consumer and other goods	hanson was a london producer of consumer and other goods
but usair might not want to help mr. steinhardt he adds	but usair might not want to help mr. steinhardt he added
he confers big trading commissions on wall street firms	he confered big trading commissions on wall street firms
analysts say usair has great promise	analysts said usair had great promise
she thinks traders should buy the stock if it tumbles to 35	she thought traders should buy the stock if it tumbles to 35
however mr. steinhardt says he 's comfortable holding usair as an investment	however mr. steinhardt said he was comfortable holding usair as an investment
does mr. steinhardt regret his incursion into the takeover-threat game	does mr. steinhardt regretted his incursion into the takeover-threat game
himont is 81%-owned by montedison s.p a. of milan italy	himont was 81%-owned by montedison s.p a. of milan italy
they currently have large orders for cargo planes	they currently had large orders for cargo planes
the press has been doing an excellent job	the press had been doing an excellent job
in the meantime the strategies will increase expenses	in the meantime the strategies increased expenses
amr has not been and is not for sale	amr had not been and is not for sale
norton makes sandpaper and other abrasives diamond tools specialty plastics and ceramics	norton made sandpaper and other abrasives diamond tools specialty plastics and ceramics
the series is scheduled to resume tuesday evening in san francisco	the series was scheduled to resume tuesday evening in san francisco
senate hears final arguments in impeachment trial of federal judge	senate heard final arguments in impeachment trial of federal judge
companies seeking to make insurers pay for pollution cleanup win court victory	companies seeking to make insurers paid for pollution cleanup won court victory
reinsurance is protection taken out by the insurance firms themselves	reinsurance was protection took out by the insurance firms themselves
it 's the proverbial flight to safety	it was the proverbial flight to safety
people are n't necessarily running scared mr. litvack said	people were n't necessarily running scared mr. litvack said
some funds are posting yields far higher than the average	some funds were posting yields far higher than the average
formerly president and treasurer mr. lang remains chief executive officer	formerly president and treasurer mr. lang remained chief executive officer
jack kemp wants to abolish it	jack kemp wanted to abolish it
the hud scandals will simply continue but under new mismanagement	the hud scandals continued but under new mismanagement simply
conference committees are breeding grounds for mischief	conference committees were breeding grounds for mischief
they are often closed to the public and no minutes are taken	they were often closed to the public and no minutes were taken
your sept. 25 criticism of credit-card foreign-exchange charges is unwarranted	your sept. 25 criticism of credit-card foreign-exchange charges was unwarranted
the other element includes consolidating bethforge 's press-forge operations	the other element included consolidating bethforge 's press-forge operations
the entire division employs about 850 workers	the entire division employed about 850 workers
the maker of specialty chemicals has about 5.9 million shares outstanding	the maker of specialty chemicals had about 5.9 million shares outstanding
tenneco credit is a unit of tenneco inc	tenneco credit was a unit of tenneco inc
the bank is a subsidiary of baltimore-based mnc financial inc	the bank was a subsidiary of baltimore-based mnc financial inc
they are expected to have an average life of 3.16 years	they were expected to have an average life of 3.16 years
management co. manages entertainers and produces markets and finances entertainment	management co. managed entertainers and produces markets and finances entertainment
some dealers say other traders were n't picking up their phones	some dealers said other traders were n't picking up their phones
it 's very worrying that these markets ca n't cope	it was very worrying that these markets ca n't cope
the switch to the london market during such turbulent times is significant	the switch to the london market during such turbulent times was significant
but it 's just one of those things that happened	but it was just one of those things that happened
these bugs do n't affect our schedule at all he said	these bugs did n't affect our schedule at all he said
these errata do not affect business programs he said	these errata did not affect business programs he said
you can do that but you 're taking a risk	you could do that but you were taking a risk
those companies are paying the price for taking the risk	those companies were paying the price for taking the risk
that 's four times as fast as the 386	that was four times as fast as the 386
i do n't know how much got through	i did n't know how much got through
nobody has any credible estimate	nobody had any credible estimate
i find it very difficult to say that	i found it very difficult to say that
they do n't even want to talk to you	they did n't even want to talk to you
qintex australia is a unit of qintex ltd	qintex australia was a unit of qintex ltd
qintex australia owes creditors around 1.2 billion	qintex australia owed creditors around 1.2 billion
unless of course it happens to be run by the rothschilds	unless of course it happenned to be run by the rothschilds
yet the rothschilds do n't deny an emotional element to the decision	yet the rothschilds did n't deny an emotional element to the decision
the family 's long absence is understandable	the family 's long absence was understandable
indeed the competition is n't greatly concerned	indeed the competition was n't greatly concerned
the return of the rothschilds is modest	the return of the rothschilds was modest
