we cruise toward another set of pilings	we cruised toward another set of pilings
details of the escrow agreement have n't been completed the companies said	details of the escrow agreement had n't been completed the companies said
the proposal values the company 's real estate operation at 2 billion	the proposal valued the company 's real estate operation at 2 billion
but the meat-processing machines he picked up are 50 years old	but the meat-processing machines he picked up were 50 years old
this employer embodies all that i find noble and admirable	this employer embodied all that i found noble and admirable
simpson is an auto parts maker	simpson was an auto parts maker
six-year-old pace based in aurora colo. operates 41 warehouse-club stores	six-year-old pace based in aurora colo. operated 41 warehouse-club stores
the offering will be dated oct. 31 and mature oct. 31	the offering bed dated oct. 31 and mature oct. 31
i 'm happy and sad he said	i was happy and sad he said
it is widely expected that they will	it was widely expected that they did
the crimes may appear small but the prices can be huge	the crimes may appear small but the prices could be huge
the rest as they say is history	the rest as they said was history
that is the state of japan 's computer industry	that was the state of japan 's computer industry
and in financial markets irrational behavior is sometimes translated into catastrophe	and in financial markets irrational behavior was sometimes translated into catastrophe
it does n't have to be a disaster	it did n't have to be a disaster
the result according to many analysts is higher prices and less innovation	the result according to many analysts was higher prices and less innovation
it invests primarily in tax-exempt municipal securities	it invested primarily in tax-exempt municipal securities
after all gold prices usually soar when inflation is high	after all gold prices usually soared when inflation was high
only it is safer and busier	only it was safer and busier
people like pa do exist of course	people like pa did exist of course
in the end i think david will be judged for being david	in the end i thought david bed judged for being david
but some think that 's being overly optimistic	but some thought that was being overly optimistic
yet if gold prices improve silver prices could rally sharply he says	yet if gold prices improved silver prices could rally sharply he said
it 's not a zero-sum game	it was not a zero-sum game
the repair shops are n't united however	the repair shops were n't united however
golf has become the latest diversion for travelers stuck at some airports	golf had become the latest diversion for travelers stuck at some airports
while the book amply justifies its subtitle the title itself is dubious	while the book amply justifies its subtitle the title itself was dubious
uncertainty dogs every aspect of their lives	uncertainty dogged every aspect of their lives
all you get is risk	all you got was risk
should n't they properly be called exit-load funds	should n't they properly bed called exit-load funds
surely the question is obvious	surely the question was obvious
then take the expected return and subtract one standard deviation	then took the expected return and subtract one standard deviation
it is in the western interest to see mr. gorbachev succeed	it was in the western interest to see mr. gorbachev succeeded
but it 's rare to see both functions in one case	but it was rare to see both functions in one case
we are determined to get good prices	we were determined to get good prices
we 're all a little greedy	we were all a little greedy
the practice is however legal in most cases	the practice was however legal in most cases
currently the company has about six million common shares outstanding	currently the company had about six million common shares outstanding
but some militant sci tv junk-holders say that 's not enough	but some militant sci tv junk-holders said that was not enough
however more money managers are reassured that profit is regaining importance	however more money managers were reassured that profit was regaining importance
his general-election campaign is almost reagan-like all muted pictures and comforting words	his general-election campaign was almost reagan-like all muted pictures and comforting words
compuserve provides about 20 % of both sales and earnings	compuserve provided about 20 % of both sales and earnings
for months the resistance has been defenseless against air attack	for months the resistance had been defenseless against air attack
and the successful son wishes his embarrassing siblings dead	and the successful son wished his embarrassing siblings dead
there has been a tremendous increase in mmi positions mr. selkin said	there had been a tremendous increase in mmi positions mr. selkin said
some can be bought off relatively cheaply	some could be bought off relatively cheaply
her son healthy and symptom-free currently takes no medication	her son healthy and symptom-free currently took no medication
food tobacco drugs and utilities are the classic examples	food tobacco drugs and utilities were the classic examples
sadly the cycle appears not as waves but as a downward spiral	sadly the cycle appeared not as waves but as a downward spiral
more recently property rates have increased	more recently property rates had increased
he is ogling the curtains rippling above the ventilation ducts	he was ogling the curtains rippling above the ventilation ducts
this interest in words goes beyond puns and playfulness however	this interest in words went beyond puns and playfulness however
ac&r advertising is a unit of saatchi & saatchi co	ac&r advertising was a unit of saatchi & saatchi co
if there 's somethin' strange in your neighborhood	if there was somethin' strange in your neighborhood
it is the stuff of dreams but also of traumas	it was the stuff of dreams but also of traumas
likewise no government will stop this idea of the afrikaners	likewise no government stopped this idea of the afrikaners
compare the bush request to what the senators gave themselves	compared the bush request to what the senators gave themselves
the company expects all branches to reopen today	the company expected all branches to reopen today
now it 's happening again	now it was happening again
the new rules will allow investors to buy foreign stocks directly	the new rules allowed investors to buy foreign stocks directly
