mandela considered the most prominent leader of the anc remains in prison	mandela considered the most prominent leader of the anc remained in prison
agip already has an oil stake in libya	agip already had an oil stake in libya
but to hong kong china is n't purely business	but to hong kong china was n't purely business
the newport beach operators also tend to indulge themselves privately	the newport beach operators also tended to indulge themselves privately
now he said a slowdown in economic activity has slackened demand	now he said a slowdown in economic activity had slackened demand
china 's land and labor offer inexpensive alternatives to local industry	china 's land and labor offered inexpensive alternatives to local industry
some wall street firms monitor for recordkeeping purposes	some wall street firms monitored for recordkeeping purposes
dr. blumenfeld says he 's satisfied that his problem has been resolved	dr. blumenfeld said he was satisfied that his problem had been resolved
mr. conway is no longer at the exchange	mr. conway was no longer at the exchange
he has been a bearings director since 1985	he had been a bearings director since 1985
it 's a tough thing when you ca n't	it was a tough thing when you ca n't
tvx owns five stations including wtxf a fox affiliate in philadelphia	tvx owned five stations including wtxf a fox affiliate in philadelphia
and apparently it is here to stay	and apparently it was here to stay
he says his son has n't paid for the shares	he said his son had n't paid for the shares
there 's no fire sale here	there was no fire sale here
state government is more typically split along republican-governor\/democratic-legislature lines than the reverse	state government was more typically split along republican-governor\/democratic-legislature lines than the reverse
the old crowd is deeply concerned by the backlash from all this	the old crowd was deeply concerned by the backlash from all this
but the apple industry is ripe for change	but the apple industry was ripe for change
but in 1989 most senators have other ideas	but in 1989 most senators had other ideas
the judge they say was fiercely proud of his abilities and accomplishments	the judge they said was fiercely proud of his abilities and accomplishments
some state middlemen come to buy from me	some state middlemen came to buy from me
the leveraged buy-out group of ge capital now reports to mr. carpenter	the leveraged buy-out group of ge capital now reported to mr. carpenter
shearson lehman however executes program trades for clients	shearson lehman however executed program trades for clients
americans place native or native speakers in charge of subsidiaries overseas	americans placed native or native speakers in charge of subsidiaries overseas
as for the women they 're pathetic	as for the women they were pathetic
despite their ubiquity the consultants are n't entirely welcome	despite their ubiquity the consultants were n't entirely welcome
i do n't see this as a debt reduction exercise	i did n't see this as a debt reduction exercise
just wait for that tap-tap that thump-thump	just waited for that tap-tap that thump-thump
probably the most clear-cut soviet violation for example is the krasnoyarsk radar	probably the most clear-cut soviet violation for example was the krasnoyarsk radar
ms. rose is best on the early years and world war ii	ms. rose was best on the early years and world war ii
they are growing more pragmatic about their role	they were growing more pragmatic about their role
i do n't want expensive machines	i did n't want expensive machines
ashland expects that sale to be complete next year	ashland expected that sale to be complete next year
if bluebloods wo n't pay high prices for racehorses anymore who will	if bluebloods wo n't pay high prices for racehorses anymore who did
under what weights will the federal deposit insurance corporation totter	under what weights will the federal deposit insurance corporation tottered
his new forecast calls for a soft landing	his new forecast called for a soft landing
precision castparts corp. portland ore. will begin trading with the symbol pcp	precision castparts corp. portland ore. began trading with the symbol pcp
the jokes are n't just on the japanese though	the jokes were n't just on the japanese though
on a stand-alone basis the network ought to make money he says	on a stand-alone basis the network ought to make money he said
to be sure the stock still has a lot of fans	to be sure the stock still had a lot of fans
we worry about her out there cynthia says	we worryed about her out there cynthia said
the fundamentals are pretty strong mr. dreman says	the fundamentals were pretty strong mr. dreman said
samuel hall howard university 's placement director also does n't see it	samuel hall howard university 's placement director also did n't see it
yet these purchases can be misleading	yet these purchases could be misleading
brockville is about 100 miles east of toronto	brockville was about 100 miles east of toronto
y&r 's klein steps down	y&r 's klein stepped down
but quite a few money managers are n't buying it	but quite a few money managers were n't buying it
congress is unlikely to go even that far	congress was unlikely to go even that far
he says blaming futures is like blaming the messenger	he said blaming futures was like blaming the messenger
such a proposal values jaguar at more than 1.6 billion 2.53 billion	such a proposal valued jaguar at more than 1.6 billion 2.53 billion
mail-order ministers have been squelched	mail-order ministers had been squelched
this is keeping the gold traders handcuffed	this was keeping the gold traders handcuffed
werner k. rey believes fortunes are made by being friendly	werner k. rey believed fortunes were made by being friendly
when it comes to money once bitten 2,000 times shy	when it came to money once bitten 2,000 times shy
the company also has a stock-repurchase plan	the company also had a stock-repurchase plan
it is the new journalism come to television	it was the new journalism come to television
a higher proportion of black men smoke than white men	a higher proportion of black men smoked than white men
he reset opening arguments for today	he resetted opening arguments for today
abuse to our bodies is overwhelming	abuse to our bodies was overwhelming
the emotional aspect is so draining they needed a good workout	the emotional aspect was so draining they needed a good workout
mr. cockburn is a columnist for the nation and la weekly	mr. cockburn was a columnist for the nation and la weekly
i happen to think it was right mr. bush said flatly	i happenned to think it was right mr. bush said flatly
it 's an overwhelming job she says	it was an overwhelming job she said
apple computer inc. has doubled its staff here over the past year	apple computer inc. had doubled its staff here over the past year
but the japanese have to go a long way to catch up	but the japanese had to go a long way to catch up
senator pete domenici calls this effort the first gift of democracy	senator pete domenici called this effort the first gift of democracy
no one panicked a spokeswoman says	no one panicked a spokeswoman said
sir richard succeeds john plastow who resigned in july	sir richard succeeded john plastow who resigned in july
please submit your offers says felipe bince jr	please submitted your offers said felipe bince jr
other major players in intimate apparel apparently feel the same way	other major players in intimate apparel apparently felt the same way
manville is a building and forest products concern	manville was a building and forest products concern
people in glass houses tend to look stoned	people in glass houses tended to look stoned
i have plenty more at home	i had plenty more at home
it 's the total relationship that is important	it was the total relationship that was important
no other computer vendor offers graphics performance that good for their price	no other computer vendor offered graphics performance that good for their price
coopers uses the coopers & lybrand name world-wide	coopers used the coopers & lybrand name world-wide
mr. sukle says he would n't dream of participating himself	mr. sukle said he would n't dream of participating himself
foreign traders say the company is strapped for cash	foreign traders said the company was strapped for cash
it is a quick fix for a complex problem	it was a quick fix for a complex problem
some in the industry are skeptical	some in the industry were skeptical
a two-hour lunch break follows	a two-hour lunch break followed
learning aids lists films pamphlets brochures videos and other educational data	learning aids listed films pamphlets brochures videos and other educational data
unfortunately the toxin is also poisonous	unfortunately the toxin was also poisonous
what 's happening here is n't justified by the fundamentals	what was happening here was n't justified by the fundamentals
it has three u.s. branches	it had three u.s. branches
but he thinks investors may be overreacting to the market 's problems	but he thought investors may be overreacting to the market 's problems
the u.s. contends that the rules are n't justified on health grounds	the u.s. contended that the rules were n't justified on health grounds
mrs. allen is a senior editor of insight magazine	mrs. allen was a senior editor of insight magazine
we are n't looking at anything like a doomsday scenario he says	we were n't looking at anything like a doomsday scenario he said
about 518 million of debt is affected	about 518 million of debt was affected
the notebook the ti model 12 will be priced at 4,199	the notebook the ti model 12 bed priced at 4,199
they are very visually sophisticated explains lsi graphics specialist robert seltzer	they were very visually sophisticated explained lsi graphics specialist robert seltzer
shrubs and flowers give it a pleasing and non-fortress-like appearance	shrubs and flowers gave it a pleasing and non-fortress-like appearance
but mr. simmons has long ties to both republicans and banking	but mr. simmons had long ties to both republicans and banking
the alternative giuliani is ghastly	the alternative giuliani was ghastly
mr. tait say he does n't blame lilly	mr. tait said he did n't blame lilly
the percentage change is since year-end	the percentage change was since year-end
that is typically about a three-week window	that was typically about a three-week window
making computers smaller often means sacrificing memory	making computers smaller often meant sacrificing memory
i do n't doubt it for a moment	i did n't doubt it for a moment
jeffrey peter and joseph jr. are brothers	jeffrey peter and joseph jr. were brothers
since then prices have slumped to an average of 395,374 this summer	since then prices had slumped to an average of 395,374 this summer
cairo 's spirited squalor also has gone gray	cairo 's spirited squalor also had gone gray
i do n't see this as a bear market at all	i did n't see this as a bear market at all
that division 's manager has been fired	that division 's manager had been fired
here they are searching for a higher price	here they were searching for a higher price
the company estimates its total debt at about 5.2 billion	the company estimated its total debt at about 5.2 billion
the interest-only securities will be sold separately by bt securities	the interest-only securities bed sold separately by bt securities
the states have their own ideas about regulation and certification	the states had their own ideas about regulation and certification
i do not by any means defend hud management	i did not by any means defend hud management
policy statement p-5-39 sets out terms	policy statement p-5-39 set out terms
bob stone is a fictional name but the incident described is real	bob stone was a fictional name but the incident described was real
you can be wicked but not foolish says mr. mankiewicz	you could be wicked but not foolish said mr. mankiewicz
in congress lawmakers already are looking for ways to add relief funds	in congress lawmakers already were looking for ways to add relief funds
but i 'm going to proceed in a more logical way	but i was going to proceed in a more logical way
california 's insurance commissioner does n't hold hearings on acquisition applications	california 's insurance commissioner did n't hold hearings on acquisition applications
the minimum unit is 100,000	the minimum unit was 100,000
obviously we are looking at making economies across the board	obviously we were looking at making economies across the board
no major player in the sci tv deal will talk publicly	no major player in the sci tv deal talked publicly
the centers normally are closed through the weekend	the centers normally were closed through the weekend
these people have different agendas	these people had different agendas
we 're settling down to a less active period	we were settling down to a less active period
yet that has n't discouraged investors	yet that had n't discouraged investors
and he questions the white house dedication	and he questioned the white house dedication
i do n't know what the risk is of holding the stock	i did n't know what the risk was of holding the stock
beyond that money managers and analysts see other problems	beyond that money managers and analysts saw other problems
passive components makes capacitors and filters used to protect electronics	passive components made capacitors and filters used to protect electronics
richard l. sherman 42 will advise midsized businesses	richard l. sherman 42 advised midsized businesses
both clarcor and anderson are based in rockford ill	both clarcor and anderson were based in rockford ill
mr. gale is an assistant professor of economics at ucla	mr. gale was an assistant professor of economics at ucla
in texas taxes and development costs are also lower they said	in texas taxes and development costs were also lower they said
the hall 's few computers are used mostly to send messages	the hall 's few computers were used mostly to send messages
where does that first stimulus go exclaims suny neurologist paul maccabee	where does that first stimulus went exclaimed suny neurologist paul maccabee
most recently a lack of buyers has been added to the list	most recently a lack of buyers had been added to the list
but that does n't mean i 'm not going to get angry	but that did n't mean i was not going to get angry
reform starts in the pentagon	reform started in the pentagon
but with some clients the talk can heat up a bit	but with some clients the talk could heat up a bit
it expects to be fully operational by next week	it expected to be fully operational by next week
cnbc will produce six one-hour programs beginning in april 1990	cnbc produced six one-hour programs beginning in april 1990
currently average pay for machinists is 13.39 an hour boeing said	currently average pay for machinists was 13.39 an hour boeing said
it is payable nov. 30 to units of record oct. 31	it was payable nov. 30 to units of record oct. 31
who ya gon na call	who ya gonned na call
the venture plans to announce a final site by late november	the venture planned to announce a final site by late november
fortunately the nations of southern africa have n't totally surrendered their sovereignty	fortunately the nations of southern africa had n't totally surrendered their sovereignty
texaco has purchased an oil-producing company in texas for 476.5 million	texaco had purchased an oil-producing company in texas for 476.5 million
malaysia 's high court is expected to approve the plan	malaysia 's high court was expected to approve the plan
it 's just not cost efficient he says	it was just not cost efficient he said
we do n't disclose specifics	we did n't disclose specifics
budget is set at 1.5 million	budget was set at 1.5 million
the solution is stronger domestic growth in germany he said	the solution was stronger domestic growth in germany he said
it makes only a handful of abortion-related decisions	it made only a handful of abortion-related decisions
sandwiched between desks underwriters sit on benches surrounded by stacks of policies	sandwiched between desks underwriters sat on benches surrounded by stacks of policies
a main motive is hard cash	a main motive was hard cash
as well reinsurers and insurance brokerage companies will have improved profits	as well reinsurers and insurance brokerage companies had improved profits
as a critique of middle-class mores the story is heavy-handed	as a critique of middle-class mores the story was heavy-handed
this time we do n't have that at all	this time we did n't have that at all
however stateswest is n't abandoning its pursuit of the much-larger mesa	however stateswest was n't abandoning its pursuit of the much-larger mesa
i 'm sure he still wants amr	i was sure he still wanted amr
concord is a camera and photographic products company	concord was a camera and photographic products company
the deal fell through and kandahar remains a major regime base	the deal fell through and kandahar remained a major regime base
but the japanese insist upon japanese managers everywhere they set up shop	but the japanese insisted upon japanese managers everywhere they set up shop
the completion of the merger agreement follows months of twists and turns	the completion of the merger agreement followed months of twists and turns
some dealers say other traders were n't picking up their phones	some dealers said other traders were n't picking up their phones
it 's going to get bloody	it was going to get bloody
it 's a bottom-line issue	it was a bottom-line issue
still the split is there	still the split was there
that 's the dilemma for today 's parent	that was the dilemma for today 's parent
he says he spent 300 million on his art business this year	he said he spent 300 million on his art business this year
his credentials are excellent for the task	his credentials were excellent for the task
while the theme is compelling the plot and characters are not	while the theme was compelling the plot and characters were not
but fujitsu ltd. has taken that practice to a new extreme	but fujitsu ltd. had taken that practice to a new extreme
there is a reality to the excess energy he said	there was a reality to the excess energy he said
it 's very worrying that these markets ca n't cope	it was very worrying that these markets ca n't cope
the percentage change is since year-end	the percentage change was since year-end
i 'm done in two minutes	i was done in two minutes
they now are experimenting with measuring blood flow	they now were experimenting with measuring blood flow
new jersey bell awaits state clearance	new jersey bell awaited state clearance
upgrades to bigger models also will be costlier	upgrades to bigger models also bed costlier
the transit system is how people are going to be getting around	the transit system was how people were going to be getting around
ge capital has a working relationship with l.j. hooker	ge capital had a working relationship with l.j. hooker
we 're not asking them to save up 50 proof-of-purchases	we were not asking them to save up 50 proof-of-purchases
we are a vanishing breed he muses	we were a vanishing breed he muses
he will concentrate on among others j.p. morgan and hyundai	he concentrated on among others j.p. morgan and hyundai
having only a republican measure makes the task harder	having only a republican measure made the task harder
it smacks of big brotherism	it smacked of big brotherism
mr. dozen succeeds sadakane doi who will become vice chairman	mr. dozen succeeded sadakane doi who became vice chairman
so the federal reserve is an attractive target for complaint by politicians	so the federal reserve was an attractive target for complaint by politicians
expect brushbacks but no beanballs says mr. mcenaney	expected brushbacks but no beanballs said mr. mcenaney
it has purchased about 19 million of them	it had purchased about 19 million of them
lawyers remain divided about whether anything is wrong with all this	lawyers remained divided about whether anything was wrong with all this
it 's just not true he says	it was just not true he said
yet they do n't disparage their audiences by disparaging their act	yet they did n't disparage their audiences by disparaging their act
the latest wave of marketing is instructive	the latest wave of marketing was instructive
california 's high-priced real estate puts it in an awkward position too	california 's high-priced real estate put it in an awkward position too
fortunately volunteers and charities are not motivated by self-interest but by altruism	fortunately volunteers and charities were not motivated by self-interest but by altruism
but he added you can only take one call at a time	but he added you could only take one call at a time
how can we turn this situation around	how can we turned this situation around
mr. freeman is an executive vice president of american express	mr. freeman was an executive vice president of american express
there is nothing wrong with the economy all the indices are up	there was nothing wrong with the economy all the indices were up
some bourbon makers advertise abroad as they do at home	some bourbon makers advertised abroad as they did at home
but conner is n't standing still	but conner was n't standing still
many brokerage house officials also are optimistic	many brokerage house officials also were optimistic
the report follows five-consecutive declines in full monthly figures	the report followed five-consecutive declines in full monthly figures
but we 're not going back to 1970	but we were not going back to 1970
it means we 're eating into the bread that keeps us going	it meant we were eating into the bread that kept us going
what that will mean for manufacturers is anybody 's guess	what that meant for manufacturers was anybody 's guess
estimated and actual results involving losses are omitted	estimated and actual results involving losses were omitted
pemex which produces 40 % of government revenue desperately needs new investment	pemex which produced 40 % of government revenue desperately needs new investment
mr. straszheim expects he will take some heat and he 's right	mr. straszheim expected he took some heat and he was right
many law firms sponsor their own programs	many law firms sponsored their own programs
william o'donnell president says he still thinks the ipo will succeed	william o'donnell president said he still thought the ipo succeeded
this hardly sounds like an anti-homosexual screed	this hardly sounded like an anti-homosexual screed
the value of the company has changed	the value of the company had changed
starting tomorrow i 'm stalking you	starting tomorrow i was stalking you
this is exactly the same thing as far as i 'm concerned	this was exactly the same thing as far as i was concerned
since 1987 40 states have increased the speed limit on rural interstates	since 1987 40 states had increased the speed limit on rural interstates
defining combat aircraft is even tougher	defining combat aircraft was even tougher
size does n't matter mr. peladeau says	size did n't matter mr. peladeau said
mr. dorgen has changed tactics dropping the seat-for-the-secretary idea	mr. dorgen had changed tactics dropping the seat-for-the-secretary idea
the khmer rouge however carry an unsurpassed record for cambodian tyranny	the khmer rouge however carryed an unsurpassed record for cambodian tyranny
tandem 's new high-end computer is called cyclone	tandem 's new high-end computer was called cyclone
manville itself does n't rule out a restructuring	manville itself did n't rule out a restructuring
more elderly maintain their independence	more elderly maintained their independence
chivas class is n't the first such promotion	chivas class was n't the first such promotion
the dutch utility firm serves the amsterdam and utrecht areas	the dutch utility firm served the amsterdam and utrecht areas
these days anything can happen	these days anything could happen
the yale political union does n't pay an honorarium to speakers	the yale political union did n't pay an honorarium to speakers
witness the walsh prosecution of ollie north	witnessed the walsh prosecution of ollie north
the expansion is subject to approval by federal and wisconsin environmental regulators	the expansion was subject to approval by federal and wisconsin environmental regulators
and some even do it with malice aforethought	and some even did it with malice aforethought
bond mutual funds offer diversification and are easy to buy and sell	bond mutual funds offered diversification and are easy to buy and sell
mr. lesko himself is n't yet prepared to accept that explanation	mr. lesko himself was n't yet prepared to accept that explanation
there are still bulls out there	there were still bulls out there
mr. locke teaches english and comparative literature at columbia university	mr. locke taught english and comparative literature at columbia university
second-tier companies are receiving even less per ton	second-tier companies were receiving even less per ton
the name of the game is to move goods	the name of the game was to move goods
it 's also a fast fix for an ailing image	it was also a fast fix for an ailing image
and black-and-white photography classes are crowded with students	and black-and-white photography classes were crowded with students
there is hope of change	there was hope of change
the most obvious pitch of course is the lure of big returns	the most obvious pitch of course was the lure of big returns
kidder officials stand by their aggressive use of program trading	kidder officials stood by their aggressive use of program trading
since tuesday the shares have gained nearly 4 %	since tuesday the shares had gained nearly 4 %
labor problems are the last thing mr. smith needs right now	labor problems were the last thing mr. smith needed right now
