otherwise actual profit is compared with the 300-day estimate	otherwise actual profit was compared with the 300-day estimate
oddly enough this presents a problem for the stock	oddly enough this presented a problem for the stock
union officials have taken a beating politically as a result	union officials had taken a beating politically as a result
but if you make a request you should support the committee	but if you made a request you should support the committee
it 's an attractive market with good growth opportunities he added	it was an attractive market with good growth opportunities he added
but this is almost an underground activity	but this was almost an underground activity
the average american watches seven hours of tv a day	the average american watched seven hours of tv a day
there is no slow-motion close-up blood-and-guts portrayal of the animal 's demise	there was no slow-motion close-up blood-and-guts portrayal of the animal 's demise
other fundamental reforms of the 1986 act have been threatened as well	other fundamental reforms of the 1986 act had been threatened as well
mr. ohmae is managing director of mckinsey & co. in japan	mr. ohmae was managing director of mckinsey & co. in japan
i am convinced that ufos exist because i have seen one	i was convinced that ufos existed because i had seen one
but most lawyers accept that the marketplace has spoken	but most lawyers accepted that the marketplace had spoken
it can happen in any industry	it could happen in any industry
but pemex managers are the ones most thrilled by the contract	but pemex managers were the ones most thrilled by the contract
the answer seems perfectly clear	the answer seemed perfectly clear
seats currently are quoted at 361,000 bid 395,000 asked	seats currently were quoted at 361,000 bid 395,000 asked
major european auction houses are turning increasingly to specialized sales	major european auction houses were turning increasingly to specialized sales
i 'm not sure what 's going to happen he said	i was not sure what was going to happen he said
chicago law firm recruits american express co. vice president	chicago law firm recruited american express co. vice president
we do n't want to bring back something the members will reject	we did n't want to bring back something the members rejected
mr. paul nods in agreement	mr. paul nodded in agreement
but the stock market swings have continued	but the stock market swings had continued
i think a lot of people got scared and stayed home	i thought a lot of people got scared and stayed home
more than 700 people work in the gte building	more than 700 people worked in the gte building
if there 's something weird and it do n't look good	if there was something weird and it did n't look good
the bank has been making adjustment loans for 10 years	the bank had been making adjustment loans for 10 years
labor problems top the list	labor problems topped the list
one of their pastors has envisioned a new utopia of creative socialism	one of their pastors had envisioned a new utopia of creative socialism
conference committees are breeding grounds for mischief	conference committees were breeding grounds for mischief
have the freedoms of glasnost gone to mr. ovcharenko 's head	have the freedoms of glasnost went to mr. ovcharenko 's head
some stock-index funds are huge	some stock-index funds were huge
but both the traders and the pilots remain interested in some transaction	but both the traders and the pilots remained interested in some transaction
ibm based in armonk n.y. has dominated the market for decades	ibm based in armonk n.y. had dominated the market for decades
now we 're at the bottom of the heap	now we were at the bottom of the heap
competitors are known as the enemy	competitors were known as the enemy
u.s. clearance also is needed for the proposed acquisition	u.s. clearance also was needed for the proposed acquisition
mr. mcdonough responds i 'm asking people to broaden their agendas	mr. mcdonough responded i was asking people to broaden their agendas
he adds this is n't 1987 revisited	he added this was n't 1987 revisitted
but he says cane & associates does n't receive referral fees	but he said cane & associates did n't receive referral fees
mr. carey will remain a member of the merchant bank 's board	mr. carey remained a member of the merchant bank 's board
now that 's name-dropping if you know what i mean	now that was name-dropping if you knew what i meant
evaluating asset-backed securities poses another problem	evaluating asset-backed securities posed another problem
we feel we are doing everything we can an occidental spokesman says	we felt we were doing everything we could an occidental spokesman said
they 're thrashing around for diversification he says	they were thrashing around for diversification he said
a bus is the data highway within a computer	a bus was the data highway within a computer
the bare-faced messiah decision strikes a blow against the whole historical enterprise	the bare-faced messiah decision struck a blow against the whole historical enterprise
the hulk of stalinism it seems will not quickly crumble away	the hulk of stalinism it seemed did not quickly crumble away
it does n't give any particular group the ability to veto change	it did n't give any particular group the ability to veto change
the other element includes consolidating bethforge 's press-forge operations	the other element included consolidating bethforge 's press-forge operations
merabank 's rating for short-term deposits remains not prime	merabank 's rating for short-term deposits remained not prime
i wonder when we 'll be able to relax	i wondered when we 'll be able to relax
i do n't feel either hard or soft	i did n't feel either hard or soft
but these wide swings scare them to death	but these wide swings scared them to death
penalty overhaul is still likely congressional sources say	penalty overhaul was still likely congressional sources said
of course that is n't really the case	of course that was n't really the case
japanese companies have long been accused of sacrificing profit to boost sales	japanese companies had long been accused of sacrificing profit to boost sales
such authority is more than adequate say opponents of the legislation	such authority was more than adequate said opponents of the legislation
take heart sports fans he wrote	took heart sports fans he wrote
what did we get out of it	what did we got out of it
the rest is listed on spanish stock exchanges	the rest was listed on spanish stock exchanges
total return is price changes plus interest income	total return was price changes plus interest income
goldman sachs & co. will manage the offering	goldman sachs & co. managed the offering
for now defense attorneys are tight-lipped about their plans	for now defense attorneys were tight-lipped about their plans
u.s. and british law firms announce rare joint venture in tokyo	u.s. and british law firms announced rare joint venture in tokyo
moreover both men have hewn to a similar hard-line philosophy	moreover both men had hewn to a similar hard-line philosophy
people hold out and try to get a bargain	people held out and try to get a bargain
but the rockefeller investment is its largest	but the rockefeller investment was its largest
the core rate is not really out of line	the core rate was not really out of line
companies will continue to war over standards	companies continued to war over standards
no we are not overreacting	no we were not overreacting
the 1989 act simply extends these guarantees to the private sector	the 1989 act simply extended these guarantees to the private sector
mr. vinson estimates the industry 's total revenues approach 200 million	mr. vinson estimated the industry 's total revenues approached 200 million
i just do n't understand it	i just did n't understand it
the industry is overbuilt he says	the industry was overbuilt he said
some have been training for months others only recently left active status	some had been training for months others only recently left active status
they are expected to have an average life of 3.16 years	they were expected to have an average life of 3.16 years
it is a feel-good candidacy	it was a feel-good candidacy
the companies being acquired provide telecommunications services to the telephone industry	the companies being acquired provided telecommunications services to the telephone industry
the transaction is expected to close by nov. 30	the transaction was expected to close by nov. 30
that perception takes the focus off the magazine	that perception took the focus off the magazine
syms operates 25 off-price apparel stores in the u.s.	syms operated 25 off-price apparel stores in the u.s.
the new pricing strategy is working the spokesman asserted	the new pricing strategy was working the spokesman asserted
both residents ' organizations admit to receiving some funding from abroad	both residents ' organizations admitted to receiving some funding from abroad
but if he 's sharp and quick he has a chance	but if he was sharp and quick he had a chance
both issues are dated oct. 31	both issues were dated oct. 31
most estimates for monsanto run between 1.70 and 2 a share	most estimates for monsanto ran between 1.70 and 2 a share
how can it make available funds for purchases	how can it made available funds for purchases
now many republicans are listening	now many republicans were listening
that means stocks bonds money market instruments and real estate	that meant stocks bonds money market instruments and real estate
i care very much for this post he says	i cared very much for this post he said
yes my prices are high	yes my prices were high
he 's a rare democratic hawk	he was a rare democratic hawk
working students she explains want some satisfaction	working students she explained wanted some satisfaction
i do n't like the sound of that	i did n't like the sound of that
we have no in-office business	we had no in-office business
only recently has it been attractively redesigned and its editorial product improved	only recently has it bed attractively redesigned and its editorial product improved
but he adds everybody and his sister have opened up m&a shops	but he added everybody and his sister had opened up m&a shops
now for example she owns 48 hats	now for example she owned 48 hats
mr. bates usually handles day-to-day ual trading on his own	mr. bates usually handled day-to-day ual trading on his own
favored ventures include media telecommunications and retailing	favored ventures included media telecommunications and retailing
for instance employment in denver will be reduced to 105 from 430	for instance employment in denver bed reduced to 105 from 430
texaco has also been attempting to sell oil properties	texaco had also been attempting to sell oil properties
mr. merksamer is leading the buy-out	mr. merksamer was leading the buy-out
the heart of the case official oppression remains intact	the heart of the case official oppression remained intact
mr. warren pronounces the litchfield case your typical demonic infestation	mr. warren pronounced the litchfield case your typical demonic infestation
and he says block 's other businesses are growing although less consistently	and he said block 's other businesses were growing although less consistently
term bonds due 2010 are 7.10 % securities priced at par	term bonds due 2010 were 7.10 % securities priced at par
the move is likely to anger traders	the move was likely to anger traders
judges miner and altimari do not appear to have a clue	judges miner and altimari did not appear to have a clue
newspapers including this one have generally ignored his news releases	newspapers including this one had generally ignored his news releases
venezuela will hold a debt-equity auction friday with 32 potential bidders participating	venezuela held a debt-equity auction friday with 32 potential bidders participating
it 's very much a growing concern	it was very much a growing concern
they then run remotely controlled self-diagnostic programs	they then ran remotely controlled self-diagnostic programs
that compares with 3.5 % butterfat for whole milk	that compared with 3.5 % butterfat for whole milk
she has lots of opinions	she had lots of opinions
it 's all part of a new command center	it was all part of a new command center
for vietnamese these are tricky often treacherous times	for vietnamese these were tricky often treacherous times
the government is projecting a 14 billion surplus for the fiscal year	the government was projecting a 14 billion surplus for the fiscal year
fundamental factors are at work as well	fundamental factors were at work as well
the anticipated drop follows a 3.9 % rise in august	the anticipated drop followed a 3.9 % rise in august
standard & poor 's corp. has them under review	standard & poor 's corp. had them under review
that amounts to more than 350 billion a year	that amounted to more than 350 billion a year
my back is still in knots and my hands are still shaking	my back was still in knots and my hands were still shaking
and they 've bought one	and they 'ved bought one
there 's no question it will make lbos more expensive he said	there was no question it made lbos more expensive he said
the biggest foreign inroads though have been made by bourbon	the biggest foreign inroads though had been made by bourbon
the stock has a 3.5 % dividend yield and goes ex-dividend today	the stock had a 3.5 % dividend yield and goes ex-dividend today
the beebes have not yet decided whether to appeal	the beebes had not yet decided whether to appeal
mr. carson has been charged with being anti-semitic	mr. carson had been charged with being anti-semitic
judges will write the real bill as suits roll through the courts	judges wrote the real bill as suits rolled through the courts
an s&p rating of double-a-plus has already been confirmed	an s&p rating of double-a-plus had already been confirmed
mr. bass is based in fort worth	mr. bass was based in fort worth
it 's too disruptive he says	it was too disruptive he said
the state will vigorously defend against any counterclaim	the state defended against any counterclaim vigorously
but the issue is stickier than it seems	but the issue was stickier than it seemed
santa cruz county estimates total damage at nearly 600 million	santa cruz county estimated total damage at nearly 600 million
that 's not fair they 're not all fat	that was not fair they were not all fat
our commitment to manage these businesses profitably will continue	our commitment to manage these businesses profitably continued
but there were supposed to be three mr. wathen 's company claims	but there were supposed to be three mr. wathen 's company claimed
so what does george bush really believe	so what does george bush really believed
most dealers can not continue to absorb this supply	most dealers could not continue to absorb this supply
the latest quarter 's loss equals 9.92 a share	the latest quarter 's loss equaled 9.92 a share
profit systems valley stream n.y. is an air freight forwarding concern	profit systems valley stream n.y. was an air freight forwarding concern
not quite sen. leahy contends	not quite sen. leahy contended
partly costs will be held down through strategic technology alliances management said	partly costs bed held down through strategic technology alliances management said
each rothschild bank is linked by family ties and cross-ownership	each rothschild bank was linked by family ties and cross-ownership
at the core of mr. loggia 's mancuso is his world-weary truculence	at the core of mr. loggia 's mancuso was his world-weary truculence
at least once an episode we see protestors marching around screaming slogans	at least once an episode we saw protestors marching around screaming slogans
the switch to the london market during such turbulent times is significant	the switch to the london market during such turbulent times was significant
and ship lines carrying containers are also trying to raise their rates	and ship lines carrying containers were also trying to raise their rates
we do n't have passive readers	we did n't have passive readers
as that system grows larger computers may be needed	as that system grew larger computers may be needed
montedison now owns about 72 % of erbamont 's shares outstanding	montedison now owned about 72 % of erbamont 's shares outstanding
the key man seems to be the campaign manager mr. lynch	the key man seemed to be the campaign manager mr. lynch
estimated and actual results involving losses are omitted	estimated and actual results involving losses were omitted
so what 's the best way to buy stocks	so what was the best way to buy stocks
crestmont is conducting a search for a chief executive	crestmont was conducting a search for a chief executive
he succeeds the retiring james w. wilcock	he succeeded the retiring james w. wilcock
but sometimes more energetic attacks are required	but sometimes more energetic attacks were required
this is only a further step in a lengthy investigation	this was only a further step in a lengthy investigation
battelle 's mr. mccall thinks steelmakers should concentrate more on construction	battelle 's mr. mccall thought steelmakers should concentrate more on construction
taxes are not going out of business	taxes were not going out of business
another contradictory message comes from businessland inc. a computer retailer	another contradictory message came from businessland inc. a computer retailer
mr. putka covers education from the wall street journal 's boston bureau	mr. putka covered education from the wall street journal 's boston bureau
it is also planning another night of original series	it was also planning another night of original series
their approach did n't work mine is	their approach did n't work mine was
and those who did n't move some production overseas suffer labor shortages	and those who did n't move some production overseas suffered labor shortages
the owners are trying to boost profit in other ways too	the owners were trying to boost profit in other ways too
every time he sees me he gets very nervous	every time he saw me he got very nervous
still its edge is lost	still its edge was lost
the good news is it 's not your fault	the good news was it 's not your fault
b.a.t has declined to identify the potential bidders	b.a.t had declined to identify the potential bidders
forget about treasury bills or a money-market fund	forgot about treasury bills or a money-market fund
it 's tabloid news from a to z	it was tabloid news from a to z
the books 1,500 entries include stepping on cracks and knocking on wood	the books 1,500 entries included stepping on cracks and knocking on wood
in japan about 1 % are linked	in japan about 1 % were linked
the index uses a base of 100 in 1982	the index used a base of 100 in 1982
all prices are as of monday 's close	all prices were as of monday 's close
the house appears reluctant to join the senators	the house appeared reluctant to join the senators
the metaphor of theater is not entirely coincidental	the metaphor of theater was not entirely coincidental
and they are a very odd team in any case	and they were a very odd team in any case
the agreement is subject to government approval	the agreement was subject to government approval
ms. rubin is a free-lance writer based in los angeles	ms. rubin was a free-lance writer based in los angeles
some plan to pursue foreign development ventures mostly in europe	some planned to pursue foreign development ventures mostly in europe
nuclear power plants are acceptable	nuclear power plants were acceptable
the ambitious warsaw project still awaits approval by city officials	the ambitious warsaw project still awaited approval by city officials
the sustainability of u.s. foreign policy is essential he explains	the sustainability of u.s. foreign policy was essential he explained
that 's good news because we all swim in this water	that was good news because we all swam in this water
the bridge normally carries 250,000 commuters a day	the bridge normally carryed 250,000 commuters a day
the current backlog of orders is strong throughout the corporation he said	the current backlog of orders was strong throughout the corporation he said
they are what they are	they were what they were
the estimate includes the results of new stores	the estimate included the results of new stores
it helps to keep out unions	it helped to keep out unions
and sooner or later we have to do something about it	and sooner or later we had to do something about it
this does n't mean they 're less likely to live alone however	this did n't mean they were less likely to live alone however
just say the offices are tastefully appointed he says	just said the offices were tastefully appointed he said
the obligation is totally unwarranted the statement said	the obligation was totally unwarranted the statement said
the earnings-per-share figures reflect a 25 % stock dividend in june 1989	the earnings-per-share figures reflected a 25 % stock dividend in june 1989
the three existing plants and their land will be sold	the three existing plants and their land bed sold
rising operating expenses are another problem	rising operating expenses were another problem
ibm 's push is also unusual in its approach to marketing	ibm 's push was also unusual in its approach to marketing
the oldest designer got to work on the dashboard she recalls	the oldest designer got to work on the dashboard she recalled
our expectation of confidentiality is being eroded	our expectation of confidentiality was being eroded
not so fast says rep. mickey edwards of oklahoma a fellow republican	not so fast said rep. mickey edwards of oklahoma a fellow republican
nobody has any credible estimate	nobody had any credible estimate
otherwise actual profit is compared with the 300-day estimate	otherwise actual profit was compared with the 300-day estimate
allied-lyons while powerful in whiskey does n't own any major white-spirit brands	allied-lyons while powerful in whiskey did n't own any major white-spirit brands
local pollution problems require cheap energy and capital for their solution	local pollution problems required cheap energy and capital for their solution
brawls between union factions still erupt at pemex installations	brawls between union factions still erupted at pemex installations
briggs screamed mr. windsor recalls	briggs screamed mr. windsor recalled
revco has 1.5 billion in claims outstanding	revco had 1.5 billion in claims outstanding
i do n't think we do now he says	i did n't think we did now he said
what you then do is you make them think inappropriately	what you then did was you made them thought inappropriately
it 's like kicking the tires of a car	it was like kicking the tires of a car
mr. strieber knows a lot about aliens	mr. strieber knew a lot about aliens
call it the uninformed trudging after the incomprehensible	called it the uninformed trudging after the incomprehensible
two years later mrs. aquino 's promise remains largely unfulfilled	two years later mrs. aquino 's promise remained largely unfulfilled
but in art-world parlance mr. paul 's holdings are burnt	but in art-world parlance mr. paul 's holdings were burnt
she manages it with the title of general-director	she managed it with the title of general-director
this is n't a technology issue but an attitude issue he says	this was n't a technology issue but an attitude issue he said
the computers will display stock prices selected by users	the computers displayed stock prices selected by users
the operating chief 's post is new	the operating chief 's post was new
what 's so discouraging is	what was so discouraging was
and the show 's creativity makes up for any technological deficiencies	and the show 's creativity made up for any technological deficiencies
sierra has been instrumental in securing a number of the california bans	sierra had been instrumental in securing a number of the california bans
it is fun competing as a private company mr. brawer says	it was fun competing as a private company mr. brawer said
justice is attempting to avoid a replay of these tactics	justice was attempting to avoid a replay of these tactics
i 'm not sure he 's explained everything mrs. stinnett says grudgingly	i was not sure he 's explained everything mrs. stinnett said grudgingly
telerate has rejected the offer which expires nov. 3	telerate had rejected the offer which expired nov. 3
august is a month when people are paying school tuition he said	august was a month when people were paying school tuition he said
if the show ai n't a killer they 're gone	if the show aied n't a killer they were gone
fear of aids hinders hiring at few hospitals	fear of aids hindered hiring at few hospitals
that way they can be home in time for work sunday	that way they could be home in time for work sunday
we have some level of financial interest in the collection	we had some level of financial interest in the collection
and for now at least the competition is n't the only enemy	and for now at least the competition was n't the only enemy
over the long run however sleazy cases will make bad law	over the long run however sleazy cases made bad law
we are having a regular day	we were having a regular day
on his off-hours he wears cardigan sweaters	on his off-hours he wore cardigan sweaters
it has not however made a formal proposal	it had not however made a formal proposal
a few drops in circulation are of no consequence	a few drops in circulation were of no consequence
they are coming to publishers looking for ideas	they were coming to publishers looking for ideas
by comparison republicans have held closer to the anti-abortion movement	by comparison republicans had held closer to the anti-abortion movement
as a result of the sales he holds 6,727,042 shares	as a result of the sales he held 6,727,042 shares
