why even 20 % of the republican vote is going to dinkins	why even 20 % of the republican vote was going to dinkins
these bacterial cousins ordinarily do n't make the toxin	these bacterial cousins ordinarily did n't make the toxin
they want to pretend it does n't exist he said	they wanted to pretend it did n't exist he said
tomorrow the treasury will sell 10 billion of two-year notes	tomorrow the treasury sold 10 billion of two-year notes
still some aid is moving westward from washington almost immediately	still some aid was moving westward from washington almost immediately
the total borrowing will be about 208 million the company said	the total borrowing bed about 208 million the company said
his approach to the recantation is direct but low-key	his approach to the recantation was direct but low-key
the second factor spurring mega-issues is political	the second factor spurring mega-issues was political
the hud scandals will simply continue but under new mismanagement	the hud scandals continued but under new mismanagement simply
seats are currently quoted at 425,000 bid and 475,000 offered	seats were currently quoted at 425,000 bid and 475,000 offered
now comes the pool flap	now came the pool flap
north carolinians new yorkers californians chicagoans and ohioans own texas banks	north carolinians new yorkers californians chicagoans and ohioans owned texas banks
you do n't have a right to practice	you did n't have a right to practice
her recent report classifies the stock as a hold	her recent report classified the stock as a hold
we do n't think this will affect that	we did n't think this affected that
my attitude is let 's come out of the closet	my attitude was let 's come out of the closet
but this time it 's hurting opposition as well as ruling-party members	but this time it was hurting opposition as well as ruling-party members
even perks have been reduced	even perks had been reduced
even drexel is pulling back	even drexel was pulling back
companies seeking to make insurers pay for pollution cleanup win court victory	companies seeking to make insurers paid for pollution cleanup won court victory
it 's become a day-by-day business he says	it was become a day-by-day business he said
the daily volume for treasury securities is about 110 billion	the daily volume for treasury securities was about 110 billion
much is being done in colombia to fight the drug cartel mafia	much was being done in colombia to fight the drug cartel mafia
now at least one japanese company is turning the courtroom tables	now at least one japanese company was turning the courtroom tables
the steelmaker employs about 16,000 people	the steelmaker employed about 16,000 people
opponents of the cut are playing hardball	opponents of the cut were playing hardball
community involvement is an even worse idea	community involvement was an even worse idea
to ask those questions is to answer them	to ask those questions was to answer them
copper has been stuck in a trading range of 1.19 to 1.34	copper had been stuck in a trading range of 1.19 to 1.34
the otc market has only a handful of takeover-related stocks	the otc market had only a handful of takeover-related stocks
he succeeds john a. boudreau who resigned for personal reasons	he succeeded john a. boudreau who resigned for personal reasons
the family 's long absence is understandable	the family 's long absence was understandable
productivity in japanese offices is relatively low	productivity in japanese offices was relatively low
they do n't want to get caught again says one industry watcher	they did n't want to get caught again said one industry watcher
mr. deaver has reopened a public-relations business	mr. deaver had reopened a public-relations business
advertisers are resisting higher prices which would help close the gap	advertisers were resisting higher prices which would help close the gap
even so traditional american cockiness is n't terribly endangered	even so traditional american cockiness was n't terribly endangered
this reduces the baseline by 229 billion	this reduced the baseline by 229 billion
healthcare operates many of the health-care properties that healthvest owns	healthcare operated many of the health-care properties that healthvest owned
wisconsin toy currently has about 4.7 million shares outstanding	wisconsin toy currently had about 4.7 million shares outstanding
the shares are redeemable after the end of 1994	the shares were redeemable after the end of 1994
china 's leaders have promised generous liberties for post-1997 hong kong	china 's leaders had promised generous liberties for post-1997 hong kong
and then there 's the case of the missing gold watch	and then there was the case of the missing gold watch
it was like a play on broadway recalls mr. martinez	it was like a play on broadway recalled mr. martinez
apparently they are learning to say no to excess risk	apparently they were learning to say no to excess risk
the other meals do n't matter	the other meals did n't matter
most of the evening though is filled with rare and welcome wit	most of the evening though was filled with rare and welcome wit
we view it as a good long-term investment the spokesman said	we viewed it as a good long-term investment the spokesman said
among her otc picks are oshkosh b'gosh and a&w brands	among her otc picks were oshkosh b'gosh and a&w brands
ira rules have been changed over the years	ira rules had been changed over the years
those include rhin et moselle vie and via assurances	those included rhin et moselle vie and via assurances
the suit seeks unspecified damages	the suit seeked unspecified damages
stateswest serves 10 cities in california arizona and nevada	stateswest served 10 cities in california arizona and nevada
the place costs nearly 2 million a year to maintain	the place cost nearly 2 million a year to maintain
silver however is in a deeper slump than are gold and platinum	silver however was in a deeper slump than were gold and platinum
the market changed he adds	the market changed he added
he expects citicorp to take a similar step this year	he expected citicorp to take a similar step this year
to maintain that dialogue is absolutely crucial	to maintain that dialogue was absolutely crucial
examples are ford looking at jaguar bellsouth looking at lin broadcasting	examples were ford looking at jaguar bellsouth looking at lin broadcasting
mr. volk 55 years old succeeds duncan dwight who retired in september	mr. volk 55 years old succeeded duncan dwight who retired in september
take your vacation in a hurricane area	took your vacation in a hurricane area
if i can show signs of maturity almost anybody can he jokes	if i could show signs of maturity almost anybody could he joked
that 's antithetical to the art of selling	that was antithetical to the art of selling
the french analysis goes further	the french analysis went further
all parts of the issue are callable at any time at par	all parts of the issue were callable at any time at par
the notes can be redeemed starting in july 1991	the notes could be redeemed starting in july 1991
he will retain the honorary title of non-executive chairman	he retained the honorary title of non-executive chairman
mr. nolan is a contributing editor at los angeles magazine	mr. nolan was a contributing editor at los angeles magazine
clients are all staying out of the market one merrill trader says	clients were all staying out of the market one merrill trader said
i expect all the companies to appeal he added	i expected all the companies to appeal he added
these groups constitute up to 10 % of its work force	these groups constituted up to 10 % of its work force
delivery is to begin in early 1991	delivery was to begin in early 1991
marshall 's ghost is satisfied for now but he 'll be back	marshall 's ghost was satisfied for now but he 'll be back
they 're getting some major wins she added	they were getting some major wins she added
the year-earlier results have been restated to reflect an accounting change	the year-earlier results had been restated to reflect an accounting change
but do n't do anything rash	but did n't do anything rash
the company is an independent refined-petroleum-products pipeline serving six western states	the company was an independent refined-petroleum-products pipeline serving six western states
for complex cases judges sometimes allow many more	for complex cases judges sometimes allowed many more
get rid of the dogs	got rid of the dogs
we keep wondering what mr. gates wanted to say	we kept wondering what mr. gates wanted to say
the investment is worth about 130 today	the investment was worth about 130 today
we ca n't do without their help says mrs. conradie	we ca n't do without their help said mrs. conradie
the remainder expect a downturn to begin sometime in	the remainder expected a downturn to begin sometime in
but while index options are convenient they have several disadvantages	but while index options were convenient they had several disadvantages
details and camden are essential florio	details and camden were essential florio
its return so far this year has been a credible 21.71 %	its return so far this year had been a credible 21.71 %
but some investors and consultants who have tried it are enthusiastic	but some investors and consultants who had tried it were enthusiastic
the republicans show no sign of relenting	the republicans showed no sign of relenting
the farmer barges into the naczelnik 's office	the farmer barged into the naczelnik 's office
there 's nothing on the other side	there was nothing on the other side
about 800 have crossed the picket lines and returned to work	about 800 had crossed the picket lines and returned to work
it just is n't done	it just was n't done
areas that are made of fill liquefy	areas that were made of fill liquefied
here are details of yesterday 's three-month and six-month bill auction	here were details of yesterday 's three-month and six-month bill auction
grain milk and meat come next	grain milk and meat came next
mr. roman appears custom-made for the american express job	mr. roman appeared custom-made for the american express job
the tribe is one of the poorest in the pacific northwest	the tribe was one of the poorest in the pacific northwest
the organization is scheduled to meet in vienna beginning nov. 25	the organization was scheduled to meet in vienna beginning nov. 25
pressed on the matter he is more specific	pressed on the matter he was more specific
the individual voter 's standing consequently will be enhanced through lower taxes	the individual voter 's standing consequently bed enhanced through lower taxes
the theory relies on three assumptions	the theory relyed on three assumptions
billing is included in a caller 's regular phone bill	billing was included in a caller 's regular phone bill
i 'm not looking for a runaway christmas at all he says	i was not looking for a runaway christmas at all he said
he is in warsaw to open a shop	he was in warsaw to open a shop
but my father meant it to mean real separation says the son	but my father meant it to mean real separation said the son
the california thrift has just announced a 226 million third-quarter loss	the california thrift had just announced a 226 million third-quarter loss
this time however some analysts think he could face a real battle	this time however some analysts thought he could face a real battle
citicorp and chase are attempting to put together a new lower bid	citicorp and chase were attempting to put together a new lower bid
i feel committed to the program of opening markets and expanding trade	i felt committed to the program of opening markets and expanding trade
analysts expect others to show a similar pattern	analysts expected others to show a similar pattern
china 's foreign trade has gone in cycles during the past decade	china 's foreign trade had gone in cycles during the past decade
ford faces an uphill fight for jaguar however	ford faced an uphill fight for jaguar however
we have to study their experience very well he says	we had to study their experience very well he said
i do n't know why barber never told anybody else	i did n't know why barber never told anybody else
the state can also bar drexel as an investment adviser	the state could also bar drexel as an investment adviser
imperial cup has annual sales of approximately 75 million	imperial cup had annual sales of approximately 75 million
some couples continue to try	some couples continued to try
every witness receives a formal subpoena rep. gonzalez told him	every witness received a formal subpoena rep. gonzalez told him
company expects to be fully operational by next week	company expected to be fully operational by next week
but many newspapers are facing similar comparisons	but many newspapers were facing similar comparisons
william coors is their uncle	william coors was their uncle
but the firm has never had a day like yesterday	but the firm had never had a day like yesterday
its contract expires dec. 1	its contract expired dec. 1
i do n't think their customers would like it very much	i did n't think their customers would like it very much
the bill is expected to pass in congress next month	the bill was expected to pass in congress next month
there are die-hard bodies of course	there were die-hard bodies of course
in some industries like pharmaceuticals acquisitions make sense	in some industries like pharmaceuticals acquisitions made sense
however for many managing speed does not come naturally	however for many managing speed did not come naturally
jury 's criminal conviction under superfund law is a first	jury 's criminal conviction under superfund law was a first
the independent-contractor project which began in 1988 involves about 350 irs agents	the independent-contractor project which began in 1988 involved about 350 irs agents
which celebrity endorsers are most believable	which celebrity endorsers were most believable
not even all the brokerage firms see clear sailing ahead	not even all the brokerage firms saw clear sailing ahead
amcore also a bank holding company has assets of 1.06 billion	amcore also a bank holding company had assets of 1.06 billion
why did he add the value fund to the list	why did he added the value fund to the list
at the same time it has been caught in an earnings squeeze	at the same time it had been caught in an earnings squeeze
here in south texas we say tie-vole-ee my host gently corrects	here in south texas we said tie-vole-ee my host gently corrected
norman j. harrison chairman will succeed him as chief executive	norman j. harrison chairman succeeded him as chief executive
the plan is talking about applicants admitted not students who enroll	the plan was talking about applicants admitted not students who enrolled
when will i get that check for a million dollars he jokes	when will i got that check for a million dollars he joked
sounds great or does it	sounded great or does it
other firms are dealing with the masses	other firms were dealing with the masses
wisely ms. bogart has kept gorky 's time and place intact	wisely ms. bogart had kept gorky 's time and place intact
some people think the search for liquidity is fruitless	some people thought the search for liquidity was fruitless
campeau has too much debt	campeau had too much debt
whitman & ransom recruits lawyers from disbanding firm	whitman & ransom recruited lawyers from disbanding firm
any fool can publish a money-losing magazine	any fool could publish a money-losing magazine
murray lawrence lloyd 's chairman agrees the exchange faces big challenges	murray lawrence lloyd 's chairman agreed the exchange faced big challenges
why they wonder should it belong to the ec	why they wondered should it belonged to the ec
portrait studios have also latched onto the trend	portrait studios had also latched onto the trend
tandy 's decision is a second setback for u.s. memories	tandy 's decision was a second setback for u.s. memories
and where we are is bad	and where we were was bad
to leave this decision to an independent agency is not only undemocratic	to leave this decision to an independent agency was not only undemocratic
when selling is so frenzied prices fall steeply and fast	when selling was so frenzied prices fell steeply and fast
maitre'd claims in suit that restaurant fired her because she was pregnant	maitre'd claimed in suit that restaurant fired her because she was pregnant
now they 're charging as little 3 a day	now they were charging as little 3 a day
i 'm using it a lot she says	i was using it a lot she said
you do n't know which way to punch	you did n't know which way to punch
the effort will make the peanuts gang very familiar pitchmen in 1990	the effort made the peanuts gang very familiar pitchmen in 1990
we 're very pleased with the new deal	we were very pleased with the new deal
then says dr. levy she woke up paralyzed	then said dr. levy she woke up paralyzed
bush administration officials say inflation is under control	bush administration officials said inflation was under control
do n't say it 's a gold ceiling	did n't say it was a gold ceiling
if mr. dozen has a weakness it may be his golf game	if mr. dozen had a weakness it may be his golf game
cbs is likely to spend whatever it takes to keep them	cbs was likely to spend whatever it took to keep them
study halls complete with reference materials will be available	study halls complete with reference materials bed available
but this is not where the rewards of junk financing were found	but this was not where the rewards of junk financing were found
he 's a genuine wheaties-box athlete gushes mr. jones	he was a genuine wheaties-box athlete gushed mr. jones
logic plays a minimal role here	logic played a minimal role here
on the big board crawford & co. atlanta cfd begins trading today	on the big board crawford & co. atlanta cfd began trading today
the minimum unit is 100,000	the minimum unit was 100,000
the irish-soviet aviation connection is alive and well here at shannon airport	the irish-soviet aviation connection was alive and well here at shannon airport
the press has been doing an excellent job	the press had been doing an excellent job
some economists and many japanese companies are puzzled by the warnings	some economists and many japanese companies were puzzled by the warnings
seats currently are quoted at 400,000 bid 425,000 asked	seats currently were quoted at 400,000 bid 425,000 asked
but in the end customers ' wishes are what will prevail	but in the end customers ' wishes were what prevailed
similarly the big board hopes to entice merrill lynch & co	similarly the big board hopped to entice merrill lynch & co
utilities management is a major commercial niche	utilities management was a major commercial niche
artists and draftsmen need harder leads	artists and draftsmen needed harder leads
it expects any impact on its business to be slight	it expected any impact on its business to be slight
it reduces the baseline by 169 billion	it reduced the baseline by 169 billion
viroqua serves about 3,000 access lines in western wisconsin	viroqua served about 3,000 access lines in western wisconsin
leading the assault against the egg king has been united egg producers	leading the assault against the egg king had been united egg producers
ibm will face still more competition in coming months	ibm faced still more competition in coming months
we continue to develop products faster than anyone else can	we continued to develop products faster than anyone else could
this article is adapted from one in the october american spectator	this article was adapted from one in the october american spectator
mr. pilson is an unlikely big spender	mr. pilson was an unlikely big spender
hospital regulation sparks kentucky feud	hospital regulation sparked kentucky feud
now stock prices seem to be in a general retreat	now stock prices seemed to be in a general retreat
the result is a new and huge appetite for programming	the result was a new and huge appetite for programming
also rather than increase supplies they reduce them and encourage hoarding	also rather than increased supplies they reduced them and encourage hoarding
this is the commercial version	this was the commercial version
judges oakes and leval understand the requirements of historical scholarship	judges oakes and leval understood the requirements of historical scholarship
suddenly the woman begins swaying and then writhing	suddenly the woman began swaying and then writhing
there was a unique combination in 1987 he says	there was a unique combination in 1987 he said
so far one test of restricting dual trading has worked well	so far one test of restricting dual trading had worked well
investors will develop thicker skins and their confidence will return he says	investors developped thicker skins and their confidence returned he said
a texas legislator proposes color-coding drivers ' licenses of some drug offenders	a texas legislator proposed color-coding drivers ' licenses of some drug offenders
we will vigorously oppose the bill he says	we vigorously oppose the bill he said
los angeles creates a courthouse for kids	los angeles created a courthouse for kids
mitsubishi has a futuristic delivery truck called the guppy	mitsubishi had a futuristic delivery truck called the guppy
digital is promising a new approach	digital was promising a new approach
that 's four times as fast as the 386	that was four times as fast as the 386
other retailers are also preparing for a ho-hum holiday	other retailers were also preparing for a ho-hum holiday
after cooling the coins are then rewrapped	after cooling the coins were then rewrapped
we are only going to sell at the right price	we were only going to sell at the right price
ashurst is new to the far east	ashurst was new to the far east
mr. rezneck is a lawyer in washington d.c	mr. rezneck was a lawyer in washington d.c
and he has attached himself to the lincoln story tenaciously	and he had attached himself to the lincoln story tenaciously
not everyone believes that the good times are over for shippers	not everyone believed that the good times were over for shippers
one apparent side effect is a minor increase in a brain hormone	one apparent side effect was a minor increase in a brain hormone
accounting problems raise more knotty issues	accounting problems raised more knotty issues
silicon graphics ' strategy seems to be paying off	silicon graphics ' strategy seemed to be paying off
entrepreneurs do n't rush to get into a stagnant or declining industry	entrepreneurs did n't rush to get into a stagnant or declining industry
bigger business can often better afford to minimize the cost of crime	bigger business could often better afford to minimize the cost of crime
i 've had no problems performing my duties and responsibilities	i 'ved had no problems performing my duties and responsibilities
he says he has never even dined with gangsters	he said he had never even dined with gangsters
the company is being acquired	the company was being acquired
social security and spending for poor people are exempted	social security and spending for poor people were exempted
you try to maintain your dignity under difficult circumstances	you tryed to maintain your dignity under difficult circumstances
the issue is backed by fannie mae 9 % securitiess	the issue was backed by fannie mae 9 % securitiess
in california this is the reality	in california this was the reality
lucy of course is pretty and smart though uneducated	lucy of course was pretty and smart though uneducated
mr. mccall will remain chairman	mr. mccall remained chairman
the orange workers speak sincerely	the orange workers spoke sincerely
sometimes traders lose sight of that he says	sometimes traders lost sight of that he said
it suggests that households accumulate wealth across a broad spectrum of assets	it suggested that households accumulated wealth across a broad spectrum of assets
this plays right into the hands of the advertising agencies	this played right into the hands of the advertising agencies
sometimes like now it 's gray	sometimes like now it was gray
people are fearful and sensitive	people were fearful and sensitive
it 's a nuisance tax on mergers	it was a nuisance tax on mergers
the early omens we admit scarcely suggest so wholesome an outcome	the early omens we admitted scarcely suggest so wholesome an outcome
advertisers attribute this shared loyalty to the striking similarity among brands	advertisers attributed this shared loyalty to the striking similarity among brands
other funds have recently sold weak junk bonds to raise cash	other funds had recently sold weak junk bonds to raise cash
you know who you are	you knew who you were
once they are in the building they stay	once they were in the building they stayed
mr. lang feels that time 's priorities changed	mr. lang felt that time 's priorities changed
analysts expect further jitters this week	analysts expected further jitters this week
other forms of red tape are more pervasive	other forms of red tape were more pervasive
the offering series 104 is backed by freddie mac 9 % securities	the offering series 104 was backed by freddie mac 9 % securities
this could be the first major bankruptcy-law proceeding for kkr he adds	this could be the first major bankruptcy-law proceeding for kkr he added
futures he says merely cut down on trading costs	futures he said merely cut down on trading costs
many fund managers have boosted their cash levels in recent weeks	many fund managers had boosted their cash levels in recent weeks
now television and radio evangelists are under scrutiny	now television and radio evangelists were under scrutiny
however mr. steinhardt says he 's comfortable holding usair as an investment	however mr. steinhardt said he was comfortable holding usair as an investment
but he adds i was not acting as a messenger	but he added i was not acting as a messenger
